Cites,Authors,Title,Year,Source,Publisher,ArticleURL,CitesURL,GSRank,QueryDate,Type,DOI,ISSN,CitationURL,Volume,Issue,StartPage,EndPage,ECC,CitesPerYear,CitesPerAuthor,AuthorCount,Age,Abstract,FullTextURL,RelatedURL
187,"NL Kanagy, C Szabo, ...","Vascular biology of hydrogen sulfide",2017,"American Journal of …","journals.physiology.org","https://journals.physiology.org/doi/abs/10.1152/ajpcell.00329.2016","https://scholar.google.com/scholar?cites=2153938030401358049&as_sdt=2005&sciodt=2007&hl=en",245,"2023-07-13 17:55:37","","10.1152/ajpcell.00329.2016","","",,,,,187,31.17,62,3,6,"… vessel density, angiogenic indices, and blood flow in CSE KO mice compared with WT mice … Administration of NaHS to high-fat-fed (HFD) ApoE KO mice not only reduces vascular Ο 2 − …","https://journals.physiology.org/doi/full/10.1152/ajpcell.00329.2016","https://scholar.google.com/scholar?q=related:4QhHAjpT5B0J:scholar.google.com/&scioq=%22vessel+density%22+%22hfd%22+%22mice%22&hl=en&as_sdt=2007&as_ylo=1900&as_yhi=2023"
11,"D Ma, Y Wang, G Zhou, Y Wang, X Li","the roles and mechanisms of glycoprotein 130 cytokines in the regulation of adipocyte biological function",2019,"Inflammation","Springer","https://link.springer.com/article/10.1007/s10753-019-00959-6","https://scholar.google.com/scholar?cites=4129243862408943408&as_sdt=2005&sciodt=2007&hl=en",246,"2023-07-13 17:55:37","","10.1007/s10753-019-00959-6","","",,,,,11,2.75,2,5,4,"… disorders when the mice were fed an HFD. Furthermore, in … VEGF production and vessel density in both subcutaneous … VEGF expression and vessel density might support angiogenesis …","","https://scholar.google.com/scholar?q=related:MNfYSWoFTjkJ:scholar.google.com/&scioq=%22vessel+density%22+%22hfd%22+%22mice%22&hl=en&as_sdt=2007&as_ylo=1900&as_yhi=2023"
12,"Y Chen, M Zhao, C Wang, H Wen, ...","Adipose vascular endothelial growth factor B is a major regulator of energy metabolism",2020,"Journal of …","joe.bioscientifica.com","https://joe.bioscientifica.com/view/journals/joe/244/3/JOE-19-0341.xml","https://scholar.google.com/scholar?cites=7144377161380652948&as_sdt=2005&sciodt=2007&hl=en",247,"2023-07-13 17:55:37","HTML","","","",,,,,12,4.00,2,5,3,"… Blood vessel density was decreased by 52.8% in gWAT (Fig. 2C and D) measured with … mice on HFD from week 3 to week 12 (n = 6). (K) Body temperature. (L) Triglyceride content. …","https://joe.bioscientifica.com/view/journals/joe/244/3/JOE-19-0341.xml","https://scholar.google.com/scholar?q=related:lOeB_SztJWMJ:scholar.google.com/&scioq=%22vessel+density%22+%22hfd%22+%22mice%22&hl=en&as_sdt=2007&as_ylo=1900&as_yhi=2023"
154,"N Sawada, A Jiang, F Takizawa, A Safdar, A Manika, ...","Endothelial PGC-1α mediates vascular dysfunction in diabetes",2014,"Cell metabolism","cell.com","https://www.cell.com/cell-metabolism/pdf/S1550-4131(14)00003-5.pdf","https://scholar.google.com/scholar?cites=7835407720745430948&as_sdt=2005&sciodt=2007&hl=en",248,"2023-07-13 17:55:37","PDF","","","",,,,,154,17.11,26,6,9,"… in ECs in vivo, mice were fed a high-fat diet (HFD) to induce … heart tissue of these diabetic mice, compared to control animals … Right, quantification of vessel density. (B) Schema of Tet-off …","https://www.cell.com/cell-metabolism/pdf/S1550-4131(14)00003-5.pdf","https://scholar.google.com/scholar?q=related:pG9i6c71vGwJ:scholar.google.com/&scioq=%22vessel+density%22+%22hfd%22+%22mice%22&hl=en&as_sdt=2007&as_ylo=1900&as_yhi=2023"
0,"H TANG, J LI, H ZOU","DU Yueshanyi, WANG Xian, ZHANG Guoming",2023,"Journal of Otolaryngology …","ebhyxbwk.njournal.sdu.edu.cn","http://ebhyxbwk.njournal.sdu.edu.cn/EN/article/advancedSearchResult.do","",249,"2023-07-13 17:55:37","HTML","","","",,,,,0,0.00,0,3,1,"… diet(HFD)on the sensitization of allergic rhinitis(AR)mice and … significantly correlated with superficial vessel density(SVD)SVD … changes in the macular area of iERM and vessel density. …","http://ebhyxbwk.njournal.sdu.edu.cn/EN/article/advancedSearchResult.do","https://scholar.google.com/scholar?q=related:XCXYDb1-JzoJ:scholar.google.com/&scioq=%22vessel+density%22+%22hfd%22+%22mice%22&hl=en&as_sdt=2007&as_ylo=1900&as_yhi=2023"
53,"R Dong, Y Gong, W Meng, M Yuan, H Zhu, M Ying, ...","The involvement of M2 macrophage polarization inhibition in fenretinide-mediated chemopreventive effects on colon cancer",2017,"Cancer letters","Elsevier","https://www.sciencedirect.com/science/article/pii/S0304383516307170","https://scholar.google.com/scholar?cites=13683250481203517697&as_sdt=2005&sciodt=2007&hl=en",250,"2023-07-13 17:55:37","HTML","","","",,,,,53,8.83,8,7,6,"… coli (APC min/+ ) transgenic mice, we demonstrated that the … -old APC min/+ mice were fed with a HFD (45% fat, Xietong … 6G and H, CD31 staining revealed that tumor vessel density …","https://www.sciencedirect.com/science/article/pii/S0304383516307170","https://scholar.google.com/scholar?q=related:ARnU0NCr5L0J:scholar.google.com/&scioq=%22vessel+density%22+%22hfd%22+%22mice%22&hl=en&as_sdt=2007&as_ylo=1900&as_yhi=2023"
175,"H Iwamoto, M Abe, Y Yang, D Cui, T Seki, M Nakamura, ...","Cancer lipid metabolism confers antiangiogenic drug resistance",2018,"Cell Metabolism","cell.com","https://www.cell.com/cell-metabolism/pdf/S1550-4131(18)30312-7.pdf","https://scholar.google.com/scholar?cites=12279837654587396509&as_sdt=2005&sciodt=2007&hl=en",251,"2023-07-13 17:55:37","PDF","","","",,,,,175,35.00,25,7,5,"… It was possible that HFD-induced … liver mice did not augment growth rates (Figure S3C). In another experiment, tumors were subcutaneously implanted in healthy mice and HFD-fed mice…","https://www.cell.com/cell-metabolism/pdf/S1550-4131(18)30312-7.pdf","https://scholar.google.com/scholar?q=related:ndElFUm_aqoJ:scholar.google.com/&scioq=%22vessel+density%22+%22hfd%22+%22mice%22&hl=en&as_sdt=2007&as_ylo=1900&as_yhi=2023"
0,"X Zhang, Y Duan, X Zhang, M Jiang, W Man, Y Zhang, ...","Adipsin alleviates cardiac microvascular injury in diabetic cardiomyopathy through Csk-dependent signaling mechanism",2023,"BMC medicine","Springer","https://link.springer.com/article/10.1186/s12916-023-02887-7","",252,"2023-07-13 17:55:37","HTML","10.1186/s12916-023-02887-7","","",,,,,0,0.00,0,7,1,"… Experimental diabetes was induced in mice with adipose … used to determine blood vessel density in heart. The blood … -enriched exosomes significantly ameliorated HFD/STZ-induced …","https://link.springer.com/article/10.1186/s12916-023-02887-7","https://scholar.google.com/scholar?q=related:CYswQFCfLR8J:scholar.google.com/&scioq=%22vessel+density%22+%22hfd%22+%22mice%22&hl=en&as_sdt=2007&as_ylo=1900&as_yhi=2023"
0,"A Kariagina, O Morozova, R Hoshyar, MD Aupperlee, ...","Interactions between benzophenone-3 and dietary fat in mammary tumorigenesis",2020,"","researchsquare.com","https://www.researchsquare.com/article/rs-59529/latest","",253,"2023-07-13 17:55:37","","","","",,,,,0,0.00,0,5,3,"… determination of blood vessel density, antigen retrieval was … Blood vessel density is expressed as the percentage of CD31… with mice fed LFD, pubertally-restricted HFD (HFD-LFD), and …","https://www.researchsquare.com/article/rs-59529/latest.pdf","https://scholar.google.com/scholar?q=related:xnQp4h0qo0UJ:scholar.google.com/&scioq=%22vessel+density%22+%22hfd%22+%22mice%22&hl=en&as_sdt=2007&as_ylo=1900&as_yhi=2023"
0,"T Regnault, K Vonnahme","Aspen/Snowmass Perinatal Biology Symposium:“Interconnecting Animal and Human Systems to Understand Life-Long Disease”",2016,"","nature.com","https://www.nature.com/articles/pr2016141","",254,"2023-07-13 17:55:37","HTML","","","",,,,,0,0.00,0,2,7,"… decrease vessel density in R213G mice (p <0.001). RVH was present in R213G mice at … (P <0.05) in HFD offspring when compared with control mice. The hypothalamus was sampled …","https://www.nature.com/articles/pr2016141","https://scholar.google.com/scholar?q=related:6TWd8uaQE4MJ:scholar.google.com/&scioq=%22vessel+density%22+%22hfd%22+%22mice%22&hl=en&as_sdt=2007&as_ylo=1900&as_yhi=2023"
40,"TM da Costa Daniele, PFC de Bruin, ...","Exercise effects on brain and behavior in healthy mice, Alzheimer's disease and Parkinson's disease model—A systematic review and meta-analysis",2020,"Behavioural brain …","Elsevier","https://www.sciencedirect.com/science/article/pii/S0166432819310022","https://scholar.google.com/scholar?cites=10943221013304154128&as_sdt=2005&sciodt=2007&hl=en",255,"2023-07-13 17:55:37","HTML","","","",,,,,40,13.33,13,3,3,"… This systematic review and meta-analysis examines how exercise modifies brain and behavior in healthy mice, … One study reported increased blood vessel density in the striatum [33]. …","https://www.sciencedirect.com/science/article/pii/S0166432819310022","https://scholar.google.com/scholar?q=related:EJiVLIgh3pcJ:scholar.google.com/&scioq=%22vessel+density%22+%22hfd%22+%22mice%22&hl=en&as_sdt=2007&as_ylo=1900&as_yhi=2023"
7,"V Wolf, Y Abdul, W Li, A Ergul","Impact of diabetes and ischemic stroke on the cerebrovasculature: A female perspective",2022,"Neurobiology of Disease","Elsevier","https://www.sciencedirect.com/science/article/pii/S0969996122000584","https://scholar.google.com/scholar?cites=7113439073482368078&as_sdt=2005&sciodt=2007&hl=en",256,"2023-07-13 17:55:37","HTML","","","",,,,,7,7.00,2,4,1,"… However, fewer native pial collaterals were observed in mice … Studies with the HFD/STZ model of diabetes suggested that … these differences but at least in the HFD/TZ model, same strain …","https://www.sciencedirect.com/science/article/pii/S0969996122000584","https://scholar.google.com/scholar?q=related:TuRMEiYDuGIJ:scholar.google.com/&scioq=%22vessel+density%22+%22hfd%22+%22mice%22&hl=en&as_sdt=2007&as_ylo=1900&as_yhi=2023"
45,"E Maquoi, G Vörös, P Carmeliet, ...","Role of Gas-6 in adipogenesis and nutritionally induced adipose tissue development in mice",2005,"… , and vascular biology","Am Heart Assoc","https://www.ahajournals.org/doi/abs/10.1161/01.atv.0000160611.68791.c6","https://scholar.google.com/scholar?cites=3793087447487438234&as_sdt=2005&sciodt=2007&hl=en",257,"2023-07-13 17:55:37","","10.1161/01.atv.0000160611.68791.c6","","",,,,,45,2.50,11,4,18,"… To determine the contribution of Gas-6 in the development of obesity, we investigated the impact of a HFD on Gas-6 −/− mice. In accordance with the expression profile observed in the …","https://www.ahajournals.org/doi/full/10.1161/01.atv.0000160611.68791.c6","https://scholar.google.com/scholar?q=related:ml171e_AozQJ:scholar.google.com/&scioq=%22vessel+density%22+%22hfd%22+%22mice%22&hl=en&as_sdt=2007&as_ylo=1900&as_yhi=2023"
67,"F Quondamatteo","Skin and diabetes mellitus: what do we know?",2014,"Cell and tissue research","Springer","https://link.springer.com/article/10.1007/s00441-013-1751-2","https://scholar.google.com/scholar?cites=10452400243059399068&as_sdt=2005&sciodt=2007&hl=en",258,"2023-07-13 17:55:37","","10.1007/s00441-013-1751-2","","",,,,,67,7.44,67,1,9,"… Several other phenotypic aspects of TSOD mice have been reported. At 12 weeks of age, … DM in TSOD mice does not progress to high levels of severity and these mice retain normal life …","https://search.proquest.com/openview/28e77fcee1f7ba1058342c7c505632b4/1.pdf?pq-origsite=gscholar&cbl=49301","https://scholar.google.com/scholar?q=related:nBnDUaRiDpEJ:scholar.google.com/&scioq=%22vessel+density%22+%22hfd%22+%22mice%22&hl=en&as_sdt=2007&as_ylo=1900&as_yhi=2023"
196,"D Lin, TH Chun, L Kang","Adipose extracellular matrix remodelling in obesity and insulin resistance",2016,"Biochemical pharmacology","Elsevier","https://www.sciencedirect.com/science/article/pii/S0006295216300788","https://scholar.google.com/scholar?cites=14084783508328948781&as_sdt=2005&sciodt=2007&hl=en",259,"2023-07-13 17:55:37","HTML","","","",,,,,196,28.00,65,3,7,"… Moreover, chronic treatment of HFD-fed obese mice with a PEGylated human recombinant … ), vascular endothelial cell markers, and decreased vessel density [103]. Overexpression of …","https://www.sciencedirect.com/science/article/pii/S0006295216300788","https://scholar.google.com/scholar?q=related:LSQ6-Pkzd8MJ:scholar.google.com/&scioq=%22vessel+density%22+%22hfd%22+%22mice%22&hl=en&as_sdt=2007&as_ylo=1900&as_yhi=2023"
56,"Y Wu, MJ Lee, Y Ido, SK Fried","High-fat diet-induced obesity regulates MMP3 to modulate depot-and sex-dependent adipose expansion in C57BL/6J mice",2017,"American Journal of …","journals.physiology.org","https://journals.physiology.org/doi/abs/10.1152/ajpendo.00128.2016","https://scholar.google.com/scholar?cites=7168544053365218892&as_sdt=2005&sciodt=2007&hl=en",260,"2023-07-13 17:55:37","","10.1152/ajpendo.00128.2016","","",,,,,56,9.33,14,4,6,"… that GON depots of young male mice challenged with a HFD have a higher capacity to … GON and ING in female mice fed HFD. We also found that the HFD led to increased numbers of …","https://journals.physiology.org/doi/prev/20161122-aop/pdf/10.1152/ajpendo.00128.2016","https://scholar.google.com/scholar?q=related:TJ6SAdbIe2MJ:scholar.google.com/&scioq=%22vessel+density%22+%22hfd%22+%22mice%22&hl=en&as_sdt=2007&as_ylo=1900&as_yhi=2023"
51,"E Kurki, J Shi, E Martonen, ...","Distinct effects of calorie restriction on adipose tissue cytokine and angiogenesis profiles in obese and lean mice",2012,"Nutrition & …","nutritionandmetabolism …","https://nutritionandmetabolism.biomedcentral.com/articles/10.1186/1743-7075-9-64","https://scholar.google.com/scholar?cites=15366781390075942770&as_sdt=2005&sciodt=2007&hl=en",261,"2023-07-13 17:55:37","HTML","10.1186/1743-7075-9-64","","",,,,,51,4.64,13,4,11,"… , in particular when CR is carried out by restricting intake of HFD. Further studies are thus … adipose tissue blood vessel density have been demonstrated in MMP-3 deficient mice kept on …","https://nutritionandmetabolism.biomedcentral.com/articles/10.1186/1743-7075-9-64","https://scholar.google.com/scholar?q=related:cleP8EHGQdUJ:scholar.google.com/&scioq=%22vessel+density%22+%22hfd%22+%22mice%22&hl=en&as_sdt=2007&as_ylo=1900&as_yhi=2023"
272,"Y Oike, M Akao, K Yasunaga, T Yamauchi, ...","Angiopoietin-related growth factor antagonizes obesity and insulin resistance",2005,"Nature medicine","nature.com","https://www.nature.com/articles/nm1214","https://scholar.google.com/scholar?cites=14856925381277804141&as_sdt=2005&sciodt=2007&hl=en",262,"2023-07-13 17:55:37","","","","",,,,,272,15.11,54,5,18,"… of capillary vessel density in the gastrocnemius muscle in TG and NTG female mice at 4 … muscle (d) in TG mice relative to that seen in NTG female and male mice at 4 months of age. …","https://www.academia.edu/download/52095408/nm121420170309-17983-1va39jz.pdf","https://scholar.google.com/scholar?q=related:bWaMPetmLs4J:scholar.google.com/&scioq=%22vessel+density%22+%22hfd%22+%22mice%22&hl=en&as_sdt=2007&as_ylo=1900&as_yhi=2023"
27,"L Dowsett, S Piper, A Slaviero, N Dufton, Z Wang, ...","Endothelial dimethylarginine dimethylaminohydrolase 1 is an important regulator of angiogenesis but does not regulate vascular reactivity or hemodynamic …",2015,"Circulation","Am Heart Assoc","https://www.ahajournals.org/doi/abs/10.1161/CIRCULATIONAHA.114.015064","https://scholar.google.com/scholar?cites=16072751516017384222&as_sdt=2005&sciodt=2007&hl=en",263,"2023-07-13 17:55:37","","10.1161/CIRCULATIONAHA.114.015064","","",,,,,27,3.38,5,6,8,"… area than control mice (P=0.05; n=4), which is reduced further after an HFD feeding (P=0.01… To mimic a physiological setting of angiogenesis, we explored the vessel density in growing …","https://www.ahajournals.org/doi/full/10.1161/circulationaha.114.015064","https://scholar.google.com/scholar?q=related:HltWw1jiDd8J:scholar.google.com/&scioq=%22vessel+density%22+%22hfd%22+%22mice%22&hl=en&as_sdt=2007&as_ylo=1900&as_yhi=2023"
40,"K Thomas, F Beyer, G Lewe, R Zhang, S Schindler, ...","Higher body mass index is linked to altered hypothalamic microstructure",2019,"Scientific reports","nature.com","https://www.nature.com/articles/s41598-019-53578-4","https://scholar.google.com/scholar?cites=606985862252445210&as_sdt=2005&sciodt=2007&hl=en",264,"2023-07-13 17:55:37","HTML","","","",,,,,40,10.00,7,6,4,"… underwent apoptosis as a consequence of the HFD 11 . Therefore, the observed diffusion … shown that HFD triggers hypothalamic angiopathy in mice with increased vessel density and …","https://www.nature.com/articles/s41598-019-53578-4","https://scholar.google.com/scholar?q=related:Gr49_2xybAgJ:scholar.google.com/&scioq=%22vessel+density%22+%22hfd%22+%22mice%22&hl=en&as_sdt=2007&as_ylo=1900&as_yhi=2023"
42,"IL Gomes-Santos, Z Amoozgar, AS Kumar, ...","Exercise Training Improves Tumor Control by Increasing CD8+ T-cell Infiltration via CXCR3 Signaling and Sensitizes Breast Cancer to Immune Checkpoint Blockade",2021,"Cancer immunology …","AACR","https://aacrjournals.org/cancerimmunolres/article-abstract/9/7/765/666149","https://scholar.google.com/scholar?cites=8566159862558305317&as_sdt=2005&sciodt=2007&hl=en",265,"2023-07-13 17:55:37","","","","",,,,,42,21.00,11,4,2,"… (8 weeks old) were subjected to an ad libitum high-fat diet (HFD; … We excluded mice that did not reach at least 75% of … A and B, Vessel density, indicated by fractional area (stained for …","https://aacrjournals.org/cancerimmunolres/article/9/7/765/666149","https://scholar.google.com/scholar?q=related:JSz_cAId4XYJ:scholar.google.com/&scioq=%22vessel+density%22+%22hfd%22+%22mice%22&hl=en&as_sdt=2007&as_ylo=1900&as_yhi=2023"
18,"GK Dhamrait, K Panchal, NJ Fleury, TN Abel, ...","Characterising nitric oxide-mediated metabolic benefits of low-dose ultraviolet radiation in the mouse: a focus on brown adipose tissue",2020,"Diabetologia","Springer","https://link.springer.com/article/10.1007/s00125-019-05022-5","https://scholar.google.com/scholar?cites=9472861417997740077&as_sdt=2005&sciodt=2007&hl=en",266,"2023-07-13 17:55:37","HTML","10.1007/s00125-019-05022-5","","",,,,,18,6.00,4,5,3,"… mice fed the HFD (group-housed). In Experiment 1, 4-week-old Ucp1 luciferase transgenic male mice … [29], while reduced lymphatic vessel density occurs in sun-damaged skin [30]. …","https://link.springer.com/article/10.1007/s00125-019-05022-5","https://scholar.google.com/scholar?q=related:LShCMkVddoMJ:scholar.google.com/&scioq=%22vessel+density%22+%22hfd%22+%22mice%22&hl=en&as_sdt=2007&as_ylo=1900&as_yhi=2023"
94,"PRB Dib, AC Quirino-Teixeira, LB Merij, ...","Innate immune receptors in platelets and platelet-leukocyte interactions",2020,"Journal of Leucocyte …","academic.oup.com","https://academic.oup.com/jleukbio/article-abstract/108/4/1157/6884360","https://scholar.google.com/scholar?cites=2865850590589811282&as_sdt=2005&sciodt=2007&hl=en",267,"2023-07-13 17:55:37","","","","",,,,,94,31.33,24,4,3,"… This platelet response leads to thrombocytopenia in mice as platelets become activated and … in vitro and participates in thrombosis in atherosclerotic mice 69 (see Section 5.1). …","https://academic.oup.com/jleukbio/article/108/4/1157/6884360","https://scholar.google.com/scholar?q=related:Uvpyn-2LxScJ:scholar.google.com/&scioq=%22vessel+density%22+%22hfd%22+%22mice%22&hl=en&as_sdt=2007&as_ylo=1900&as_yhi=2023"
8,"NS Pellegata, M Berriel Diaz, M Rohm, ...","Obesity and cancer—extracellular matrix, angiogenesis, and adrenergic signaling as unusual suspects linking the two diseases",2022,"Cancer and Metastasis …","Springer","https://link.springer.com/article/10.1007/s10555-022-10058-y","https://scholar.google.com/scholar?cites=8608334450041535587&as_sdt=2005&sciodt=2007&hl=en",268,"2023-07-13 17:55:37","HTML","10.1007/s10555-022-10058-y","","",,,,,8,8.00,2,4,1,"… tissue inflammation in obese mice [85]. … ) mice in comparison with lean wild-type mice. Notably, adipose tissue-specific overexpression of a constitutively active form of the HIF-1α in mice …","https://link.springer.com/article/10.1007/s10555-022-10058-y","https://scholar.google.com/scholar?q=related:Y7x7ypLydncJ:scholar.google.com/&scioq=%22vessel+density%22+%22hfd%22+%22mice%22&hl=en&as_sdt=2007&as_ylo=1900&as_yhi=2023"
116,"AY Lemoine, S Ledoux, E Larger","Adipose tissue angiogenesis in obesity",2013,"Thrombosis and …","thieme-connect.com","https://www.thieme-connect.com/products/ejournals/abstract/10.1160/TH13-01-0073","https://scholar.google.com/scholar?cites=5490771638614185992&as_sdt=2005&sciodt=2007&hl=en",269,"2023-07-13 17:55:37","","10.1160/TH13-01-0073","","",,,,,116,11.60,39,3,10,"… We made the reverse observation: vessel density was higher in visceral adipose … (HFD). Conversely, overexpression of VEGF-A specifically in adipose tissue of diet-induced obese mice …","https://www.thieme-connect.com/products/ejournals/pdf/10.1160/TH13-01-0073.pdf","https://scholar.google.com/scholar?q=related:CFhjxrYjM0wJ:scholar.google.com/&scioq=%22vessel+density%22+%22hfd%22+%22mice%22&hl=en&as_sdt=2007&as_ylo=1900&as_yhi=2023"
23,"J van Haare, ME Kooi, ...","Metformin and sulodexide restore cardiac microvascular perfusion capacity in diet-induced obese rats",2017,"Cardiovascular …","cardiab.biomedcentral.com","https://cardiab.biomedcentral.com/articles/10.1186/s12933-017-0525-7","https://scholar.google.com/scholar?cites=17052167454669765625&as_sdt=2005&sciodt=2007&hl=en",270,"2023-07-13 17:55:37","HTML","10.1186/s12933-017-0525-7","","",,,,,23,3.83,8,3,6,"… filling % multiplied by vessel density (number of … ) in mice that were fed a HFD for 6 weeks and received sulodexide in the last 2 weeks of the feeding period. In mice that were fed a HFD …","https://cardiab.biomedcentral.com/articles/10.1186/s12933-017-0525-7","https://scholar.google.com/scholar?q=related:-XsRKvR3pewJ:scholar.google.com/&scioq=%22vessel+density%22+%22hfd%22+%22mice%22&hl=en&as_sdt=2007&as_ylo=1900&as_yhi=2023"
55,"JG Wallace, CJ Bellissimo, E Yeo, Y Fei Xia, JJ Petrik, ...","Obesity during pregnancy results in maternal intestinal inflammation, placental hypoxia, and alters fetal glucose metabolism at mid-gestation",2019,"Scientific reports","nature.com","https://www.nature.com/articles/s41598-019-54098-x","https://scholar.google.com/scholar?cites=7700039499384520980&as_sdt=2005&sciodt=2007&hl=en",271,"2023-07-13 17:55:37","HTML","","","",,,,,55,13.75,9,6,4,"… mice fed a control (17% kcal fat, n = 7) or a high-fat diet (HFD … Consistent with our previous data in pregnant mice at E18.5, … Indeed, others have reported decreased vessel density in the …","https://www.nature.com/articles/s41598-019-54098-x","https://scholar.google.com/scholar?q=related:FIFKzSAJ3GoJ:scholar.google.com/&scioq=%22vessel+density%22+%22hfd%22+%22mice%22&hl=en&as_sdt=2007&as_ylo=1900&as_yhi=2023"
41,"J Epah, K Pálfi, FL Dienst, PF Malacarne, R Bremer, ...","3D imaging and quantitative analysis of vascular networks: a comparison of ultramicroscopy and micro-computed tomography",2018,"Theranostics","ncbi.nlm.nih.gov","https://www.ncbi.nlm.nih.gov/pmc/articles/PMC5928875/","https://scholar.google.com/scholar?cites=15673601309519001164&as_sdt=2005&sciodt=2007&hl=en",272,"2023-07-13 17:55:37","HTML","","","",,,,,41,8.20,7,6,5,"… cell vessel formation in mice was quantified. Fluorescently … Interestingly, mean vessel diameter and vessel density were … partial ligation of the LCCA and HFD. Side-dependent vascular …","https://www.ncbi.nlm.nih.gov/pmc/articles/PMC5928875/","https://scholar.google.com/scholar?q=related:TDb6RFnRg9kJ:scholar.google.com/&scioq=%22vessel+density%22+%22hfd%22+%22mice%22&hl=en&as_sdt=2007&as_ylo=1900&as_yhi=2023"
100,"L Qin, D Zhao, J Xu, X Ren, ...","The vascular permeabilizing factors histamine and serotonin induce angiogenesis through TR3/Nur77 and subsequently truncate it through thrombospondin-1",2013,"Blood, The Journal …","ashpublications.org","https://ashpublications.org/blood/article-abstract/121/11/2154/31084","https://scholar.google.com/scholar?cites=5130900805917907859&as_sdt=2005&sciodt=2007&hl=en",273,"2023-07-13 17:55:37","","","","",,,,,100,10.00,20,5,10,"… Nude, C57Bl/6 wild-type and Nur77 −/− mice were implanted … (A) Female, 4-to 5-week Nu/Nu mice were implanted … Mean vessel density was calculated with Image J software …","https://www.sciencedirect.com/science/article/pii/S0006497120474907","https://scholar.google.com/scholar?q=related:k5uAKhmfNEcJ:scholar.google.com/&scioq=%22vessel+density%22+%22hfd%22+%22mice%22&hl=en&as_sdt=2007&as_ylo=1900&as_yhi=2023"
19,"M Aoki, T Murase","Obesity-associated insulin resistance adversely affects skin function",2019,"PLoS One","journals.plos.org","https://journals.plos.org/plosone/article?id=10.1371/journal.pone.0223528","https://scholar.google.com/scholar?cites=12154253904912827445&as_sdt=2005&sciodt=2007&hl=en",274,"2023-07-13 17:55:37","HTML","","","",,,,,19,4.75,10,2,4,"… Compared with mice fed the control diet, mice fed the HFD for … Moreover, compared with the control group, HFD-fed mice … differences in the skin from mice fed control or HFD (Fig 1C). …","https://journals.plos.org/plosone/article?id=10.1371/journal.pone.0223528","https://scholar.google.com/scholar?q=related:NcQ70IeVrKgJ:scholar.google.com/&scioq=%22vessel+density%22+%22hfd%22+%22mice%22&hl=en&as_sdt=2007&as_ylo=1900&as_yhi=2023"
