Cites,Authors,Title,Year,Source,Publisher,ArticleURL,CitesURL,GSRank,QueryDate,Type,DOI,ISSN,CitationURL,Volume,Issue,StartPage,EndPage,ECC,CitesPerYear,CitesPerAuthor,AuthorCount,Age,Abstract,FullTextURL,RelatedURL
0,"C Cohen","Characterising the Cellular and Molecular Landscape of the Murine Diabetic Heart",2022,"","scholar.archive.org","https://scholar.archive.org/work/jyjuwiptibfx3c2lcvxzfwn77u/access/wayback/https://ltu-figshare-repo.s3.aarnet.edu.au/ltu-figshare-repo/35457218/Thesis.pdf?AWSAccessKeyId=RADjuIEnIStOwNiA&Expires=1654762142&Signature=CR2jHX2SzL43w6mpVf2rO6ws2vI%3D","",401,"2023-07-13 17:55:37","PDF","","","",,,,,0,0.00,0,1,1,"… in a separate cohort of T2D mice. Cardiac function was also … Moreover, mice receiving high-fat diet (HFD) display … In addition, mice administered STZ and HFD concomitantly, also …","https://scholar.archive.org/work/jyjuwiptibfx3c2lcvxzfwn77u/access/wayback/https://ltu-figshare-repo.s3.aarnet.edu.au/ltu-figshare-repo/35457218/Thesis.pdf?AWSAccessKeyId=RADjuIEnIStOwNiA&Expires=1654762142&Signature=CR2jHX2SzL43w6mpVf2rO6ws2vI%3D","https://scholar.google.com/scholar?q=related:Idp_YsCFYigJ:scholar.google.com/&scioq=%22vessel+density%22+%22hfd%22+%22mice%22&hl=en&as_sdt=2007&as_ylo=1900&as_yhi=2023"
35,"DM Ornitz, N Itoh","New developments in the biology of fibroblast growth factors",2022,"WIREs mechanisms of disease","Wiley Online Library","https://wires.onlinelibrary.wiley.com/doi/abs/10.1002/wsbm.1549","https://scholar.google.com/scholar?cites=796702009177749644&as_sdt=2005&sciodt=2007&hl=en",402,"2023-07-13 17:55:37","","10.1002/wsbm.1549","","",,,,,35,35.00,18,2,1,"… in mice that conditionally lack one copy of Ext1 in adipocytes. Adipocytes in these mice had … in tumors reduced proliferation and blood vessel density and the local expression of FGF2 …","https://wires.onlinelibrary.wiley.com/doi/pdfdirect/10.1002/wsbm.1549","https://scholar.google.com/scholar?q=related:jDjhmEF0DgsJ:scholar.google.com/&scioq=%22vessel+density%22+%22hfd%22+%22mice%22&hl=en&as_sdt=2007&as_ylo=1900&as_yhi=2023"
0,"A Oakie","The role of c-Kit and insulin receptor tyrosine kinases in beta cell function and insulin secretion",2019,"","search.proquest.com","https://search.proquest.com/openview/f499fb307cd4c20a6460d8a13ca8e36a/1?pq-origsite=gscholar&cbl=18750&diss=y","",403,"2023-07-13 17:55:37","HTML","","","",,,,,0,0.00,0,1,4,"… that c-KitβTg mice developed impaired insulin … mice on HFD developed glucose intolerance due to reduced insulin secretion and SNARE expression. Islets from MIP-βIRKO HFD mice …","https://search.proquest.com/openview/f499fb307cd4c20a6460d8a13ca8e36a/1?pq-origsite=gscholar&cbl=18750&diss=y","https://scholar.google.com/scholar?q=related:gnWewjcvVVgJ:scholar.google.com/&scioq=%22vessel+density%22+%22hfd%22+%22mice%22&hl=en&as_sdt=2007&as_ylo=1900&as_yhi=2023"
0,"O Senol-Cosar","A Role for TNMD in Adipocyte Differentiation and Adipose Tissue Function: A Dissertation",2016,"","repository.escholarship.umassmed …","https://repository.escholarship.umassmed.edu/handle/20.500.14038/32209","",404,"2023-07-13 17:55:37","","","","",,,,,0,0.00,0,1,7,"… eWAT depots at 4 and 16 weeks of HFD in control and transgenic mice ...........… vessel density quantification in eWAT from control and transgenic animals fed with HFD for 8 weeks of HFD …","https://repository.escholarship.umassmed.edu/bitstream/handle/20.500.14038/32209/Senol_Cosar_Ozlem_final.pdf?sequence=3&isAllowed=y","https://scholar.google.com/scholar?q=related:ACnqNLyXtAgJ:scholar.google.com/&scioq=%22vessel+density%22+%22hfd%22+%22mice%22&hl=en&as_sdt=2007&as_ylo=1900&as_yhi=2023"
0,"A Sharma","Therapeutic use of a mutant Caveolin-1 peptide to reduce atherosclerosis induced by hypercholesterolemia and diabetes",2014,"","open.library.ubc.ca","https://open.library.ubc.ca/soa/cIRcle/collections/ubctheses/24/items/1.0135630","",405,"2023-07-13 17:55:37","","","","",,,,,0,0.00,0,1,9,"… of ApoE KO mice fed a HFD ....... 60 4.2.2. CavNOxin ameliorates HFD-induced atherosclerosis .… infiltration and vessel density are significantly reduced in Cav-1 KO mice as compared to …","https://open.library.ubc.ca/media/download/pdf/24/1.0135630/1","https://scholar.google.com/scholar?q=related:iPG0lixfmxoJ:scholar.google.com/&scioq=%22vessel+density%22+%22hfd%22+%22mice%22&hl=en&as_sdt=2007&as_ylo=1900&as_yhi=2023"
0,"PS Petersen, X Lei, MM Seldin, S Rodriguez, ...","Articles in PresS. Am J Physiol Regul Integr Comp Physiol (October 15, 2014). doi: 10.1152/ajpregu. 00335.2014",2014,"…","journals.physiology.org","https://journals.physiology.org/doi/prev/20141015-aop/epdf/10.1152/ajpregu.00335.2014","",406,"2023-07-13 17:55:37","","10.1152/ajpregu.00335.2014","","",,,,,0,0.00,0,5,9,"… To determine whether the observed changes in circulating cytokine levels in HFD-fed mice … -1 in mice via adenoviral vector also has been shown to reduce blood vessel density in the …","","https://scholar.google.com/scholar?q=related:ucw9jLAhVzUJ:scholar.google.com/&scioq=%22vessel+density%22+%22hfd%22+%22mice%22&hl=en&as_sdt=2007&as_ylo=1900&as_yhi=2023"
0,"M Bergentall","On the role of gut microbiota in intestinal physiology and hepatic metabolism",2017,"","gupea.ub.gu.se","https://gupea.ub.gu.se/handle/2077/50862","",407,"2023-07-13 17:55:37","","","","",,,,,0,0.00,0,1,6,"… Mice that were fed a highfat diet (HFD) displayed elevated plasma LPS levels, and upon … conventionalized mice treated with anti-TF antibodies, and thus had reduced vessel density …","https://gupea.ub.gu.se/bitstream/handle/2077/50862/gupea_2077_50862_4.pdf?sequence=4&isAllowed=y","https://scholar.google.com/scholar?q=related:Fk3Ak8DMvdMJ:scholar.google.com/&scioq=%22vessel+density%22+%22hfd%22+%22mice%22&hl=en&as_sdt=2007&as_ylo=1900&as_yhi=2023"
25,"H Von Bank, C Kirsh, J Simcox","Aging adipose: Depot location dictates age-associated expansion and dysfunction",2021,"Ageing research reviews","Elsevier","https://www.sciencedirect.com/science/article/pii/S1568163721000064","https://scholar.google.com/scholar?cites=9001000903533303373&as_sdt=2005&sciodt=2007&hl=en",408,"2023-07-13 17:55:37","HTML","","","",,,,,25,12.50,8,3,2,"… Molecular characterization has largely been performed in mice, … WAT had decreased blood vessel density and lower levels of the … When the mice were given a 1-day HFD, aged mice …","https://www.sciencedirect.com/science/article/pii/S1568163721000064","https://scholar.google.com/scholar?q=related:TZYS5qH66XwJ:scholar.google.com/&scioq=%22vessel+density%22+%22hfd%22+%22mice%22&hl=en&as_sdt=2007&as_ylo=1900&as_yhi=2023"
0,"L Hua, J Li, B Feng, D Jiang, X Jiang, T Luo, L Che, ...","Dietary Intake Regulates White Adipose Tissues Angiogenesis via Liver Fibroblast Growth Factor 21",,"papers.ssrn.com","","https://papers.ssrn.com/sol3/papers.cfm?abstract_id=3707440","",409,"2023-07-13 17:55:37","","","","",,,,,0,0.00,0,8,,"… that IF ameliorated HFD-induced insulin 305 resistance in WT mice but not FGF21LKO mice. FGF21 liver … Adipose tissues, especially BAT, had a high level of vessel density [6]. 333 …","","https://scholar.google.com/scholar?q=related:1GIj-EnpC_QJ:scholar.google.com/&scioq=%22vessel+density%22+%22hfd%22+%22mice%22&hl=en&as_sdt=2007&as_ylo=1900&as_yhi=2023"
22,"S Yao, J Lopez-Tello, ...","Developmental programming of the female reproductive system—a review",2021,"Biology of …","academic.oup.com","https://academic.oup.com/biolreprod/article-abstract/104/4/745/6044072","https://scholar.google.com/scholar?cites=1954669139859171422&as_sdt=2005&sciodt=2007&hl=en",410,"2023-07-13 17:55:37","","","","",,,,,22,11.00,7,3,2,"… For example, maternal low-protein diet in mice was … in ovaries of fetal and neonatal mice [80]. Whether undernutrition also … In rats, a maternal HFD caused an increase in estradiol and …","https://academic.oup.com/biolreprod/article/104/4/745/6044072","https://scholar.google.com/scholar?q=related:Xmi59jlhIBsJ:scholar.google.com/&scioq=%22vessel+density%22+%22hfd%22+%22mice%22&hl=en&as_sdt=2007&as_ylo=1900&as_yhi=2023"
342,"C Lawson, JM Vicencio, DM Yellon, ...","Microvesicles and exosomes: new players in metabolic and cardiovascular disease",2016,"Journal of …","joe.bioscientifica.com","https://joe.bioscientifica.com/view/journals/joe/228/2/R57.xml","https://scholar.google.com/scholar?cites=700279494331027300&as_sdt=2005&sciodt=2007&hl=en",411,"2023-07-13 17:55:37","HTML","","","",,,,,342,48.86,86,4,7,"… (B) NTA of MVs from rats fed chow or HFD. (C) Indirect flow cytometric analysis of exosomes … When CD34 + Shh cells were injected into the infarct border zone in mice, infarct size was …","https://joe.bioscientifica.com/view/journals/joe/228/2/R57.xml","https://scholar.google.com/scholar?q=related:ZE8XZ33ktwkJ:scholar.google.com/&scioq=%22vessel+density%22+%22hfd%22+%22mice%22&hl=en&as_sdt=2007&as_ylo=1900&as_yhi=2023"
24,"AS Jadli, A Parasor, KP Gomes, R Shandilya, ...","Exosomes in cardiovascular diseases: pathological potential of nano-messenger",2021,"Frontiers in …","frontiersin.org","https://www.frontiersin.org/articles/10.3389/fcvm.2021.767488/full","https://scholar.google.com/scholar?cites=1582332215046315067&as_sdt=2005&sciodt=2007&hl=en",412,"2023-07-13 17:55:37","HTML","10.3389/fcvm.2021.767488","","",,,,,24,12.00,5,5,2,"… administration of HFD-VAT exosomes to hyperlipidemic apolipoprotein E–deficient mice leads … defects in the heart, with vessel density decreasing, leading to cardiac hypertrophy (96). …","https://www.frontiersin.org/articles/10.3389/fcvm.2021.767488/full","https://scholar.google.com/scholar?q=related:Oxx-GsSS9RUJ:scholar.google.com/&scioq=%22vessel+density%22+%22hfd%22+%22mice%22&hl=en&as_sdt=2007&as_ylo=1900&as_yhi=2023"
35,"DE Wong, DA Banyard, PJF Santos, LR Sayadi, ...","Adipose-derived stem cell extracellular vesicles: a systematic review✰",2019,"Journal of Plastic …","Elsevier","https://www.sciencedirect.com/science/article/pii/S1748681519301172","https://scholar.google.com/scholar?cites=17460535809238891618&as_sdt=2005&sciodt=2007&hl=en",413,"2023-07-13 17:55:37","HTML","","","",,,,,35,8.75,7,5,4,"… ADSC EVs from mice also induced significant weight loss and corrected metabolic disorders in high-fat diet (HFD) mice through improved white adipose tissue (WAT) homeostasis and …","https://www.sciencedirect.com/science/article/pii/S1748681519301172","https://scholar.google.com/scholar?q=related:YvyrAc9IUPIJ:scholar.google.com/&scioq=%22vessel+density%22+%22hfd%22+%22mice%22&hl=en&as_sdt=2007&as_ylo=1900&as_yhi=2023"
0,"J Deng, F Yan, J Tian, A Qiao, D Yan","Potential clinical biomarkers and perspectives in diabetic cardiomyopathy",2023,"Diabetology &Metabolic Syndrome","Springer","https://link.springer.com/article/10.1186/s13098-023-00998-y","",414,"2023-07-13 17:55:37","HTML","10.1186/s13098-023-00998-y","","",,,,,0,0.00,0,5,1,"… by a high-fat diet (HFD) in adult C57 WT and APN −/− mice fed with HFD [20]. Cardiac … /db mice by enhancing Apelin/Sirt3-mediated mitochondrial function [75]. Increased vessel density …","https://link.springer.com/article/10.1186/s13098-023-00998-y","https://scholar.google.com/scholar?q=related:JUbRaPbWRVIJ:scholar.google.com/&scioq=%22vessel+density%22+%22hfd%22+%22mice%22&hl=en&as_sdt=2007&as_ylo=1900&as_yhi=2023"
0,"HJ Lee","Alteration of Angiogenic Gene Expression in Heart, Muscle and Adipose Tissue by Exercise",2018,"Exercise Science","ksep-es.org","http://ksep-es.org/journal/view.php?doi=10.15857/ksep.2018.27.1.1","",415,"2023-07-13 17:55:37","HTML","10.15857/ksep.2018.27.1.1","","",,,,,0,0.00,0,1,5,"… Thereby, exercise eventually prevents diseases including cardiovascular impairment, muscle atrophy and metabolic syndrome by increasing or maintaining blood vessel density in heart…","http://ksep-es.org/journal/view.php?doi=10.15857/ksep.2018.27.1.1","https://scholar.google.com/scholar?q=related:PaULmQ7HJHUJ:scholar.google.com/&scioq=%22vessel+density%22+%22hfd%22+%22mice%22&hl=en&as_sdt=2007&as_ylo=1900&as_yhi=2023"
18,"DR Soto-Pantoja, JM Sipes, G Martin-Manso, ...","Dietary fat overcomes the protective activity of thrombospondin-1 signaling in the ApcMin/+ model of colon cancer",2016,"Oncogenesis","nature.com","https://www.nature.com/articles/oncsis201637","https://scholar.google.com/scholar?cites=6289833847387871941&as_sdt=2005&sciodt=2007&hl=en",416,"2023-07-13 17:55:37","HTML","","","",,,,,18,2.57,5,4,7,"… Decreased TSP1 expression in adenomas of Apc Min/+ mice was associated with a reduced apoptotic index, increase in proliferation and differential patterns of vessel density. Apc Min/…","https://www.nature.com/articles/oncsis201637","https://scholar.google.com/scholar?q=related:xVrIKY_6SVcJ:scholar.google.com/&scioq=%22vessel+density%22+%22hfd%22+%22mice%22&hl=en&as_sdt=2007&as_ylo=1900&as_yhi=2023"
0,"L Zhang, G Chen, R Tang, Y Xiong, Q Pan, W Jiang, ...","Levosimendan reverses the cardiac malfunction and cardiomyocyte ferroptosis under heart failure with preserved ejection via connexin43 signaling activation",2022,"","researchsquare.com","https://www.researchsquare.com/article/rs-2011741/latest","",417,"2023-07-13 17:55:37","","","","",,,,,0,0.00,0,7,1,"… Brie y, C57BL/6N mice had unrestricted access to a HFD (… We found that compared to control mice, HFpEF mice showed … (green) and quanti cation of blood vessel density (n = 6). Scale …","https://www.researchsquare.com/article/rs-2011741/latest.pdf","https://scholar.google.com/scholar?q=related:L-pYfYZ2xk8J:scholar.google.com/&scioq=%22vessel+density%22+%22hfd%22+%22mice%22&hl=en&as_sdt=2007&as_ylo=1900&as_yhi=2023"
0,"X Cheng","Association Between Angiopoietin-2 and Obese-related Human Metabolic Homeostasis",2021,"","zhb.uni-luebeck.de","https://www.zhb.uni-luebeck.de/epubs/ediss2819.pdf","",418,"2023-07-13 17:55:37","PDF","","","",,,,,0,0.00,0,1,2,"… shown that high fat diet (HFD) upregulated Ang-2 expression in AT of wild-type mice [16]. It … , with a decreased SAT blood vessel density compared with wild-type mice [144]. However, a …","https://www.zhb.uni-luebeck.de/epubs/ediss2819.pdf","https://scholar.google.com/scholar?q=related:jiZoh8i2oB4J:scholar.google.com/&scioq=%22vessel+density%22+%22hfd%22+%22mice%22&hl=en&as_sdt=2007&as_ylo=1900&as_yhi=2023"
0,"O Wang","Novel Approaches for Enhancing Cell Survival and Function In Vivo",2021,"","search.proquest.com","https://search.proquest.com/openview/998eb116c08bf98c0bb7c38f1745ef5c/1?pq-origsite=gscholar&cbl=18750&diss=y","",419,"2023-07-13 17:55:37","HTML","","","",,,,,0,0.00,0,1,2,"… in HFD fed mice. BA microtissues increased the blood vessel density in HFD fed mice (… The liver fat content was significantly increased in HFD mice but was almost normalized by BA …","https://search.proquest.com/openview/998eb116c08bf98c0bb7c38f1745ef5c/1?pq-origsite=gscholar&cbl=18750&diss=y","https://scholar.google.com/scholar?q=related:HUeSUaTitCwJ:scholar.google.com/&scioq=%22vessel+density%22+%22hfd%22+%22mice%22&hl=en&as_sdt=2007&as_ylo=1900&as_yhi=2023"
0,"J Son","Exercise-Induced Hormone, Apelin, in Mediating Fetal Muscle and Adipose Development",2020,"","search.proquest.com","https://search.proquest.com/openview/2ae1fca079fd68face7b52adbe21492d/1?pq-origsite=gscholar&cbl=18750&diss=y","",420,"2023-07-13 17:55:37","BOOK","","","",,,,,0,0.00,0,1,3,"… In the present study, the area of the labyrinth zone was increased but vessel density was reduced in HFD mice; on the other hand, exercise training reversed these adverse changes …","https://search.proquest.com/openview/2ae1fca079fd68face7b52adbe21492d/1?pq-origsite=gscholar&cbl=18750&diss=y","https://scholar.google.com/scholar?q=related:nnncO8Q28NcJ:scholar.google.com/&scioq=%22vessel+density%22+%22hfd%22+%22mice%22&hl=en&as_sdt=2007&as_ylo=1900&as_yhi=2023"
17,"JC Correia, Y Kelahmetoglu, PR Jannig, ...","Muscle-secreted neurturin couples myofiber oxidative metabolism and slow motor neuron identity",2021,"Cell Metabolism","cell.com","https://www.cell.com/cell-metabolism/pdf/S1550-4131(21)00422-8.pdf","https://scholar.google.com/scholar?cites=15818136066755174172&as_sdt=2005&sciodt=2007&hl=en",421,"2023-07-13 17:55:37","PDF","","","",,,,,17,8.50,4,4,2,"… of blood vessel density in TA muscles of WT and HSA-NRTN mice (n = 5–7). (F) Gene expression analysis of angiogenic factors in gastrocnemius muscles of WT and HSA-NRTN mice (…","https://www.cell.com/cell-metabolism/pdf/S1550-4131(21)00422-8.pdf","https://scholar.google.com/scholar?q=related:HJ-80_FOhdsJ:scholar.google.com/&scioq=%22vessel+density%22+%22hfd%22+%22mice%22&hl=en&as_sdt=2007&as_ylo=1900&as_yhi=2023"
2,"J Chen, S Qin, S Liu, K Zhong, Y Jing, X Wu, ...","Targeting matrix metalloproteases in diabetic wound healing",2023,"Frontiers in …","frontiersin.org","https://www.frontiersin.org/articles/10.3389/fimmu.2023.1089001/full","https://scholar.google.com/scholar?cites=16907674059421966434&as_sdt=2005&sciodt=2007&hl=en",422,"2023-07-13 17:55:37","HTML","10.3389/fimmu.2023.1089001","","",,,,,2,2.00,0,7,1,"… , and elevates the micro-vessel density through suppressing the levels of inflammatory … Recently, several studies reveal that PA administration improves wound healing in HFD-fed mice …","https://www.frontiersin.org/articles/10.3389/fimmu.2023.1089001/full","https://scholar.google.com/scholar?q=related:YuDu8fkfpOoJ:scholar.google.com/&scioq=%22vessel+density%22+%22hfd%22+%22mice%22&hl=en&as_sdt=2007&as_ylo=1900&as_yhi=2023"
0,"PP van Krieken","In vivo regulation of pancreatic beta cell function",2018,"","search.proquest.com","https://search.proquest.com/openview/a66c41a15ad6bc16d83657df67af3d67/1?pq-origsite=gscholar&cbl=2026366&diss=y","",423,"2023-07-13 17:55:37","BOOK","","","",,,,,0,0.00,0,1,5,"… beta cells from mice on control diet. In addition, islets from mice exposed to HFD contained a … of the dynamics of individual islet mass and vessel density as well as blood flow [159]. Also, …","https://search.proquest.com/openview/a66c41a15ad6bc16d83657df67af3d67/1?pq-origsite=gscholar&cbl=2026366&diss=y","https://scholar.google.com/scholar?q=related:OUI3s8fOQOIJ:scholar.google.com/&scioq=%22vessel+density%22+%22hfd%22+%22mice%22&hl=en&as_sdt=2007&as_ylo=1900&as_yhi=2023"
0,"U von Andrian","Plenary Talk Thursday, 13 October 2011",,"karger.com","","https://karger.com/jvr/article-pdf/48/Suppl.%201/4/3039767/000332604.pdf","",424,"2023-07-13 17:55:37","","","","",,,,,0,0.00,0,1,,"… /flTie2Cre genotype showed an increased vessel density, indicated by an elevated number … in chow and HFD mice. Insulininduced vasoreactivity in chow and HFD RA was studied in a …","",""
10,"X Lu, L Qin, M Guo, J Geng, S Dong, K Wang, H Xu, ...","A novel alginate from Sargassum seaweed promotes diabetic wound healing by regulating oxidative stress and angiogenesis",2022,"Carbohydrate …","Elsevier","https://www.sciencedirect.com/science/article/pii/S0144861722003423","https://scholar.google.com/scholar?cites=8609474032361743829&as_sdt=2005&sciodt=2007&hl=en",425,"2023-07-13 17:55:37","HTML","","","",,,,,10,10.00,1,8,1,"… (E) Histograms show the micro-vessel density of each group. SARP (200 mg/kg) was injected intravenously to STZ-induced diabetic rats and blood was collected after 10 days SARP …","https://www.sciencedirect.com/science/article/pii/S0144861722003423","https://scholar.google.com/scholar?q=related:1SXfeQT_encJ:scholar.google.com/&scioq=%22vessel+density%22+%22hfd%22+%22mice%22&hl=en&as_sdt=2007&as_ylo=1900&as_yhi=2023"
0,"LAR Freeman","An investigation into the mechanisms of action of incretin-based anti-diabetic therapies in the human vasculature",2020,"","search.proquest.com","https://search.proquest.com/openview/49f9b2d40809ffc0c85eee6d1741131d/1?pq-origsite=gscholar&cbl=51922&diss=y","",426,"2023-07-13 17:55:37","BOOK","","","",,,,,0,0.00,0,1,3,"… Indeed, eNOS expression is markedly decreased, by up to 85%, in the kidneys of C57BL/6J mice with DN simulated unilateral obstruction in the kidney, compared with sham …","https://search.proquest.com/openview/49f9b2d40809ffc0c85eee6d1741131d/1?pq-origsite=gscholar&cbl=51922&diss=y","https://scholar.google.com/scholar?q=related:yzgvQ2DRsB0J:scholar.google.com/&scioq=%22vessel+density%22+%22hfd%22+%22mice%22&hl=en&as_sdt=2007&as_ylo=1900&as_yhi=2023"
0,"R Khursheed, SK Singh, S Wadhwa, M Gulati, ...","A sojourn into therapeutic and nutraceutical potential of curcumin and its novel drug delivery system: Current achievements and future perspectives",2022,"South African Journal of …","Elsevier","https://www.sciencedirect.com/science/article/pii/S025462992200182X","",427,"2023-07-13 17:55:37","HTML","","","",,,,,0,0.00,0,5,1,"Curcumin is a polyphenol which is derived from the rhizomes of Curcuma longa. From the last few decades, it is utilized as a condiment, a flavouring and colouring agent in different …","https://www.sciencedirect.com/science/article/pii/S025462992200182X","https://scholar.google.com/scholar?q=related:BCRf34j23x0J:scholar.google.com/&scioq=%22vessel+density%22+%22hfd%22+%22mice%22&hl=en&as_sdt=2007&as_ylo=1900&as_yhi=2023"
1,"L Lu, J Dong, W Gong","Advances in basic research of traditional Chinese medicine herbal formulae in the treatment of non-small cell lung cancer",2022,"Traditional Medicine and Modern Medicine","World Scientific","https://www.worldscientific.com/doi/abs/10.1142/S2575900021300010","https://scholar.google.com/scholar?cites=4248509745973903006&as_sdt=2005&sciodt=2007&hl=en",428,"2023-07-13 17:55:37","","10.1142/S2575900021300010","","",,,,,1,1.00,0,3,1,"… in the serum of LLC-bearing mice and effectively halt the cell … -3 in LLC-bearing mice, inhibiting tumor growth by promoting … Micro-vessel density (MVD) is important in evaluating tumor …","https://www.worldscientific.com/doi/pdf/10.1142/S2575900021300010","https://scholar.google.com/scholar?q=related:nj6PuRq99ToJ:scholar.google.com/&scioq=%22vessel+density%22+%22hfd%22+%22mice%22&hl=en&as_sdt=2007&as_ylo=1900&as_yhi=2023"
1,"S Mahata, B Tota, D O'connor, G Bandyopadhyay, ...","Catestatin (cst) and its variants for treatment of cardiovascular and metabolic disorders",2009,"","Google Patents","https://patents.google.com/patent/WO2009137091A2/en","https://scholar.google.com/scholar?cites=2621594672182062517&as_sdt=2005&sciodt=2007&hl=en",429,"2023-07-13 17:55:37","","","","",,,,,1,0.07,0,5,14,"WO2009137091A2 - Catestatin (cst) and its variants for treatment of cardiovascular and metabolic disorders - Google Patents WO2009137091A2 - Catestatin (cst) and its variants for …","","https://scholar.google.com/scholar?q=related:te137HbGYSQJ:scholar.google.com/&scioq=%22vessel+density%22+%22hfd%22+%22mice%22&hl=en&as_sdt=2007&as_ylo=1900&as_yhi=2023"
13,"AC Ludzki, MW Pataky, GD Cartee, ...","Acute endurance exercise increases Vegfa mRNA expression in adipose tissue of rats during the early stages of weight gain",2018,"Applied Physiology …","cdnsciencepub.com","https://cdnsciencepub.com/doi/abs/10.1139/apnm-2017-0434","https://scholar.google.com/scholar?cites=17012146553447605058&as_sdt=2005&sciodt=2007&hl=en",430,"2023-07-13 17:55:37","","10.1139/apnm-2017-0434","","",,,,,13,2.60,3,4,5,"… Vegf-a overexpression in mice are observed during early HFD exposure; while, in contrast, … depots in HFD-SED versus LFD-SED, Pecam expression was not higher in HFD-SED versus …","https://www.ncbi.nlm.nih.gov/pmc/articles/PMC6260956/?dopt=Abstract","https://scholar.google.com/scholar?q=related:QmMh-SdJF-wJ:scholar.google.com/&scioq=%22vessel+density%22+%22hfd%22+%22mice%22&hl=en&as_sdt=2007&as_ylo=1900&as_yhi=2023"
0,"SL Sandow, L Wise","14th Australian and New Zealand Microcirculation Society Meeting",2009,"","karger.com","https://karger.com/jvr/article-pdf/46/Suppl.%202/1/3038167/000230992.pdf","",431,"2023-07-13 17:55:37","","","","",,,,,0,0.00,0,2,14,"… Here, we provide evidence in mice that this gender difference only occurs if the ischemic … of physiological growth, in terms of vessel density and mural cell ensheathment. Given the non-…","https://scholar.archive.org/work/gujhv36scjdu3nnx3tfzlxlq4a/access/wayback/https://www.karger.com/Article/Pdf/230992","https://scholar.google.com/scholar?q=related:eOttZbUXTQQJ:scholar.google.com/&scioq=%22vessel+density%22+%22hfd%22+%22mice%22&hl=en&as_sdt=2007&as_ylo=1900&as_yhi=2023"
0,"F Daneshgari","Path of Translational Discovery of “Urological Complications of Obesity and Diabetes (UCOD)” 2",2017,"","journals.physiology.org","https://journals.physiology.org/doi/prev/20170111-aop/epdf/10.1152/ajprenal.00489.2016","",432,"2023-07-13 17:55:37","","10.1152/ajprenal.00489.2016","","",,,,,0,0.00,0,1,6,"… vessel density in bladder wall are decreased at 20 weeks after diabetes induction (70). 177 … HFD-feeding male C57BL/6J mice for 20 weeks even though it induced diabetes, 288 …","","https://scholar.google.com/scholar?q=related:CEq0HStwyLoJ:scholar.google.com/&scioq=%22vessel+density%22+%22hfd%22+%22mice%22&hl=en&as_sdt=2007&as_ylo=1900&as_yhi=2023"
14,"F Huang, W Mei, Y Li, G Tan, H Dai, J Guo, H Wang, ...","Toxicarioside A inhibits tumor growth and angiogenesis: involvement of TGF-β/endoglin signaling",2012,"PLoS …","journals.plos.org","https://journals.plos.org/plosone/article?id=10.1371/journal.pone.0050351","https://scholar.google.com/scholar?cites=8502019029333245816&as_sdt=2005&sciodt=2007&hl=en",433,"2023-07-13 17:55:37","HTML","","","",,,,,14,1.27,2,8,11,"… Vessel density was determined by counting the number of microvessels per high-power … Relative to mice treated with DMSO, the tumor volumes in the mice treated with toxicarioside A …","https://journals.plos.org/plosone/article?id=10.1371/journal.pone.0050351","https://scholar.google.com/scholar?q=related:eP8E9UI9_XUJ:scholar.google.com/&scioq=%22vessel+density%22+%22hfd%22+%22mice%22&hl=en&as_sdt=2007&as_ylo=1900&as_yhi=2023"
