Cites,Authors,Title,Year,Source,Publisher,ArticleURL,CitesURL,GSRank,QueryDate,Type,DOI,ISSN,CitationURL,Volume,Issue,StartPage,EndPage,ECC,CitesPerYear,CitesPerAuthor,AuthorCount,Age,Abstract,FullTextURL,RelatedURL
0,"YY Wheeler","The use of intrabodies in anti-angiogenesis research",2003,"","search.proquest.com","https://search.proquest.com/openview/482cede983cd1ae2e4099056295b4728/1?pq-origsite=gscholar&cbl=18750&diss=y","",188,"2023-07-14 14:45:40","BOOK","","","",,,,,0,0.00,0,1,20,"… of VEGF-A and VPF revealed that the activities of VEGF-A … Flt-1 has the highest binding affinity to VEGF165, with a Kd of … neurophilins (NRP1 and NRP2). Each receptor has their specific …","https://search.proquest.com/openview/482cede983cd1ae2e4099056295b4728/1?pq-origsite=gscholar&cbl=18750&diss=y","https://scholar.google.com/scholar?q=related:Q7yY3Iu_iAUJ:scholar.google.com/&scioq=%22binding+affinity%22+%22kd%22+%22vegf%22+%22nrp1%22&hl=en&as_sdt=2007&as_ylo=1950&as_yhi=2023"
0,"SM Christie","Elucidation of Membrane Protein Interactions Under Native and Ligand Stimulated Conditions Using Fluorescence Correlation Spectroscopy",2020,"","search.proquest.com","https://search.proquest.com/openview/8798eed2806818ef7214284688b36d7c/1?pq-origsite=gscholar&cbl=18750&diss=y","",189,"2023-07-14 14:45:40","BOOK","","","",,,,,0,0.00,0,1,3,"… affinity for each other (Plexin A2-Nrp1 Kd = ~60 µM) with the ligand … other signaling pathways, including VEGF and TGF-ß, so … If the Nrp1 homo-dimer has a high binding affinity it is also …","https://search.proquest.com/openview/8798eed2806818ef7214284688b36d7c/1?pq-origsite=gscholar&cbl=18750&diss=y","https://scholar.google.com/scholar?q=related:OeyC96L80kEJ:scholar.google.com/&scioq=%22binding+affinity%22+%22kd%22+%22vegf%22+%22nrp1%22&hl=en&as_sdt=2007&as_ylo=1950&as_yhi=2023"
9,"CCW Lee, RSN Munuganti, JW Peacock, ...","Targeting semaphorin 3C in prostate cancer with small molecules",2018,"Journal of the …","academic.oup.com","https://academic.oup.com/jes/article-abstract/2/12/1381/5126391","https://scholar.google.com/scholar?cites=17913525718405594340&as_sdt=2005&sciodt=2007&hl=en",190,"2023-07-14 14:45:40","","","","",,,,,9,1.80,2,4,5,"… -NRP1 crystal structure allowed us to virtually screen small molecules for the potential ability to disrupt SEMA3C-NRP1 … demonstrated high predicted binding affinity toward the SEMA3C …","https://academic.oup.com/jes/article/2/12/1381/5126391","https://scholar.google.com/scholar?q=related:5LxjILugmfgJ:scholar.google.com/&scioq=%22binding+affinity%22+%22kd%22+%22vegf%22+%22nrp1%22&hl=en&as_sdt=2007&as_ylo=1950&as_yhi=2023"
0,"RS Helms","MACROPHAGES EXPRESSING NEUROPILIN-1 AND BREAST TUMOR PROGRESSION",2015,"","repository.charlotte.edu","https://repository.charlotte.edu/islandora/object/etd:1322/datastream/PDF/download/citation.pdf","",191,"2023-07-14 14:45:40","PDF","","","",,,,,0,0.00,0,1,8,"… the binding affinity of VEGF to VEGFR2 enhancing cellular migration to the VEGF stimuli [28, 31… Interestingly, NRP-1 can also act as a co-receptor VEGF 165 with VEGFR1; however, this …","https://repository.charlotte.edu/islandora/object/etd:1322/datastream/PDF/download/citation.pdf","https://scholar.google.com/scholar?q=related:wJof32bSwz4J:scholar.google.com/&scioq=%22binding+affinity%22+%22kd%22+%22vegf%22+%22nrp1%22&hl=en&as_sdt=2007&as_ylo=1950&as_yhi=2023"
29,"DO Bates, N Beazley-Long, AV Benest, X Ye, ...","Physiological role of vascular endothelial growth factors as homeostatic regulators",2018,"Comprehensive …","ora.ox.ac.uk","https://ora.ox.ac.uk/objects/uuid:72dbfd88-423d-47dc-aae2-e94a6a68c323","https://scholar.google.com/scholar?cites=11714506107374986918&as_sdt=2005&sciodt=2007&hl=en",192,"2023-07-14 14:45:40","","","","",,,,,29,5.80,6,5,5,"… exon 7, and the additional protein sequence confers heparin binding affinity. VEGF-B186 … Contrasting evidence exists however, suggesting that NRP1 is able to support VEGF-induced …","https://ora.ox.ac.uk/objects/uuid:72dbfd88-423d-47dc-aae2-e94a6a68c323/download_file?file_format=pdf&safe_filename=Comprehensive%2BPhysiology%2BAAM.pdf&type_of_work=Journal+article","https://scholar.google.com/scholar?q=related:puY6ET1JkqIJ:scholar.google.com/&scioq=%22binding+affinity%22+%22kd%22+%22vegf%22+%22nrp1%22&hl=en&as_sdt=2007&as_ylo=1950&as_yhi=2023"
0,"N Zhao","Delivery of growth factors and stem cells for therapeutic angiogenesis",2019,"","search.proquest.com","https://search.proquest.com/openview/1357bb818bed21b62c919c1f252c78e9/1?pq-origsite=gscholar&cbl=18750&diss=y","",193,"2023-07-14 14:45:40","BOOK","","","",,,,,0,0.00,0,1,4,"… VEGF-B can bind to VEGFR1 and NRP1 [22]. In human … can bind to VEGFR1 with high affinity (Kd from 10 to 20 pM) … -A and PDGF-BB through genetic engineering, the binding affinity of …","https://search.proquest.com/openview/1357bb818bed21b62c919c1f252c78e9/1?pq-origsite=gscholar&cbl=18750&diss=y","https://scholar.google.com/scholar?q=related:qzlgdUDIJrAJ:scholar.google.com/&scioq=%22binding+affinity%22+%22kd%22+%22vegf%22+%22nrp1%22&hl=en&as_sdt=2007&as_ylo=1950&as_yhi=2023"
0,"Š Brkić","Molecular regulation of intussusceptive angiogenesis by ephrinB2/EphB4 signaling and its therapeutic potential",2017,"","edoc.unibas.ch","https://edoc.unibas.ch/57744/","",194,"2023-07-14 14:45:40","","","","",,,,,0,0.00,0,1,6,"… Generally, VEGFA isoforms have different heparin-binding affinity, depending on how many … , VEGF-A121 does not bind neither extracellular matrix (ECM), nor NRP1, whereas VEGF-…","https://edoc.unibas.ch/57744/1/PhD_Thesis_Sime_Brkic_2017_edoc.pdf","https://scholar.google.com/scholar?q=related:spcjSaR_JZAJ:scholar.google.com/&scioq=%22binding+affinity%22+%22kd%22+%22vegf%22+%22nrp1%22&hl=en&as_sdt=2007&as_ylo=1950&as_yhi=2023"
1,"V Samuel, T Rajeev, L Ramesh, ...","Integrin receptor trafficking in health and disease",2023,"Progress in Molecular …","Elsevier","https://www.sciencedirect.com/science/article/pii/S187711732200151X","https://scholar.google.com/scholar?cites=2963516957736134203&as_sdt=2005&sciodt=2007&hl=en",195,"2023-07-14 14:45:40","","","","",,,,,1,1.00,0,4,1,"… a range of growth factors like VEGF in endothelial cells and … the co-internalization of Nrp1 and α5β1 integrins into clathrin … ) without affecting the ligand binding affinity and specificity as …","","https://scholar.google.com/scholar?q=related:O2a1v_iGICkJ:scholar.google.com/&scioq=%22binding+affinity%22+%22kd%22+%22vegf%22+%22nrp1%22&hl=en&as_sdt=2007&as_ylo=1950&as_yhi=2023"
3,"JW Lee, J Choi, Y Choi, K Kim, Y Yang, SH Kim, ...","Molecularly engineered siRNA conjugates for tumor-targeted RNAi therapy",2022,"Journal of Controlled …","Elsevier","https://www.sciencedirect.com/science/article/pii/S0168365922006356","https://scholar.google.com/scholar?cites=10511205285802414470&as_sdt=2005&sciodt=2007&hl=en",196,"2023-07-14 14:45:40","HTML","","","",,,,,3,3.00,0,7,1,"… found to increase the biostability and target-binding affinity [33]. Besides modifying the ribose, … -NRP1 siRNA enabled effective treatment of lung tumor. Both SLUG and NRP1 genes play …","https://www.sciencedirect.com/science/article/pii/S0168365922006356","https://scholar.google.com/scholar?q=related:hhF2RYRN35EJ:scholar.google.com/&scioq=%22binding+affinity%22+%22kd%22+%22vegf%22+%22nrp1%22&hl=en&as_sdt=2007&as_ylo=1950&as_yhi=2023"
24,"C Wu","Fabs-in-tandem immunoglobulin and uses thereof",2019,"US Patent 10,266,608","Google Patents","https://patents.google.com/patent/US10266608B2/en","https://scholar.google.com/scholar?cites=17643132417995733588&as_sdt=2005&sciodt=2007&hl=en",197,"2023-07-14 14:45:40","","","","",,,,,24,6.00,24,1,4,"The present invention provides multivalent and multispecific binding proteins that are capable of binding two or more antigens, or two or more epitopes. The present invention also …","https://patentimages.storage.googleapis.com/89/6e/17/9f99797da7469f/US10266608.pdf","https://scholar.google.com/scholar?q=related:VHrQ83T_2PQJ:scholar.google.com/&scioq=%22binding+affinity%22+%22kd%22+%22vegf%22+%22nrp1%22&hl=en&as_sdt=2007&as_ylo=1950&as_yhi=2023"
0,"M aan den Toorn","Biochemical investigations into the regulation and specificity of SERK co-receptors",2014,"","search.proquest.com","https://search.proquest.com/openview/300c06e9940894d9dcf0d9b01314b608/1?pq-origsite=gscholar&cbl=2026366&diss=y","",198,"2023-07-14 14:45:40","BOOK","","","",,,,,0,0.00,0,1,9,"… NRP1 is not an obligate co-receptor in VEGF-signalling, and VEGFR2 activation can occur in absence of NRP1 (Pan et al. 2007), however NRP1 … contribute to the binding affinity of the …","https://search.proquest.com/openview/300c06e9940894d9dcf0d9b01314b608/1?pq-origsite=gscholar&cbl=2026366&diss=y","https://scholar.google.com/scholar?q=related:0OpKREuXO9IJ:scholar.google.com/&scioq=%22binding+affinity%22+%22kd%22+%22vegf%22+%22nrp1%22&hl=en&as_sdt=2007&as_ylo=1950&as_yhi=2023"
0,"A Angulo Urarte","Regulation of actomyosin contractility by p110α P13-kinase in sprouting angiogenesis",2017,"","diposit.ub.edu","https://diposit.ub.edu/dspace/handle/2445/108516","",199,"2023-07-14 14:45:40","","","","",,,,,0,0.00,0,1,6,"… even more, due to its high affinity to VEGF but low kinase activity. Depletion of Dll4 or Notch … VEGFs also bind to VEGFs co-receptors as neuropilin NRP1 and NRP2 and to heparan …","https://diposit.ub.edu/dspace/bitstream/2445/108516/1/AAU_PhD_THESIS.pdf","https://scholar.google.com/scholar?q=related:wfdy1fngU3UJ:scholar.google.com/&scioq=%22binding+affinity%22+%22kd%22+%22vegf%22+%22nrp1%22&hl=en&as_sdt=2007&as_ylo=1950&as_yhi=2023"
1,"R Tao, B Mi, Y Hu, S Lin, Y Xiong, X Lu, AC Panayi, ...","Hallmarks of peripheral nerve function in bone regeneration",2023,"Bone Research","nature.com","https://www.nature.com/articles/s41413-022-00240-x","https://scholar.google.com/scholar?cites=14590707855213812313&as_sdt=2005&sciodt=2007&hl=en",200,"2023-07-14 14:45:40","HTML","","","",,,,,1,1.00,0,8,1,"Skeletal tissue is highly innervated. Although different types of nerves have been recently identified in the bone, the crosstalk between bone and nerves remains unclear. In this review, …","https://www.nature.com/articles/s41413-022-00240-x","https://scholar.google.com/scholar?q=related:WVqFS32bfMoJ:scholar.google.com/&scioq=%22binding+affinity%22+%22kd%22+%22vegf%22+%22nrp1%22&hl=en&as_sdt=2007&as_ylo=1950&as_yhi=2023"
3,"M Hashizume, A Takashima, C Ono, T Okamoto, ...","Phenothiazines inhibit SARS-CoV-2 cell entry via a blockade of spike protein binding to neuropilin-1",2023,"Antiviral research","Elsevier","https://www.sciencedirect.com/science/article/pii/S0166354222002509","https://scholar.google.com/scholar?cites=2672432492447515461&as_sdt=2005&sciodt=2007&hl=en",201,"2023-07-14 14:45:40","HTML","","","",,,,,3,3.00,1,5,1,"… (KD) values of 33.3, 13.8, and 7.88 μM, respectively, indicating that these phenothiazines exert an antiviral effect through their binding to ACE2. However, the relatively high KD values …","https://www.sciencedirect.com/science/article/pii/S0166354222002509","https://scholar.google.com/scholar?q=related:RcOLVjFjFiUJ:scholar.google.com/&scioq=%22binding+affinity%22+%22kd%22+%22vegf%22+%22nrp1%22&hl=en&as_sdt=2007&as_ylo=1950&as_yhi=2023"
49,"S Catuogno, CL Esposito, G Condorelli, ...","Nucleic acids delivering nucleic acids",2018,"Advanced drug delivery …","Elsevier","https://www.sciencedirect.com/science/article/pii/S0169409X18300589","https://scholar.google.com/scholar?cites=12117247015579733211&as_sdt=2005&sciodt=2007&hl=en",202,"2023-07-14 14:45:40","HTML","","","",,,,,49,9.80,12,4,5,"… the vascular endothelial growth factor (VEGF) or VEGF receptor-1 to … of target recognition and binding affinity proper of antibodies … of SLUG and NRP1 expressions synergistically inhibits …","https://www.sciencedirect.com/science/article/pii/S0169409X18300589","https://scholar.google.com/scholar?q=related:28xK8_UbKagJ:scholar.google.com/&scioq=%22binding+affinity%22+%22kd%22+%22vegf%22+%22nrp1%22&hl=en&as_sdt=2007&as_ylo=1950&as_yhi=2023"
2,"A Rani, S Jakhmola, S Karnati, HS Parmar, ...","Potential entry receptors for human γ-herpesvirus into epithelial cells: A plausible therapeutic target for viral infections",2021,"Tumour Virus Research","Elsevier","https://www.sciencedirect.com/science/article/pii/S2666679021000173","https://scholar.google.com/scholar?cites=8016757929892941802&as_sdt=2005&sciodt=2007&hl=en",203,"2023-07-14 14:45:40","HTML","","","",,,,,2,1.00,0,5,2,"… The gL mutant (N69L/S71V) study of EBV showed a higher binding affinity for EphA2 … NRP1 or the knockdown of NRP1 reduced EBV infection to about 50% in NPECs. Likewise, NRP1 …","https://www.sciencedirect.com/science/article/pii/S2666679021000173","https://scholar.google.com/scholar?q=related:6o-Q1dw-QW8J:scholar.google.com/&scioq=%22binding+affinity%22+%22kd%22+%22vegf%22+%22nrp1%22&hl=en&as_sdt=2007&as_ylo=1950&as_yhi=2023"
12,"P Kozielewicz, R Shekhani, S Moser, ...","Quantitative profiling of WNT-3A binding to all human Frizzled paralogues in HEK293 cells by nanoBiT/BRET assessments",2021,"ACS Pharmacology & …","ACS Publications","https://pubs.acs.org/doi/abs/10.1021/acsptsci.1c00084","https://scholar.google.com/scholar?cites=18338236541737208630&as_sdt=2005&sciodt=2007&hl=en",204,"2023-07-14 14:45:40","","10.1021/acsptsci.1c00084","","",,,,,12,6.00,3,4,2,"… eGFP-WNT-3A/FZD Binding Affinity at Equilibrium To define saturation binding affinity of eGFP-… The reported saturation binding affinity values range from 4.9 to 48.6 nM, and they are in …","https://pubs.acs.org/doi/full/10.1021/acsptsci.1c00084","https://scholar.google.com/scholar?q=related:NotVffmAfv4J:scholar.google.com/&scioq=%22binding+affinity%22+%22kd%22+%22vegf%22+%22nrp1%22&hl=en&as_sdt=2007&as_ylo=1950&as_yhi=2023"
1,"NC Dale, CW White, EKM Johnstone, ...","Bioluminescence Resonance Energy Transfer (BRET) Technologies to Study GPCRs",2022,"GPCRs as …","Wiley Online Library","https://onlinelibrary.wiley.com/doi/abs/10.1002/9781119564782.ch23","https://scholar.google.com/scholar?cites=2329131337495323502&as_sdt=2005&sciodt=2007&hl=en",205,"2023-07-14 14:45:40","","10.1002/9781119564782.ch23","","",,,,,1,1.00,0,4,1,"… Probe dependence of allosteric enhancers on the binding affinity of adenosine A1-receptor … of fluorescent VEGF-A isoforms that discriminate between VEGFR2 and NRP1 in living cells…","","https://scholar.google.com/scholar?q=related:bqOjdpy8UiAJ:scholar.google.com/&scioq=%22binding+affinity%22+%22kd%22+%22vegf%22+%22nrp1%22&hl=en&as_sdt=2007&as_ylo=1950&as_yhi=2023"
8,"R Dumache, A Enache, I Macasoi, CA Dehelean, ...","SARS-CoV-2: an overview of the genetic profile and vaccine effectiveness of the five variants of concern",2022,"Pathogens","mdpi.com","https://www.mdpi.com/2076-0817/11/5/516","https://scholar.google.com/scholar?cites=15252120103030388736&as_sdt=2005&sciodt=2007&hl=en",206,"2023-07-14 14:45:40","HTML","","","",,,,,8,8.00,2,5,1,"… (VEGF) and participates in the control of cell migration in vessel remodeling [58]. NRP1 is … importance due to the increase in the binding affinity of the ACE2 receptor and the decrease …","https://www.mdpi.com/2076-0817/11/5/516","https://scholar.google.com/scholar?q=related:AHi4rGxqqtMJ:scholar.google.com/&scioq=%22binding+affinity%22+%22kd%22+%22vegf%22+%22nrp1%22&hl=en&as_sdt=2007&as_ylo=1950&as_yhi=2023"
28,"J Kim, J Hong, J Lee, SF Lahiji, YH Kim","Recent advances in tumor microenvironment-targeted nanomedicine delivery approaches to overcome limitations of immune checkpoint blockade-based …",2021,"Journal of Controlled Release","Elsevier","https://www.sciencedirect.com/science/article/pii/S0168365921000493","https://scholar.google.com/scholar?cites=5732703842859691153&as_sdt=2005&sciodt=2007&hl=en",207,"2023-07-14 14:45:40","HTML","","","",,,,,28,14.00,6,5,2,"… In addition, VEGF signaling from tumor cells … that Nrp1+ Tregs were more efficient than Nrp1− Tregs in inducing immunosuppression. Moreover, the upregulated expression of Nrp1 in …","https://www.sciencedirect.com/science/article/pii/S0168365921000493","https://scholar.google.com/scholar?q=related:kSwrnMWnjk8J:scholar.google.com/&scioq=%22binding+affinity%22+%22kd%22+%22vegf%22+%22nrp1%22&hl=en&as_sdt=2007&as_ylo=1950&as_yhi=2023"
1,"A Grinberg, R Castonguay, E Werner, ...","Endoglin peptides to treat fibrotic diseases",2023,"US Patent …","Google Patents","https://patents.google.com/patent/US11590201B2/en","https://scholar.google.com/scholar?cites=758553627391879302&as_sdt=2005&sciodt=2007&hl=en",208,"2023-07-14 14:45:40","","","","",,,,,1,1.00,0,4,1,"… (KD) less than 1×10 −9 M or a dissociation rate constant (kd) … An anti-VEGF antibody will usually not bind to other VEGF … toward the intermediate ligand binding affinity shown by ENG(…","","https://scholar.google.com/scholar?q=related:hujGT4HshgoJ:scholar.google.com/&scioq=%22binding+affinity%22+%22kd%22+%22vegf%22+%22nrp1%22&hl=en&as_sdt=2007&as_ylo=1950&as_yhi=2023"
0,"S Snyder","Developing A Heterotypic Cell Culture Model To Determine Vegf Action Of Neural Stem Cell Fate Choice",2015,"","commons.und.edu","https://commons.und.edu/theses/1836/","",209,"2023-07-14 14:45:40","","","","",,,,,0,0.00,0,1,8,"… Vegf-E, but the focus of this study deals solely with Vegf-A, … binding affinity for Vegf compared to VEGFR2 21 (and … to VEGFR2 but is not able to bridge to NRP1 due to the its lack …","https://commons.und.edu/cgi/viewcontent.cgi?article=2837&context=theses","https://scholar.google.com/scholar?q=related:UtrYtPBAX48J:scholar.google.com/&scioq=%22binding+affinity%22+%22kd%22+%22vegf%22+%22nrp1%22&hl=en&as_sdt=2007&as_ylo=1950&as_yhi=2023"
137,"SH Ku, SD Jo, YK Lee, K Kim, SH Kim","Chemical and structural modifications of RNAi therapeutics",2016,"Advanced drug delivery reviews","Elsevier","https://www.sciencedirect.com/science/article/pii/S0169409X15002409","https://scholar.google.com/scholar?cites=9143650286025782200&as_sdt=2005&sciodt=2007&hl=en",210,"2023-07-14 14:45:40","HTML","","","",,,,,137,19.57,27,5,7,"… serum stability and the binding affinity of siRNA duplex (~ 1 C … When siRNA targeting vascular endothelial growth factor (VEGF) … ) and neuropilin 1 (NRP1) synergistically suppressed the …","https://www.sciencedirect.com/science/article/pii/S0169409X15002409","https://scholar.google.com/scholar?q=related:uDP3cH3F5H4J:scholar.google.com/&scioq=%22binding+affinity%22+%22kd%22+%22vegf%22+%22nrp1%22&hl=en&as_sdt=2007&as_ylo=1950&as_yhi=2023"
0,"A Novak, F Kersaudy, S Berger, S Morisset-Lopez, ...","N-terminal cysteine as minimalistic handle for dual, site-selective bioconjugation: application to an anti-HER2 affibody reveals synergy of two conjugated drugs",2023,"","chemrxiv.org","https://chemrxiv.org/engage/chemrxiv/article-details/645f67a2f2112b41e97bcb3a","",211,"2023-07-14 14:45:40","","","","",,,,,0,0.00,0,5,1,"… Biophysical assays on Afb 3 showed increased binding affinity (60 pM) compared to 1, to … [a] association rate constant (ka), dissociation rate constant (kd), and steady state affinity (KD) …","https://chemrxiv.org/engage/api-gateway/chemrxiv/assets/orp/resource/item/645f67a2f2112b41e97bcb3a/original/n-terminal-cysteine-as-minimalistic-handle-for-dual-site-selective-bioconjugation-application-to-an-anti-her2-affibody-reveals-synergy-of-two-conjugated-drugs.pdf","https://scholar.google.com/scholar?q=related:asy6WB3jAHoJ:scholar.google.com/&scioq=%22binding+affinity%22+%22kd%22+%22vegf%22+%22nrp1%22&hl=en&as_sdt=2007&as_ylo=1950&as_yhi=2023"
68,"P Bhattarai, S Hameed, Z Dai","Recent advances in anti-angiogenic nanomedicines for cancer therapy",2018,"Nanoscale","pubs.rsc.org","https://pubs.rsc.org/en/content/articlehtml/2018/nr/c7nr09612g","https://scholar.google.com/scholar?cites=2865399879453617373&as_sdt=2005&sciodt=2007&hl=en",212,"2023-07-14 14:45:40","","","","",,,,,68,13.60,23,3,5,"… NRP1 and 2) function as co-receptors responsible for increasing the binding affinity of VEGF … Recent studies have highlighted significant therapeutic benefits by targeting VEGF and NP1 …","","https://scholar.google.com/scholar?q=related:3axHQgLywycJ:scholar.google.com/&scioq=%22binding+affinity%22+%22kd%22+%22vegf%22+%22nrp1%22&hl=en&as_sdt=2007&as_ylo=1950&as_yhi=2023"
0,"G Fuh, H Gerber, WC Liang, FA Fellouse, SS Sidhu, ...","anticorpos, método de seleção de um anticorpo de hvegf, ácido nucléico isolado, vetor, célula hospedeira, processo de produção de um anticorpo, método de uso do …",2006,"","Google Patents","https://patents.google.com/patent/BRPI0412637A/enIt.pdf","",213,"2023-07-14 14:45:40","","","","",,,,,0,0.00,0,6,17,"… 01 2016-07-12 Consejo Nacional De Investigation Cientifica Anti-human VEGF antibodies with unusually strong binding affinity to human VEGF-A and cross reactivity to human VEGF-B …","","https://scholar.google.com/scholar?q=related:y1VQbvrh-_gJ:scholar.google.com/&scioq=%22binding+affinity%22+%22kd%22+%22vegf%22+%22nrp1%22&hl=en&as_sdt=2007&as_ylo=1950&as_yhi=2023"
0,"V Schellenberger, J Silverman, CW Wang, ...","Binding fusion proteins, binding fusion protein-drug conjugates, xten-drug conjugates and methods of making and using same",2023,"US Patent App. 17 …","Google Patents","https://patents.google.com/patent/US20230061715A1/en","",214,"2023-07-14 14:45:40","","","","",,,,,0,0.00,0,4,1,"… is a targeting moiety with specific binding affinity to a target … protein is less than about 25 kD. Accordingly, the binding fusion … VEGF (113) to form the binding complex that sequesters the …","","https://scholar.google.com/scholar?q=related:mBqOeF0XjxAJ:scholar.google.com/&scioq=%22binding+affinity%22+%22kd%22+%22vegf%22+%22nrp1%22&hl=en&as_sdt=2007&as_ylo=1950&as_yhi=2023"
0,"E Hefni","The Role of Angiopoietin-Like 4 in Head and Neck Squamous Cell Carcinoma Progression and Dissemination",2022,"","search.proquest.com","https://search.proquest.com/openview/2417c7cd9d38d4dc4ac804e72e055427/1?pq-origsite=gscholar&cbl=18750&diss=y","",215,"2023-07-14 14:45:40","HTML","","","",,,,,0,0.00,0,1,1,"… To this end, we first examined NRP1 and NRP2 expression in our cell lines and found expression of NRP1 in normal (NOK) and dysplastic (DOK) keratinocytes, as well as in HNSCCs (…","https://search.proquest.com/openview/2417c7cd9d38d4dc4ac804e72e055427/1?pq-origsite=gscholar&cbl=18750&diss=y","https://scholar.google.com/scholar?q=related:V7KFVUGnR-EJ:scholar.google.com/&scioq=%22binding+affinity%22+%22kd%22+%22vegf%22+%22nrp1%22&hl=en&as_sdt=2007&as_ylo=1950&as_yhi=2023"
0,"S Vivekanandhan","Genetic Status of KRAS Influences Transforming Growth Factor Beta (TGFβ) Signaling in Tumorigenesis",2018,"","search.proquest.com","https://search.proquest.com/openview/639f446d15ed4dd0c0370237a00f3338/1?pq-origsite=gscholar&cbl=18750&diss=y","",216,"2023-07-14 14:45:40","HTML","","","",,,,,0,0.00,0,1,5,"… the isoforms, as the binding affinity given by the farnesyl group … that NRP1 promoted vascular endothelial growth factor (VEGF)-… showed that NRP1 transduces VEGFinduced prosurvival …","https://search.proquest.com/openview/639f446d15ed4dd0c0370237a00f3338/1?pq-origsite=gscholar&cbl=18750&diss=y","https://scholar.google.com/scholar?q=related:SpEJuvITQD0J:scholar.google.com/&scioq=%22binding+affinity%22+%22kd%22+%22vegf%22+%22nrp1%22&hl=en&as_sdt=2007&as_ylo=1950&as_yhi=2023"
10,"SW Hock, Z Fan, M Buchfelder, ...","Brain Tumor–Induced Angiogenesis: Approaches and Bioassays",2013,"Evolution of the …","books.google.com","https://books.google.com/books?hl=en&lr=&id=0fugDwAAQBAJ&oi=fnd&pg=PA125&dq=%22binding+affinity%22+%22kd%22+%22vegf%22+%22nrp1%22&ots=BOprxFj_8g&sig=5GWuYdSxS-hEQWk9PPvv7KzMM8o","https://scholar.google.com/scholar?cites=10874634808530755158&as_sdt=2005&sciodt=2007&hl=en",217,"2023-07-14 14:45:40","","","","",,,,,10,1.00,3,4,10,"… VEGF-A is overexpressed by the vast majority of cancers [31] … affinity of various VEGF ligands to the primary VEGF-receptors… 2 are antagonistic ligands with a high binding affinity to tie-2. …","https://opus4.kobv.de/opus4-fau/files/3248/hock_brain.pdf","https://scholar.google.com/scholar?q=related:Vt6S-L126pYJ:scholar.google.com/&scioq=%22binding+affinity%22+%22kd%22+%22vegf%22+%22nrp1%22&hl=en&as_sdt=2007&as_ylo=1950&as_yhi=2023"
24,"J Wilting, B Christ, L Yuan, A Eichmann","Cellular and molecular mechanisms of embryonic haemangiogenesis and lymphangiogenesis",2003,"Naturwissenschaften","Springer","https://link.springer.com/article/10.1007/s00114-003-0455-y","https://scholar.google.com/scholar?cites=6157066172966858905&as_sdt=2005&sciodt=2007&hl=en",218,"2023-07-14 14:45:40","","10.1007/s00114-003-0455-y","","",,,,,24,1.20,6,4,20,"… Receptor binding affinity is enhanced during the stepwise processing and the fully processed forms of VEGF-C and -D also bind VEGFR-2. Both ligands are mitogenic for ECs and …","","https://scholar.google.com/scholar?q=related:mXBDEhBLclUJ:scholar.google.com/&scioq=%22binding+affinity%22+%22kd%22+%22vegf%22+%22nrp1%22&hl=en&as_sdt=2007&as_ylo=1950&as_yhi=2023"
0,"W Vecchiato","Determining the role of Protocadherin-1 in angiogenesis",2022,"","etheses.bham.ac.uk","https://etheses.bham.ac.uk/id/eprint/12148/","",219,"2023-07-14 14:45:40","","","","",,,,,0,0.00,0,1,1,"Protocadherin-1 (PCDH1) is a single-pass transmembrane protein belonging to the Cadherin superfamily of adhesion molecules. Protocadherins are involved in neuronal guidance, …","https://etheses.bham.ac.uk/id/eprint/12148/7/Vecchiato2022PhD.pdf","https://scholar.google.com/scholar?q=related:0FQe8XFQtKcJ:scholar.google.com/&scioq=%22binding+affinity%22+%22kd%22+%22vegf%22+%22nrp1%22&hl=en&as_sdt=2007&as_ylo=1950&as_yhi=2023"
