Cites,Authors,Title,Year,Source,Publisher,ArticleURL,CitesURL,GSRank,QueryDate,Type,DOI,ISSN,CitationURL,Volume,Issue,StartPage,EndPage,ECC,CitesPerYear,CitesPerAuthor,AuthorCount,Age,Abstract,FullTextURL,RelatedURL
61,"W Li, JMK Ng, CC Wong, EKW Ng, J Yu","Molecular alterations of cancer cell and tumour microenvironment in metastatic gastric cancer",2018,"Oncogene","nature.com","https://www.nature.com/articles/s41388-018-0341-x","https://scholar.google.com/scholar?cites=17352865662983958578&as_sdt=2005&sciodt=2007&hl=en",685,"2023-07-26 09:55:10","HTML","","","",,,,,61,12.20,12,5,5,"… A study reported that the lymphatic vessel density (LVD) … of the vessel walls irrespective of vessel size [6]. Alternatively, … diameters of 20–30 μm compared to that of around 8 μm [6]. Once …","https://www.nature.com/articles/s41388-018-0341-x","https://scholar.google.com/scholar?q=related:MnA7jWHD0fAJ:scholar.google.com/&scioq=%22vessel+size%22+%22vessel+density%22+%22tumor%22+%22mice%22+%22%C2%B5m%22&hl=en&as_sdt=2007&as_ylo=1950&as_yhi=2023"
1,"Z Zhi","Development and Application of Multifunctional Optical Coherence Tomography",2014,"","digital.lib.washington.edu","https://digital.lib.washington.edu/researchworks/handle/1773/26688","https://scholar.google.com/scholar?cites=10057073267536891107&as_sdt=2005&sciodt=2007&hl=en",686,"2023-07-26 09:55:10","","","","",,,,,1,0.11,1,1,9,"… morphology and microvasculature in obese mice, which may play … showing the lymphatic vessel size and density changes … µm/pixel, which provides a measurement accuracy of 3.7µm …","https://digital.lib.washington.edu/researchworks/bitstream/handle/1773/26688/Zhi_washington_0250E_12846.pdf?sequence=1&isAllowed=y","https://scholar.google.com/scholar?q=related:4wydJ9rmkYsJ:scholar.google.com/&scioq=%22vessel+size%22+%22vessel+density%22+%22tumor%22+%22mice%22+%22%C2%B5m%22&hl=en&as_sdt=2007&as_ylo=1950&as_yhi=2023"
5,"L Vergori, E Lauret, R Soleti, MC Martinez, ...","Low concentration of ethanol favors progenitor cell differentiation and neovascularization in high-fat diet-fed mice model",2016,"… International Journal of …","Elsevier","https://www.sciencedirect.com/science/article/pii/S1357272516301765","https://scholar.google.com/scholar?cites=7827946434812054423&as_sdt=2005&sciodt=2007&hl=en",687,"2023-07-26 09:55:10","HTML","","","",,,,,5,0.71,1,5,7,"… Frozen Matrigel plugs sections (30 μm thickness) were … anti-CD31 antibody to analyze vessel density. Conversely, the … Vessel size from plugs with 1% ethanol were increased (⿼…","https://www.sciencedirect.com/science/article/pii/S1357272516301765","https://scholar.google.com/scholar?q=related:lwvC585zomwJ:scholar.google.com/&scioq=%22vessel+size%22+%22vessel+density%22+%22tumor%22+%22mice%22+%22%C2%B5m%22&hl=en&as_sdt=2007&as_ylo=1950&as_yhi=2023"
0,"F Ceteci","Analysis of the role of the E-(Epithelial) Cadherin in murine lung tumorigenesis",2008,"","opus.bibliothek.uni-wuerzburg.de","https://opus.bibliothek.uni-wuerzburg.de/frontdoor/index/index/docId/2518","",688,"2023-07-26 09:55:10","","","","",,,,,0,0.00,0,1,15,"… Vessel size (diameter) was presented as µm. … Similar observations were made regarding vessel size (data not … As in the case of dn E-cadherin analysis of blood vessel density by CD31 …","https://opus.bibliothek.uni-wuerzburg.de/files/2518/ceteci_F_dissertation.pdf","https://scholar.google.com/scholar?q=related:SHyf1AEYow8J:scholar.google.com/&scioq=%22vessel+size%22+%22vessel+density%22+%22tumor%22+%22mice%22+%22%C2%B5m%22&hl=en&as_sdt=2007&as_ylo=1950&as_yhi=2023"
0,"F Wang, X Liu, S Li, C Zhao, Y Sun, K Tian, ...","Resolving the lineage relationship between malignant cells and vascular cells in glioblastomas",2023,"Protein & …","academic.oup.com","https://academic.oup.com/proteincell/article-abstract/14/2/105/6587399","",689,"2023-07-26 09:55:10","","","","",,,,,0,0.00,0,7,1,"… structures, with increased vessel density and vessel area when … Scale bars, 50 μm. Representative images showing … vasculature, but that vessel density, vessel size, and the vascular …","https://academic.oup.com/proteincell/article/14/2/105/6587399","https://scholar.google.com/scholar?q=related:CqIbr1qXbHkJ:scholar.google.com/&scioq=%22vessel+size%22+%22vessel+density%22+%22tumor%22+%22mice%22+%22%C2%B5m%22&hl=en&as_sdt=2007&as_ylo=1950&as_yhi=2023"
26,"SA Mills, AI Jobling, MA Dixon, BV Bui, ...","Fractalkine-induced microglial vasoregulation occurs within the retina and is altered early in diabetic retinopathy",2021,"Proceedings of the …","National Acad Sciences","https://www.pnas.org/doi/abs/10.1073/pnas.2112561118","https://scholar.google.com/scholar?cites=1221808630530246990&as_sdt=2005&sciodt=2007&hl=en",690,"2023-07-26 09:55:10","","10.1073/pnas.2112561118","","",,,,,26,13.00,5,5,2,"… ≤15 µm), particularly the smallest retinal capillaries (<10 µm), … to vessel area for each vessel size and show microglia … ) for each vessel type and vessel density was expressed as …","https://www.pnas.org/doi/full/10.1073/pnas.2112561118","https://scholar.google.com/scholar?q=related:TglD3nm89BAJ:scholar.google.com/&scioq=%22vessel+size%22+%22vessel+density%22+%22tumor%22+%22mice%22+%22%C2%B5m%22&hl=en&as_sdt=2007&as_ylo=1950&as_yhi=2023"
0,"E Hysi","ON THE DEVELOPMENT OF PHOTOACOUSTIC IMAGING BIOMARKERS FOR CANCER TREATMENT MONITORING",2020,"","scholar.archive.org","https://scholar.archive.org/work/vp7rhemstbhnzp7uprt7r7m5qa/access/wayback/https://s3.ca-central-1.amazonaws.com/pstorage-ryerson-5010877717/31132801/HysiEno.pdf?X-Amz-Algorithm=AWS4-HMAC-SHA256&X-Amz-Credential=AKIA3OGA3B5WHYJSWH2T/20220923/ca-central-1/s3/aws4_request&X-Amz-Date=20220923T005040Z&X-Amz-Expires=10&X-Amz-SignedHeaders=host&X-Amz-Signature=afdb78c2f228edd337b4d1e33134e17620808039c04c42fe0b3d53b8e1b879c9","",691,"2023-07-26 09:55:10","PDF","","","",,,,,0,0.00,0,1,3,"… -induced changes in the tumor microenvironment are needed. … , number density and spacing of tumor blood vessels can be … drop in the oxygenation of the tumor as early as 30 minutes …","https://scholar.archive.org/work/vp7rhemstbhnzp7uprt7r7m5qa/access/wayback/https://s3.ca-central-1.amazonaws.com/pstorage-ryerson-5010877717/31132801/HysiEno.pdf?X-Amz-Algorithm=AWS4-HMAC-SHA256&X-Amz-Credential=AKIA3OGA3B5WHYJSWH2T/20220923/ca-central-1/s3/aws4_request&X-Amz-Date=20220923T005040Z&X-Amz-Expires=10&X-Amz-SignedHeaders=host&X-Amz-Signature=afdb78c2f228edd337b4d1e33134e17620808039c04c42fe0b3d53b8e1b879c9","https://scholar.google.com/scholar?q=related:VVZ_bl8N0PoJ:scholar.google.com/&scioq=%22vessel+size%22+%22vessel+density%22+%22tumor%22+%22mice%22+%22%C2%B5m%22&hl=en&as_sdt=2007&as_ylo=1950&as_yhi=2023"
45,"JF Adam, C Nemoz, A Bravin, ...","High-resolution blood–brain barrier permeability and blood volume imaging using quantitative synchrotron radiation computed tomography: study on an F98 rat brain …",2005,"Journal of Cerebral …","journals.sagepub.com","https://journals.sagepub.com/doi/abs/10.1038/sj.jcbfm.9600017","https://scholar.google.com/scholar?cites=1911473540336179055&as_sdt=2005&sciodt=2007&hl=en",692,"2023-07-26 09:55:10","","10.1038/sj.jcbfm.9600017","","",,,,,45,2.50,11,4,18,"… The spatial resolution of the CT slice was 47 × 47 μm 2 with a 0.5 mm slice … the tumor area: chaotic architecture, heterogeneity in size and shape of the vessels, increase in vessel size, …","https://journals.sagepub.com/doi/full/10.1038/sj.jcbfm.9600017","https://scholar.google.com/scholar?q=related:b9dLuQ7rhhoJ:scholar.google.com/&scioq=%22vessel+size%22+%22vessel+density%22+%22tumor%22+%22mice%22+%22%C2%B5m%22&hl=en&as_sdt=2007&as_ylo=1950&as_yhi=2023"
1,"W Reichardt, D von Elverfeldt","Preclinical Applications of Magnetic Resonance Imaging in Oncology",2020,"Molecular Imaging in Oncology","Springer","https://link.springer.com/chapter/10.1007/978-3-030-42618-7_12","https://scholar.google.com/scholar?cites=3502531086513244122&as_sdt=2005&sciodt=2007&hl=en",693,"2023-07-26 09:55:10","","10.1007/978-3-030-42618-7_12","","",,,,,1,0.33,1,2,3,"… of tumor vasculature (eg, blood flow, blood volume, vessel permeability, vessel size, vessel density) … Vessels diameters down to 100–200 μm can be visualized accordingly in clinical …","","https://scholar.google.com/scholar?q=related:2odiSnd9mzAJ:scholar.google.com/&scioq=%22vessel+size%22+%22vessel+density%22+%22tumor%22+%22mice%22+%22%C2%B5m%22&hl=en&as_sdt=2007&as_ylo=1950&as_yhi=2023"
1,"D Ribatti","Morphofunctional Aspects of Tumor Microcirculation",2012,"","books.google.com","https://books.google.com/books?hl=en&lr=&id=6TUoifPKAd0C&oi=fnd&pg=PR6&dq=%22vessel+size%22+%22vessel+density%22+%22tumor%22+%22mice%22+%22%C2%B5m%22&ots=uurob3JZNH&sig=Sd5_x5KDfDv2hD1CL4PGrNMTW_Q","https://scholar.google.com/scholar?cites=10151443461024230205&as_sdt=2005&sciodt=2007&hl=en",694,"2023-07-26 09:55:10","BOOK","","","",,,,,1,0.09,1,1,11,"… Tumor vessel density is very heterogeneous: the highest values are found in the invading tumor … tumors removed from untreated mice (control) or from mice treated with DXR-loaded, …","","https://scholar.google.com/scholar?q=related:PavPCwss4YwJ:scholar.google.com/&scioq=%22vessel+size%22+%22vessel+density%22+%22tumor%22+%22mice%22+%22%C2%B5m%22&hl=en&as_sdt=2007&as_ylo=1950&as_yhi=2023"
62,"G Thompson, SJ Mills, DJ Coope, ...","Imaging biomarkers of angiogenesis and the microvascular environment in cerebral tumours",2011,"The British journal of …","birpublications.org","https://www.birpublications.org/doi/abs/10.1259/bjr/66316279","https://scholar.google.com/scholar?cites=9583798192053083061&as_sdt=2005&sciodt=2007&hl=en",695,"2023-07-26 09:55:10","","10.1259/bjr/66316279","","",,,,,62,5.17,16,4,12,"… , with vessel diameters ranging from 3 to 40 µm [7] and formation of … quantitative measures of average vessel size (Rv) and … reflected a decrease in vessel density with a concomitant …","https://www.birpublications.org/doi/full/10.1259/bjr/66316279","https://scholar.google.com/scholar?q=related:tdtatK19AIUJ:scholar.google.com/&scioq=%22vessel+size%22+%22vessel+density%22+%22tumor%22+%22mice%22+%22%C2%B5m%22&hl=en&as_sdt=2007&as_ylo=1950&as_yhi=2023"
7,"Y Cao, X Yin, J Zhang, T Wu, D Li, H Lu, ...","Visualization of mouse spinal cord intramedullary arteries using phase-and attenuation-contrast tomographic imaging",2016,"Journal of Synchrotron …","scripts.iucr.org","https://scripts.iucr.org/cgi-bin/paper?S1600577516006482","https://scholar.google.com/scholar?cites=7114128837949815493&as_sdt=2005&sciodt=2007&hl=en",696,"2023-07-26 09:55:10","","10.1107/S1600577516006482","","",,,,,7,1.00,1,7,7,"… The intramedullary arteries, which are typically less than 10 µm in … The vessel density in the white matter was relatively lower [… Therefore, a true measurement of the vessel size was …","https://onlinelibrary.wiley.com/doi/full/10.1107/S1600577516006482","https://scholar.google.com/scholar?q=related:xXpcYHx2umIJ:scholar.google.com/&scioq=%22vessel+size%22+%22vessel+density%22+%22tumor%22+%22mice%22+%22%C2%B5m%22&hl=en&as_sdt=2007&as_ylo=1950&as_yhi=2023"
0,"E Ruoslahti, BURNHAM INST LA JOLLA CA","Targeting Therapy Resistant Tumor Vessels",2007,"","apps.dtic.mil","https://apps.dtic.mil/sti/citations/ADA489674","",697,"2023-07-26 09:55:10","","","","",,,,,0,0.00,0,2,16,"… we injected the mice with a phage library, perfused the mice to … change in vessel size (mean diameter 9.7 μm after vehicle … The reduction in CD31-positive vessel density at 21 days …","https://apps.dtic.mil/sti/pdfs/ADA489674.pdf","https://scholar.google.com/scholar?q=related:auixo5XIA_QJ:scholar.google.com/&scioq=%22vessel+size%22+%22vessel+density%22+%22tumor%22+%22mice%22+%22%C2%B5m%22&hl=en&as_sdt=2007&as_ylo=1950&as_yhi=2023"
0,"KA Bohn","Vascular remodeling is associated with increased permeability of experimental brain metastases of breast cancer",2011,"","ttu-ir.tdl.org","https://ttu-ir.tdl.org/handle/2346/85660","",698,"2023-07-26 09:55:10","","","","",,,,,0,0.00,0,1,12,"… , and simple counting techniques provide an adequate picture of vessel density, but fail to give an adequate summary of the functional status of the tumor vasculature. Not only are the …","https://ttu-ir.tdl.org/bitstream/handle/2346/85660/BOHN-DISS-2011.pdf?sequence=1","https://scholar.google.com/scholar?q=related:c2olAueRd2kJ:scholar.google.com/&scioq=%22vessel+size%22+%22vessel+density%22+%22tumor%22+%22mice%22+%22%C2%B5m%22&hl=en&as_sdt=2007&as_ylo=1950&as_yhi=2023"
258,"O Henri, C Pouehe, M Houssari, L Galas, L Nicol, ...","Selective stimulation of cardiac lymphangiogenesis reduces myocardial edema and fibrosis leading to improved cardiac function following myocardial infarction",2016,"Circulation","Am Heart Assoc","https://www.ahajournals.org/doi/abs/10.1161/circulationaha.115.020143","https://scholar.google.com/scholar?cites=5673731946986438226&as_sdt=2005&sciodt=2007&hl=en",699,"2023-07-26 09:55:10","","10.1161/circulationaha.115.020143","","",,,,,258,36.86,43,6,7,"… with a transient decrease in podoplanin + vessel density, and the relative percentage of … by vessel-size profiling, revealed that the relative frequency of small lymphatics (<15 μm …","https://www.ahajournals.org/doi/full/10.1161/CIRCULATIONAHA.115.020143","https://scholar.google.com/scholar?q=related:Un7pIiUlvU4J:scholar.google.com/&scioq=%22vessel+size%22+%22vessel+density%22+%22tumor%22+%22mice%22+%22%C2%B5m%22&hl=en&as_sdt=2007&as_ylo=1950&as_yhi=2023"
0,"MR DiStasi","Major collateral vessels develop from pre-existing small arteries through Rac2/Nox2 independent mechanisms",2009,"","search.proquest.com","https://search.proquest.com/openview/53a136488641876f601f66fa5be84a87/1?pq-origsite=gscholar&cbl=18750","",700,"2023-07-26 09:55:10","BOOK","","","",,,,,0,0.00,0,1,14,"… (50) noted that collateral vessel density in angiograms does not … animal size due to decreasing vessel size. Therefore, the … occlusion in our mice, we have observed 50-60 µm pre-…","https://scholarworks.iupui.edu/bitstream/handle/1805/1862/Distasi_Thesis_Revision-Round%202a.pdf?sequence=1","https://scholar.google.com/scholar?q=related:14SBI9TwfnEJ:scholar.google.com/&scioq=%22vessel+size%22+%22vessel+density%22+%22tumor%22+%22mice%22+%22%C2%B5m%22&hl=en&as_sdt=2007&as_ylo=1950&as_yhi=2023"
2,"K Ho","Targeted drug delivery to breast cancer using polymeric nanoparticle micelles",2012,"","library-archives.canada.ca","https://library-archives.canada.ca/eng/services/services-libraries/theses/Pages/item.aspx?idNumber=1032904095","https://scholar.google.com/scholar?cites=8600876662844249858&as_sdt=2005&sciodt=2007&hl=en",701,"2023-07-26 09:55:10","","","","",,,,,2,0.18,2,1,11,"… Based on these observations, MFP tumour-bearing mice were used to characterize the pharmacokinetics and biodistribution of a taxol drug, docetaxel, encapsulated in poly (TMCC-co-…","https://central.bac-lac.gc.ca/.item?id=TC-OTU-34054&op=pdf&app=Library&oclc_number=1032904095","https://scholar.google.com/scholar?q=related:AlfHZcFzXHcJ:scholar.google.com/&scioq=%22vessel+size%22+%22vessel+density%22+%22tumor%22+%22mice%22+%22%C2%B5m%22&hl=en&as_sdt=2007&as_ylo=1950&as_yhi=2023"
0,"YM Ju, A Atala, JJ Yoo","Vascularization of 3D Engineered Tissues",2020,"Tissue-Engineered Vascular Grafts","Springer","https://link.springer.com/content/pdf/10.1007/978-3-030-05336-9_22.pdf","",702,"2023-07-26 09:55:10","","10.1007/978-3-030-05336-9_22","","",,,,,0,0.00,0,3,3,"… scaffold led to enhanced vessel size and maturity at 6 weeks … in severely ischemic hindlimbs of a mice model. While a high … A recent study showed that pores with a diameter >250 μm …","","https://scholar.google.com/scholar?q=related:me_8fNEWiz4J:scholar.google.com/&scioq=%22vessel+size%22+%22vessel+density%22+%22tumor%22+%22mice%22+%22%C2%B5m%22&hl=en&as_sdt=2007&as_ylo=1950&as_yhi=2023"
10,"MA Nazeer, IC Karaoglu, O Ozer, C Albayrak, ...","Neovascularization of engineered tissues for clinical translation: Where we are, where we should be?",2021,"APL …","pubs.aip.org","https://pubs.aip.org/aip/apb/article/5/2/021503/235604","https://scholar.google.com/scholar?cites=13288823722208095231&as_sdt=2005&sciodt=2007&hl=en",703,"2023-07-26 09:55:10","HTML","","","",,,,,10,5.00,2,5,2,"… mean diffusion distance of 150–200 μm, a critical diffusion limit. … higher vessel density and lower vessel diameter in vivo 93 … the significant augmentation of maturity and vessel size 135 …","https://pubs.aip.org/aip/apb/article/5/2/021503/235604","https://scholar.google.com/scholar?q=related:_2v_pMRia7gJ:scholar.google.com/&scioq=%22vessel+size%22+%22vessel+density%22+%22tumor%22+%22mice%22+%22%C2%B5m%22&hl=en&as_sdt=2007&as_ylo=1950&as_yhi=2023"
0,"K Potthoff, U Fiedler, J Drevs","Vascular Biomarkers and Imaging Studies",2012,"… : Biomarkers and In Vitro/In Vivo …","Wiley Online Library","https://onlinelibrary.wiley.com/doi/pdf/10.1002/9781118230275#page=152","",704,"2023-07-26 09:55:10","","10.1002/9781118230275","","",,,,,0,0.00,0,3,11,"… 50 μm. Modern US techniques using contrast-enhanced US permit the measurement of tissue perfusion irrespective of vessel size or … density and blood vessel density in invasive breast …","","https://scholar.google.com/scholar?q=related:mmv105uZpqsJ:scholar.google.com/&scioq=%22vessel+size%22+%22vessel+density%22+%22tumor%22+%22mice%22+%22%C2%B5m%22&hl=en&as_sdt=2007&as_ylo=1950&as_yhi=2023"
0,"J Van Bommel, H Tilanus, J Bakker, D Gommers","Sublingual microcirculation is impaired on the first day postoperatively in patients undergoing gastric tube reconstruction",2007,"Critical Care","Springer","https://link.springer.com/article/10.1186/cc5425","",705,"2023-07-26 09:55:10","","10.1186/cc5425","","",,,,,0,0.00,0,4,16,"… cells with sodium sulfide (60–300 µM) reduced the loss of … In mice subjected to bacterial lipopolysaccharide (LPS, 5 mg/… gallbladders extirpated during pancreatic tumor surgery. The …","https://link.springer.com/content/pdf/10.1186/cc5425.pdf","https://scholar.google.com/scholar?q=related:BYVxac4PB7oJ:scholar.google.com/&scioq=%22vessel+size%22+%22vessel+density%22+%22tumor%22+%22mice%22+%22%C2%B5m%22&hl=en&as_sdt=2007&as_ylo=1950&as_yhi=2023"
0,"V Adhikarla","Imaging-based modeling of vasculature growth and response to anti-angiogenic therapy",2014,"","search.proquest.com","https://search.proquest.com/openview/de13172a3952cd2a9a562d3ae77a1038/1?pq-origsite=gscholar&cbl=18750","",706,"2023-07-26 09:55:10","HTML","","","",,,,,0,0.00,0,1,9,"… subsection of the tumor was scaled up to the resolution of 20 μm. ..… Increased hypoxia, lower vessel density and also slight … Changes in viscosity, blood vessel size, and network structure …","https://search.proquest.com/openview/de13172a3952cd2a9a562d3ae77a1038/1?pq-origsite=gscholar&cbl=18750","https://scholar.google.com/scholar?q=related:1s81YbgM39AJ:scholar.google.com/&scioq=%22vessel+size%22+%22vessel+density%22+%22tumor%22+%22mice%22+%22%C2%B5m%22&hl=en&as_sdt=2007&as_ylo=1950&as_yhi=2023"
482,"JC Adams","Thrombospondins: multifunctional regulators of cell interactions",2001,"Annual review of cell and developmental biology","annualreviews.org","https://www.annualreviews.org/doi/abs/10.1146/annurev.cellbio.17.1.25","https://scholar.google.com/scholar?cites=15936356642045038015&as_sdt=2005&sciodt=2007&hl=en",707,"2023-07-26 09:55:10","","10.1146/annurev.cellbio.17.1.25","","",,,,,482,21.91,482,1,22,"… Blood vessel density, platelet … vessel size and number. In a squamous carcinoma model, increased matrix assembly around the tumor also suggested a possible barrier effect on tumor …","https://www.annualreviews.org/doi/full/10.1146/annurev.cellbio.17.1.25","https://scholar.google.com/scholar?q=related:vw0Id-5PKd0J:scholar.google.com/&scioq=%22vessel+size%22+%22vessel+density%22+%22tumor%22+%22mice%22+%22%C2%B5m%22&hl=en&as_sdt=2007&as_ylo=1950&as_yhi=2023"
1,"PT Yemane","Ultrasound for the delivery of a nanocarrier across biological barriers in tumors: impact of cavitation and acoustic radiation force",2020,"","ntnuopen.ntnu.no","https://ntnuopen.ntnu.no/ntnu-xmlui/handle/11250/2645659","https://scholar.google.com/scholar?cites=4645007799040614621&as_sdt=2005&sciodt=2007&hl=en",708,"2023-07-26 09:55:10","","","","",,,,,1,0.33,1,1,3,"… a reduction in blood vessel density and limiting the access of drugs to distant tumor cells. Hence… The SonoVue (phospholipid shell, sulfur hexafluoride gas, diameter of 2.5 µm) UCA was …","https://ntnuopen.ntnu.no/ntnu-xmlui/bitstream/handle/11250/2645659/Petros%20Tesfamichael%20Yemane.pdf?sequence=3","https://scholar.google.com/scholar?q=related:3SC8oPthdkAJ:scholar.google.com/&scioq=%22vessel+size%22+%22vessel+density%22+%22tumor%22+%22mice%22+%22%C2%B5m%22&hl=en&as_sdt=2007&as_ylo=1950&as_yhi=2023"
3,"A Shakked, Z Petrover, A Aharonov, ...","Redifferentiated cardiomyocytes retain residual dedifferentiation signatures and are protected against ischemic injury",2023,"Nature Cardiovascular …","nature.com","https://www.nature.com/articles/s44161-023-00250-w","https://scholar.google.com/scholar?cites=9837965751075790734&as_sdt=2005&sciodt=2007&hl=en",709,"2023-07-26 09:55:10","","10.1101/2022.02.22.481415.full","","",,,,,3,3.00,1,4,1,"… highlighting vessel density and size (g), scale bars, 100 μm, … (j) for WT (27.5 mm 2 tissue quantified across n = 5 mice) … 3j) rather than average vessel size (Extended Data Fig. 8f). We …","https://www.biorxiv.org/content/10.1101/2022.02.22.481415.full.pdf","https://scholar.google.com/scholar?q=related:jt9UEbp5h4gJ:scholar.google.com/&scioq=%22vessel+size%22+%22vessel+density%22+%22tumor%22+%22mice%22+%22%C2%B5m%22&hl=en&as_sdt=2007&as_ylo=1950&as_yhi=2023"
0,"R Mylavarapu, MR Kulikauskas, C Dierkes, N Sobhani, ...","p53 plays a central role in lymphatic anomalies",2020,"bioRxiv","biorxiv.org","https://www.biorxiv.org/content/10.1101/2020.03.18.992784.abstract","",710,"2023-07-26 09:55:10","","10.1101/2020.03.18.992784.abstract","","",,,,,0,0.00,0,5,3,"… of its tumor suppressor activity or as the guardian of tissue homeostasis. … b) Average lymph vessel size quantification of 10 … for RP27M4 measured ∼257 μm, which was approximately …","https://www.biorxiv.org/content/biorxiv/early/2021/10/23/2020.03.18.992784.full.pdf","https://scholar.google.com/scholar?q=related:SpMkq6AYFCoJ:scholar.google.com/&scioq=%22vessel+size%22+%22vessel+density%22+%22tumor%22+%22mice%22+%22%C2%B5m%22&hl=en&as_sdt=2007&as_ylo=1950&as_yhi=2023"
12,"LM Chu, MP Robich, C Bianchi, ...","Effects of cyclooxygenase inhibition on cardiovascular function in a hypercholesterolemic swine model of chronic ischemia",2012,"American Journal …","journals.physiology.org","https://journals.physiology.org/doi/abs/10.1152/ajpheart.00146.2011","https://scholar.google.com/scholar?cites=17863882155205173264&as_sdt=2005&sciodt=2007&hl=en",711,"2023-07-26 09:55:10","","10.1152/ajpheart.00146.2011","","",,,,,12,1.09,3,4,11,"… diameter, depending on vessel size) were placed around the … -positive structures between 5 and 25 μm 2 in cross-sectional … Vessel density. Myocardial sections were stained for CD31 …","https://journals.physiology.org/doi/prev/20111028-aop/pdf/10.1152/ajpheart.00146.2011","https://scholar.google.com/scholar?q=related:EKBxWixC6fcJ:scholar.google.com/&scioq=%22vessel+size%22+%22vessel+density%22+%22tumor%22+%22mice%22+%22%C2%B5m%22&hl=en&as_sdt=2007&as_ylo=1950&as_yhi=2023"
0,"NV Soucy","Induction of angiogenesis by arsenic: Mechanisms for arsenic-induced vascular disease",2004,"","search.proquest.com","https://search.proquest.com/openview/1fc3b7ecb60739cf1b8886dbbd6a2cc9/1?pq-origsite=gscholar&cbl=18750&diss=y","",712,"2023-07-26 09:55:10","BOOK","","","",,,,,0,0.00,0,1,19,"… vessel density in a chicken chorioallantoic membrane (CAM) assay. The threshold As(III) concentration for this response was 0.033 µM … that the blood vessel size and density changes …","https://search.proquest.com/openview/1fc3b7ecb60739cf1b8886dbbd6a2cc9/1?pq-origsite=gscholar&cbl=18750&diss=y","https://scholar.google.com/scholar?q=related:OOcMLiOqZK0J:scholar.google.com/&scioq=%22vessel+size%22+%22vessel+density%22+%22tumor%22+%22mice%22+%22%C2%B5m%22&hl=en&as_sdt=2007&as_ylo=1950&as_yhi=2023"
1,"J Zhu","Imaging lymphatic system using high frame rate contrast enhanced and super-resolution ultrasound: in vitro, in vivo and clinical study",2020,"","spiral.imperial.ac.uk","https://spiral.imperial.ac.uk/handle/10044/1/84258","https://scholar.google.com/scholar?cites=9281862219207549004&as_sdt=2005&sciodt=2007&hl=en",713,"2023-07-26 09:55:10","","","","",,,,,1,0.33,1,1,3,"… Vessel size and blood flow velocity distributions were evaluated … μm which agrees with micro-CT data. In contrast, most vessels detected with Doppler techniques were larger than 80 μm…","https://spiral.imperial.ac.uk/bitstream/10044/1/84258/1/Zhu-J-2020-PhD-Thesis.pdf","https://scholar.google.com/scholar?q=related:TCD8zYLMz4AJ:scholar.google.com/&scioq=%22vessel+size%22+%22vessel+density%22+%22tumor%22+%22mice%22+%22%C2%B5m%22&hl=en&as_sdt=2007&as_ylo=1950&as_yhi=2023"
