Authors,Title,Publication,Volume,Number,Pages,Year,Publisher,Note
"Yttersian Sletta, Kristine; Tveitarås, Maria K; Lu, Ning; Engelsen, Agnete ST; Reed, Rolf K; Garmann-Johnsen, Annette; Stuhr, Linda; ",Oxygen-dependent regulation of tumor growth and metastasis in human breast cancer xenografts,PloS one,12,8,e0183254,2017,"Public Library of Science San Francisco, CA USA",Read
"Cai, Weibo; Chen, Kai; Mohamedali, Khalid A; Cao, Qizhen; Gambhir, Sanjiv S; Rosenblum, Michael G; Chen, Xiaoyuan; ",PET of vascular endothelial growth factor receptor expression,Journal of Nuclear Medicine,47,12,2048-2056,2006,Soc Nuclear Med,Read
"Zhou, Zhichao; Zhou, Rong-Rong; Guan, Hui; Bucana, Corazon D; Kleinerman, Eugenie S; ",E1A gene therapy inhibits angiogenesis in a Ewing's sarcoma animal model,Molecular cancer therapeutics,2,12,1313-1319,2003,AACR,Pass-no unit
"Klotzsche-von Ameln, Anne; Prade, Ina; Grosser, Marianne; Kettelhake, Antje; Rezaei, Maryam; Chavakis, Triantafyllos; Flamme, Ingo; Wielockx, Ben; Breier, Georg; ",PHD4 stimulates tumor angiogenesis in osteosarcoma cells via TGF-α,Molecular cancer research,11,11,1337-1348,2013,AACR,Pass-no unit
"Li, Hongzhong; Xiao, Yi; Li, Qin; Yao, Jun; Yuan, Xiangliang; Zhang, Yuan; Yin, Xuedong; Saito, Yohei; Fan, Huihui; Li, Ping; ",The allergy mediator histamine confers resistance to immunotherapy in cancer patients via activation of the macrophage histamine receptor H1,Cancer cell,40,1,36-52. e9,2022,Elsevier,Pass
"Bieniasz-Krzywiec, Paweł; Martín-Pérez, Rosa; Ehling, Manuel; García-Caballero, Melissa; Pinioti, Sotiria; Pretto, Samantha; Kroes, Roel; Aldeni, Chiara; Di Matteo, Mario; Prenen, Hans; ",Podoplanin-expressing macrophages promote lymphangiogenesis and lymphoinvasion in breast cancer,Cell metabolism,30,5,917-936. e10,2019,Elsevier,Pass
"Zielinski, Mark R; Muenchow, Melissa; Wallig, Matthew A; Horn, Peggy L; Woods, Jeffrey A; ",Exercise delays allogeneic tumor growth and reduces intratumoral inflammation and vascularization,Journal of applied physiology,96,6,2249-2256,2004,American Physiological Society,
"Tai, Kuo-Feng; Wang, Chien-Hsing; ",Using adenovirus armed short hairpin RNA targeting transforming growth factor β1 inhibits melanoma growth and metastasis in an ex vivo animal model,Annals of Plastic Surgery,71,,S75-S81,2013,LWW,Cannot access
"Gopinathan, Ganga; Milagre, Carla; Pearce, Oliver MT; Reynolds, Louise E; Hodivala-Dilke, Kairbaan; Leinster, David A; Zhong, Haihong; Hollingsworth, Robert E; Thompson, Richard; Whiteford, James R; ",Interleukin-6 stimulates defective angiogenesis,Cancer research,75,15,3098-3107,2015,AACR,Pass
"Wong, Ping-Pui; Muñoz-Félix, José M; Hijazi, Maruan; Kim, Hyojin; Robinson, Stephen D; De Luxán-Delgado, Beatriz; Rodríguez-Hernández, Irene; Maiques, Oscar; Meng, Ya-Ming; Meng, Qiong; ",Cancer burden is controlled by mural cell-β3-integrin regulated crosstalk with tumor cells,Cell,181,6,1346-1363. e21,2020,Elsevier,
"Wang, Yugang; Alam, Goleeta N; Ning, Yu; Visioli, Fernanda; Dong, Zhihong; Nör, Jacques E; Polverini, Peter J; ",The unfolded protein response induces the angiogenic switch in human tumor cells through the PERK/ATF4 pathway,Cancer research,72,20,5396-5406,2012,AACR,Pass-no unit
"Phan, Chiuyen; Zheng, Ziyang; Wang, Jianwei; Wang, Qiwen; Hu, Xiurong; Tang, Guping; Bai, Hongzhen; ",Enhanced antitumour effect for hepatocellular carcinoma in the advanced stage using a cyclodextrin-sorafenib-chaperoned inclusion complex,Biomaterials science,7,11,4758-4768,2019,Royal Society of Chemistry,Pass
"Kanwar, Jagat R; Palmano, Kate P; Sun, Xueying; Kanwar, Rupinder K; Gupta, Rita; Haggarty, Neill; Rowan, Angela; Ram, Satyendra; Krissansen, Geoffrey W; ",‘Iron‐saturated’lactoferrin is a potent natural adjuvant for augmenting cancer chemotherapy,Immunology and cell biology,86,3,277-288,2008,Wiley Online Library,Pass-no unit
"Wei, Yan; Song, Sha; Duan, Nianxiu; Wang, Feng; Wang, Yuxi; Yang, Yiwei; Peng, Chengyuan; Li, Junjun; Nie, Di; Zhang, Xinxin; ",MT1‐MMP‐Activated Liposomes to Improve Tumor Blood Perfusion and Drug Delivery for Enhanced Pancreatic Cancer Therapy,Advanced Science,7,17,1902746,2020,Wiley Online Library,Pass
"Hoshida, Tohru; Isaka, Naohide; Hagendoorn, Jeroen; di Tomaso, Emmanuelle; Chen, Yen-Lin; Pytowski, Bronislaw; Fukumura, Dai; Padera, Timothy P; Jain, Rakesh K; ",Imaging steps of lymphatic metastasis reveals that vascular endothelial growth factor-C increases metastasis by increasing delivery of cancer cells to lymph nodes: therapeutic implications,Cancer research,66,16,8065-8075,2006,AACR,Pass
"Russell, Samantha; Duquette, Mark; Liu, Joyce; Drapkin, Ronny; Lawler, Jack; Petrik, Jim; ",Combined therapy with thrombospondin-1 type I repeats (3TSR) and chemotherapy induces regression and significantly improves survival in a preclinical model of advanced stage epithelial ovarian cancer,The FASEB Journal,29,2,576,2015,The Federation of American Societies for Experimental Biology,Pass-no unit
"Roy-Luzarraga, Marina; Reynolds, Louise E; de Luxán-Delgado, Beatriz; Maiques, Oscar; Wisniewski, Laura; Newport, Emma; Rajeeve, Vinothini; Drake, Rebecca JG; Gómez-Escudero, Jesús; Richards, Frances M; ",Suppression of endothelial cell FAK expression reduces pancreatic ductal adenocarcinoma metastasis after gemcitabine treatment,Cancer Research,82,10,1909-1925,2022,AACR,Pass-no unit
"Olson, Karen A; Byers, H Randolph; Key, Marc E; Fett, James W; ",Inhibition of prostate carcinoma establishment and metastatic growth in mice by an antiangiogenin monoclonal antibody,International journal of cancer,98,6,923-929,2002,Wiley Online Library,Pass-no unit
"Gayed, Bishoy A; O’Malley, Katherine J; Pilch, Jan; Wang, Zhou; ",Digoxin inhibits blood vessel density and HIF‐1a expression in castration‐resistant C4‐2 xenograft prostate tumors,Clinical and translational science,5,1,39-42,2012,Wiley Online Library,Pass-no unit
"Liu, Bing; Goodwin, Julie E; ",The effect of glucocorticoids on angiogenesis in the treatment of solid tumors,Journal of cellular signaling,1,3,42,2020,NIH Public Access,Review
"Tamura, Kaoru; Aoyagi, Masaru; Ando, Noboru; Ogishima, Takahiro; Wakimoto, Hiroaki; Yamamoto, Masaaki; Ohno, Kikuo; ",Expansion of CD133-positive glioma cells in recurrent de novo glioblastomas after radiotherapy and chemotherapy,Journal of neurosurgery,119,5,1145-1155,2013,American Association of Neurological Surgeons,Human
"Tavora, Bernardo; Reynolds, Louise E; Batista, Silvia; Demircioglu, Fevzi; Fernandez, Isabelle; Lechertier, Tanguy; Lees, Delphine M; Wong, Ping-Pui; Alexopoulou, Annika; Elia, George; ",Endothelial-cell FAK targeting sensitizes tumours to DNA-damaging therapy,Nature,514,7520,112-116,2014,Nature Publishing Group UK London,
"Demircioglu, Fevzi; Wang, Jun; Candido, Juliana; Costa, Ana SH; Casado, Pedro; de Luxan Delgado, Beatriz; Reynolds, Louise E; Gomez-Escudero, Jesus; Newport, Emma; Rajeeve, Vinothini; ",Cancer associated fibroblast FAK regulates malignant cell metabolism,Nature communications,11,1,1290,2020,Nature Publishing Group UK London,
"Liang, Yayun; Benakanakere, Indira; Besch-Williford, Cynthia; Hyder, Ryyan S; Ellersieck, Mark R; Hyder, Salman M; ",Synthetic progestins induce growth and metastasis of BT-474 human breast cancer xenografts in nude mice,"Menopause (New York, NY)",17,5,1040,2010,NIH Public Access,Pass-no unit
"Fan, Peng; Qiang, Huiping; Liu, Zhenhua; Zhao, Qi; Wang, Ying; Liu, Tingkun; Wang, Xuan; Chu, Tianqing; Huang, Yuhui; Xu, Wei; ",Effective low-dose Anlotinib induces long-term tumor vascular normalization and improves anti-PD-1 therapy,Frontiers in Immunology,13,,937924,2022,Frontiers,Pass-no unit
"Kienast, Yvonne; Klein, Christian; Scheuer, Werner; Raemsch, Romi; Lorenzon, Erica; Bernicke, Dirk; Herting, Frank; Yu, Sidney; The, Huynh Hung; Martarello, Laurent; ","Ang-2-VEGF-A CrossMab, a novel bispecific human IgG1 antibody blocking VEGF-A and Ang-2 functions simultaneously, mediates potent antitumor, antiangiogenic, and antimetastatic efficacy",Clinical Cancer Research,19,24,6730-6740,2013,AACR,Pass-no unit
"Liao, Junbin; Jin, Huilin; Li, Shaoqiang; Xu, Lixia; Peng, Zhenwei; Wei, Guangyan; Long, Jianting; Guo, Yu; Kuang, Ming; Zhou, Qi; ",Apatinib potentiates irradiation effect via suppressing PI3K/AKT signaling pathway in hepatocellular carcinoma,Journal of Experimental & Clinical Cancer Research,38,,13-Jan,2019,Springer,Pass
"Omene, Coral; Bandera, Elisa V; ",Anti-VEGF therapy—a role in obesity-related breast cancer,Nature reviews. Endocrinology,14,6,329,2018,NIH Public Access,Review
"Feng, Bing; Zhou, Fangyuan; Wang, Dangge; Xu, Zhiai; Yu, Haijun; Li, Yaping; ",Gold nanomaterials for treatment of metastatic cancer,Science China Chemistry,59,,984-990,2016,Springer,Review
"Yin, Juan Juan; Zhang, Luhua; Munasinghe, Jeeva; Linnoila, R Ilona; Kelly, Kathleen; ",Cediranib/AZD2171 inhibits bone and brain metastasis in a preclinical model of advanced prostate cancer,Cancer research,70,21,8662-8673,2010,AACR,Pass-no unit
"Sloan, Erica K; Priceman, Saul J; Cox, Benjamin F; Yu, Stephanie; Pimentel, Matthew A; Tangkanangnukul, Veera; Arevalo, Jesusa MG; Morizono, Kouki; Karanikolas, Breanne DW; Wu, Lily; ",The sympathetic nervous system induces a metastatic switch in primary breast cancer,Cancer research,70,18,7042-7052,2010,AACR,Pass-no unit
"El-Salhy, Magdy; Hilding, L; Royson, H; Tjomsland, Veronica; ","Comparison between triple therapy with octreotide, galanin and serotonin vs. irinotecan or oxaliplatin in combination with 5-fluorouracil/leukovorin in human colon cancer",International journal of oncology,27,3,687-691,2005,Spandidos Publications,Cannot access
"Yumimoto, Kanae; Akiyoshi, Sayuri; Ueo, Hiroki; Sagara, Yasuaki; Onoyama, Ichiro; Ueo, Hiroaki; Ohno, Shinji; Mori, Masaki; Mimori, Koshi; Nakayama, Keiichi I; ",F-box protein FBXW7 inhibits cancer metastasis in a non-cell-autonomous manner,The Journal of clinical investigation,125,2,621-635,2015,Am Soc Clin Investig,Pass
"Liang, Yayun; Mafuvadze, Benford; Besch-Williford, Cynthia; Hyder, Salman M; ",A combination of p53-activating APR-246 and phosphatidylserine-targeting antibody potently inhibits tumor development in hormone-dependent mutant p53-expressing breast cancer xenografts,Breast Cancer: Targets and Therapy,,,53-67,2018,Taylor & Francis,Pass-no unit
"Baeriswyl, Vanessa; Christofori, Gerhard; ",The angiogenic switch in carcinogenesis,Seminars in cancer biology,19,5,329-337,2009,Elsevier,Review
"McElroy, Michele K; Kaushal, Sharmeela; Tran Cao, Hop S; Moossa, AR; Talamini, Mark A; Hoffman, Robert M; Bouvet, Michael; ",Upregulation of thrombospondin-1 and angiogenesis in an aggressive human pancreatic cancer cell line selected for high metastasis,Molecular cancer therapeutics,8,7,1779-1786,2009,AACR,Pass-different unit
"He, Qianyuan; Zhang, Zhanjie; Liu, Haojie; Tuo, Zhan; Zhou, Jie; Hu, Yan; Sun, Yajie; Wan, Chao; Xu, Zushun; Lovell, Jonathan F; ",Relieving immunosuppression during long-term anti-angiogenesis therapy using photodynamic therapy and oxygen delivery,Nanoscale,12,27,14788-14800,2020,Royal Society of Chemistry,Pass-no unit
"Päll, Taavi; Pink, Anne; Kasak, Lagle; Turkina, Marina; Anderson, Wally; Valkna, Andres; Kogerman, Priit; ",Soluble CD44 interacts with intermediate filament protein vimentin on endothelial cell surface,PloS one,6,12,e29305,2011,"Public Library of Science San Francisco, USA",Pass
"Sartippour, Maryam R; Heber, David; Zhang, Liping; Beatty, Perrin; Elashoff, David; Elashoff, Robert; Go, Vay Liang; Brooks, Mai N; ",Inhibition of fibroblast growth factors by green tea,International journal of oncology,21,3,487-491,2002,Spandidos Publications,Cannot access
"Klotzsche-von Ameln, Anne; Prade, Ina; Grosser, Marianne; Kettelhake, Antje; Rezaei, Maryam; Flamme, Ingo; Wielockx, Ben; Breier, Georg; ",Prolyl hydroxylase-4 overexpression stimulates tumor angiogenesis in mouse osteosarcoma via transforming growth factor-α,,,,,,,Pass-no unit
"Abounader, Roger; Laterra, John; ",Scatter factor/hepatocyte growth factor in brain tumor growth and angiogenesis,Neuro-oncology,7,4,436-451,2005,Oxford University Press,Review
"Baker, Marianne; Reynolds, Louise E; Robinson, Stephen D; Lees, Delphine M; Parsons, Maddy; Elia, George; Hodivala-Dilke, Kairbaan; ","Stromal Claudin14-heterozygosity, but not deletion, increases tumour blood leakage without affecting tumour growth",PloS one,8,5,e62516,2013,"Public Library of Science San Francisco, USA",
"Wu, Shan; Wang, Yu; Guo, Jinsong; Chen, Qunzhi; Zhang, Jue; Fang, Jing; ",Nanosecond pulsed electric fields inhibit breast cancer development and suppress tumor blood vessel growth,2013 19th IEEE Pulsed Power Conference (PPC),,,5-Jan,2013,IEEE,Pass
"Zhang, Ming-Zhi; Xu, Jie; Yao, Bing; Yin, Huiyong; Cai, Qiuyin; Shrubsole, Martha J; Chen, Xiwu; Kon, Valentina; Zheng, Wei; Pozzi, Ambra; ",Inhibition of 11β–hydroxysteroid dehydrogenase type II selectively blocks the tumor COX-2 pathway and suppresses colon carcinogenesis in mice and humans,The Journal of clinical investigation,119,4,876-885,2009,Am Soc Clin Investig,Pass
"Carminati, Laura; Pinessi, Denise; Borsotti, Patrizia; Minoli, Lucia; Giavazzi, Raffaella; D’Incalci, Maurizio; Belotti, Dorina; Taraboletti, Giulia; ",Antimetastatic and antiangiogenic activity of trabectedin in cutaneous melanoma,Carcinogenesis,40,2,303-312,2019,Oxford University Press UK,Pass-no unit
"Jiao, Hongliang; Guan, Fangxia; Yang, Bo; Li, Jianbin; Shan, Hong; Song, Laijun; Hu, Xiang; Du, Ying; ",Human umbilical cord blood-derived mesenchymal stem cells inhibit C6 glioma via downregulation of cyclin D1,Neurology India,59,2,241,2011,Medknow Publications,Pass-no unit
"Eklund, Lauri; Bry, Maija; Alitalo, Kari; ",Mouse models for studying angiogenesis and lymphangiogenesis in cancer,Molecular oncology,7,2,259-282,2013,Elsevier,Review
"Campbell, Nicole E; Greenaway, James; Henkin, Jack; Moorehead, Roger A; Petrik, Jim; ",The thrombospondin-1 mimetic ABT-510 increases the uptake and effectiveness of cisplatin and paclitaxel in a mouse model of epithelial ovarian cancer,Neoplasia,12,3,275-283,2010,Elsevier,Pass-no unit
"Dandachi, Nadine; Kelly, Neil J; Wood, John P; Burton, Christine L; Radder, Josiah E; Leme, Adriana S; Gregory, Alyssa D; Shapiro, Steven D; ",Macrophage elastase induces TRAIL-mediated tumor cell death through its carboxy-terminal domain,American Journal of Respiratory and Critical Care Medicine,196,3,353-363,2017,American Thoracic Society,Pass
"Zhang, Wenting; Fan, Wei; Rachagani, Satyanarayana; Zhou, Zhengyuan; Lele, Subodh M; Batra, Surinder K; Garrison, Jered C; ","Comparative study of subcutaneous and orthotopic mouse models of prostate cancer: vascular perfusion, vasculature density, hypoxic burden and BB2r-targeting efficacy",Scientific reports,9,1,11117,2019,Nature Publishing Group UK London,
"Norris, Andrew J; Sartippour, Maryam R; Lu, Ming; Park, Taylor; Rao, Jian Yu; Jackson, Matthew I; Fukuto, Jon M; Brooks, Mai N; ",Nitroxyl inhibits breast tumor growth and angiogenesis,International journal of cancer,122,8,1905-1910,2008,Wiley Online Library,Pass-no unit
"Bertrand, Charlotte; Van Meerbeeck, Pierre; de Streel, Grégoire; Vaherto-Bleeckx, Noora; Benhaddi, Fatima; Rouaud, Loïc; Noël, Agnès; Coulie, Pierre G; van Baren, Nicolas; Lucas, Sophie; ",Combined Blockade of GARP: TGF-β1 and PD-1 Increases Infiltration of T Cells and Density of Pericyte-Covered GARP+ Blood Vessels in Mouse MC38 Tumors,Frontiers in Immunology,12,,704050,2021,Frontiers Media SA,
"Lattier, John M; Yang, Hua; Crawford, Susan; Grossniklaus, Hans E; ",Host pigment epithelium-derived factor (PEDF) prevents progression of liver metastasis in a mouse model of uveal melanoma,Clinical & experimental metastasis,30,,969-976,2013,Springer,Cannot access
"Liu, Lin; Qin, Shukui; Zheng, Yinghui; Han, Li; Zhang, Minmin; Luo, Nuo; Liu, Zhengcao; Gu, Ning; Gu, Xiaoyi; Yin, Xiaojin; ",Molecular targeting of VEGF/VEGFR signaling by the anti-VEGF monoclonal antibody BD0801 inhibits the growth and induces apoptosis of human hepatocellular carcinoma cells in vitro and in vivo,Cancer biology & therapy,18,3,166-176,2017,Taylor & Francis,Pass-no unit
"Lenz, G; Wright, G; Dave, SS; Xiao, W; Powell, J; Zhao, H; Xu, W; Tan, B; Goldschmidt, N; Iqbal, Javeed; ",Stromal gene signatures in large-B-cell lymphomas,New England Journal of Medicine,359,22,2313-2323,2008,Mass Medical Soc,Pass-different unit
"Liang, Yayun; Besch-Williford, Cynthia; Benakanakere, Indira; Thorpe, Philip E; Hyder, Salman M; ",Targeting mutant p53 protein and the tumor vasculature: an effective combination therapy for advanced breast tumors,Breast cancer research and treatment,125,,407-420,2011,Springer,
"Ten Voorde, Anna MW; Wierenga, Annemijn PA; Nell, Rogier J; van der Velden, Pieter A; Luyten, Gregorius PM; Verdijk, Robert M; Jager, Martine J; ","In uveal melanoma, angiopoietin-2 but not angiopoietin-1 is increased in high-risk tumors, providing a potential druggable target",Cancers,13,16,3986,2021,MDPI,Pass
"Germain, Mitchel; De Arcangelis, Adèle; Robinson, Stephen D; Baker, Marianne; Tavora, Bernardo; d'Amico, Gabriela; Silva, Rita; Kostourou, Vassiliki; Reynolds, Louise E; Watson, Alan; ",Genetic ablation of the alpha 6‐integrin subunit in Tie1Cre mice enhances tumour angiogenesis,The Journal of Pathology: A Journal of the Pathological Society of Great Britain and Ireland,220,3,370-381,2010,Wiley Online Library,
"Franco, Claudio A; Blanc, Jocelyne; Parlakian, Ara; Blanco, Raquel; Aspalter, Irene M; Kazakova, Natalia; Diguet, Nicolas; Mylonas, Elena; Gao-Li, Jacqueline; Vaahtokari, Anne; ",SRF selectively controls tip cell invasive behavior in angiogenesis,Development,140,11,2321-2333,2013,Company of Biologists,
"Blasiak, Barbara; Tomanek, Boguslaw; Abulrob, Abedelnasser; Iqbal, Umar; Stanimirovic, Danica; Albaghdadi, Homam; Foniok, Tadeusz; Lun, Xueqing; Forsyth, Peter; Sutherland, Garnette R; ",Detection of T2 changes in an early mouse brain tumor,Magnetic Resonance Imaging,28,6,784-789,2010,Elsevier,Pass-different unit
"Seril, Darren N; Liao, Jie; Yang, Guang‐Yu; ",Colorectal carcinoma development in inducible nitric oxide synthase‐deficient mice with dextran sulfate sodium‐induced ulcerative colitis,Molecular Carcinogenesis: Published in cooperation with the University of Texas MD Anderson Cancer Center,46,5,341-353,2007,Wiley Online Library,Pass-no unit
"Yang, Li; DeBusk, Laura M; Fukuda, Koari; Fingleton, Barbara; Green-Jarvis, Brenda; Shyr, Yu; Matrisian, Lynn M; Carbone, David P; Lin, P Charles; ",Expansion of myeloid immune suppressor Gr+ CD11b+ cells in tumor-bearing host directly promotes tumor angiogenesis,Cancer cell,6,4,409-421,2004,Elsevier,Pass-no unit
"Aguiar, Rodrigo Barbosa de; Moraes, Jane Zveiter de; ",Exploring the immunological mechanisms underlying the anti-vascular endothelial growth factor activity in tumors,Frontiers in immunology,10,,1023,2019,Frontiers Media SA,Review
"Pedrosa, Ana-Rita; Bodrug, Natalia; Gomez-Escudero, Jesus; Carter, Edward P; Reynolds, Louise E; Georgiou, Paraskivi Natalia; Fernandez, Isabelle; Lees, Delphine M; Kostourou, Vassiliki; Alexopoulou, Annika N; ",Tumor angiogenesis is differentially regulated by phosphorylation of endothelial cell focal adhesion kinase tyrosines-397 and-861,Cancer research,79,17,4371-4386,2019,AACR,
"Hicks, Martin J; Funato, Kosuke; Wang, Lan; Aronowitz, Eric; Dyke, Jonathan P; Ballon, Douglas J; Havlicek, David F; Frenk, Esther Z; De, Bishnu P; Chiuchiolo, Maria J; ",Genetic modification of neurons to express bevacizumab for local anti-angiogenesis treatment of glioblastoma,Cancer gene therapy,22,1,8-Jan,2015,Nature Publishing Group,Pass-no unit
"Poff, Angela M; Ari, Csilla; Seyfried, Thomas N; D’Agostino, Dominic P; ",The ketogenic diet and hyperbaric oxygen therapy prolong survival in mice with systemic metastatic cancer,PloS one,8,6,e65522,2013,"Public Library of Science San Francisco, USA",Pass
"Tan, Juntao; Yang, Nuo; Zhong, Liping; Tan, Jie; Hu, Zixi; Zhao, Qing; Gong, Wenlin; Zhang, Zhenghua; Zheng, Rong; Lai, Zongqiang; ",A new theranostic system based on endoglin aptamer conjugated fluorescent silica nanoparticles,Theranostics,7,19,4862,2017,Ivyspring International Publisher,Pass-no unit
"Jaggi, Jaspreet Singh; Henke, Erik; Seshan, Surya V; Kappel, Barry J; Chattopadhyay, Debjit; May, Chad; McDevitt, Michael R; Nolan, Daniel; Mittal, Vivek; Benezra, Robert; ",Selective alpha-particle mediated depletion of tumor vasculature with vascular normalization,PLoS One,2,3,e267,2007,"Public Library of Science San Francisco, USA",Pass
"Yoshii, Yukie; Yoshimoto, Mitsuyoshi; Matsumoto, Hiroki; Furukawa, Takako; Zhang, Ming-Rong; Inubushi, Masayuki; Tsuji, Atsushi B; Fujibayashi, Yasuhisa; Higashi, Tatsuya; Saga, Tsuneo; ",64Cu-ATSM internal radiotherapy to treat tumors with bevacizumab-induced vascular decrease and hypoxia in human colon carcinoma xenografts,Oncotarget,8,51,88815,2017,"Impact Journals, LLC",Pass-no unit
"Dace, Dru Samuel; ","The Role of Interferon-Gamma, Cd4-Positive T Cells, and Cd8-Positive T Cells in the Immune Rejection of Intraocular Tumors",,,,,2007,,Pass-thesis
"Ruotsalainen, Janne; Lopez‐Ramos, Dorys; Rogava, Meri; Shridhar, Naveen; Glodde, Nicole; Gaffal, Evelyn; Hölzel, Michael; Bald, Tobias; Tüting, Thomas; ",The myeloid cell type I IFN system promotes antitumor immunity over pro‐tumoral inflammation in cancer T‐cell therapy,Clinical & Translational Immunology,10,4,e1276,2021,Wiley Online Library,Pass-no unit
"McCormack, Paul L; Keam, Susan J; ",Bevacizumab: a review of its use in metastatic colorectal cancer,Drugs,68,,487-506,2008,Springer,Review
"Dudek, Arkadiusz Z; Zwolak, Pawel; Jasinski, Piotr; Terai, Kaoru; Gallus, Nathan J; Ericson, Marna E; Farassati, Faris; ",Protein kinase C-β inhibitor enzastaurin (LY317615. HCI) enhances radiation control of murine breast cancer in an orthotopic model of bone metastasis,Investigational new drugs,26,,13-24,2008,Springer,
"Watson, Alan R; Pitchford, Simon C; Reynolds, Louise E; Direkze, Natalie; Brittan, Mairi; Alison, Malcolm R; Rankin, Sara; Wright, Nicholas A; Hodivala‐Dilke, Kairbaan M; ",Deficiency of bone marrow β3‐integrin enhances non‐functional neovascularization,The Journal of Pathology: A Journal of the Pathological Society of Great Britain and Ireland,220,4,435-445,2010,Wiley Online Library,Pass
"Takeichi, Takayuki; Mocevicius, Paulius; Deduchovas, Olegas; Salnikova, Olga; Castro‐Santa, Edward; Büchler, Markus W; Schmidt, Jan; Ryschich, Eduard; ",αLβ2 Integrin is indispensable for CD8+ T‐cell recruitment in experimental pancreatic and hepatocellular cancer,International journal of cancer,130,9,2067-2076,2012,Wiley Online Library,
"Maione, Federica; Molla, Fabiola; Meda, Claudia; Latini, Roberto; Zentilin, Lorena; Giacca, Mauro; Seano, Giorgio; Serini, Guido; Bussolino, Federico; Giraudo, Enrico; ",Semaphorin 3A is an endogenous angiogenesis inhibitor that blocks tumor growth and normalizes tumor vasculature in transgenic mouse models,The Journal of clinical investigation,119,11,3356-3372,2009,Am Soc Clin Investig,Pass
"Moen, Ingrid; Jevne, Charlotte; Wang, Jian; Kalland, Karl-Henning; Chekenya, Martha; Akslen, Lars A; Sleire, Linda; Enger, Per Ø; Reed, Rolf K; Øyan, Anne M; ",Gene expression in tumor cells and stroma in dsRed 4T1 tumors in eGFP-expressing mice with and without enhanced oxygenation,BMC cancer,12,1,10-Jan,2012,BioMed Central,
"Liu, Bing; Pan, Shangha; Dong, Xuesong; Qiao, Haiquan; Jiang, Hongchi; Krissansen, Geoffrey W; Sun, Xueying; ",Opposing effects of arsenic trioxide on hepatocellular carcinomas in mice,Cancer science,97,7,675-681,2006,Wiley Online Library,Pass-no unit
"Cong, Zhuangzhuang; Diao, Yifei; Li, Xiaokun; Jiang, Zhisheng; Xu, Yang; Zhou, Hai; Qiang, Yong; Wu, Haiwei; Shen, Yi; ",Long non-coding RNA linc00665 interacts with YB-1 and promotes angiogenesis in lung adenocarcinoma,Biochemical and Biophysical Research Communications,527,2,545-552,2020,Elsevier,
"Schiffelers, Raymond M; Metselaar, Josbert M; Fens, Marcel HAM; Janssen, Adriänne PCA; Molema, Grietje; Storm, Gert; ",Liposome-encapsulated prednisolone phosphate inhibits growth of established tumors in mice,Neoplasia,7,2,118-127,2005,Elsevier,Pass
"Wu, Shan; Wang, Yu; Guo, Jinsong; Chen, Qunzhi; Zhang, Jue; Fang, Jing; ",Nanosecond pulsed electric fields as a novel drug free therapy for breast cancer: an in vivo study,Cancer letters,343,2,268-274,2014,Elsevier,
"Yang, Yali; Bai, Jingxiang; Shen, Rulong; Brown, Sharron AN; Komissarova, Elena; Huang, Ying; Jiang, Ning; Alberts, Gregory F; Costa, Max; Lu, Luo; ",Polo-like kinase 3 functions as a tumor suppressor and is a negative regulator of hypoxia-inducible factor-1α under hypoxic conditions,Cancer research,68,11,4077-4085,2008,AACR,Pass-no unit
"Tao, Qianying; Qi, Yingxue; Gu, Jiayi; Yu, Die; Lu, Yuxin; Liu, Jianwen; Liang, Xin; ",Breast cancer cells-derived Von Willebrand Factor promotes VEGF-A-related angiogenesis through PI3K/Akt-miR-205-5p signaling pathway,Toxicology and Applied Pharmacology,440,,115927,2022,Elsevier,Pass
"Chiu, David Kung‐Chun; Xu, Iris Ming‐Jing; Lai, Robin Kit‐Ho; Tse, Aki Pui‐Wah; Wei, Larry Lai; Koh, Hui‐Yu; Li, Lynna Lan; Lee, Derek; Lo, Regina Cheuk‐Lam; Wong, Chun‐Ming; ",Hypoxia induces myeloid‐derived suppressor cell recruitment to hepatocellular carcinoma through chemokine (C‐C motif) ligand 26,Hepatology,64,3,797-813,2016,Wiley Online Library,Pass-no unit
"Di Matteo, P; Hackl, C; Jedeszko, C; Valentinis, B; Bordignon, Claudio; Traversari, C; Kerbel, RS; Rizzardi, GP; ","NGR-TNF, a novel vascular-targeting agent, does not induce cytokine recruitment of proangiogenic bone marrow-derived cells",British journal of cancer,109,2,360-369,2013,Nature Publishing Group,Pass-no unit
