Cites,Authors,Title,Year,Source,Publisher,ArticleURL,CitesURL,GSRank,QueryDate,Type,DOI,ISSN,CitationURL,Volume,Issue,StartPage,EndPage,ECC,CitesPerYear,CitesPerAuthor,AuthorCount,Age,Abstract,FullTextURL,RelatedURL
171,"AC Tufan, NL Satiroglu-Tufan","The chick embryo chorioallantoic membrane as a model system for the study of tumor angiogenesis, invasion and development of anti-angiogenic agents",2005,"Current cancer drug targets","ingentaconnect.com","https://www.ingentaconnect.com/content/ben/ccdt/2005/00000005/00000004/art00002","https://scholar.google.com/scholar?cites=1269612462197576988&as_sdt=2005&sciodt=2007&hl=en",454,"2023-07-26 09:55:10","","","","",,,,,171,9.50,86,2,18,"… In this assay monolayer of 1 µm beads is deposited on the … , which is directly proportional to the vessel size. Thus, due to … alteration in angiogenesis include vessel density, new vessel …","https://www.researchgate.net/profile/N-Lale-Satiroglu-Tufan/publication/7768734_The_Chick_Embryo_Chorioallantoic_Membrane_as_a_Model_System_for_the_Study_of_Tumor_Angiogenesis_Invasion_and_Development_of_Anti-Angiogenic_Agents/links/5875d60108ae329d62213f45/The-Chick-Embryo-Chorioallantoic-Membrane-as-a-Model-System-for-the-Study-of-Tumor-Angiogenesis-Invasion-and-Development-of-Anti-Angiogenic-Agents.pdf","https://scholar.google.com/scholar?q=related:HBWyw86RnhEJ:scholar.google.com/&scioq=%22vessel+size%22+%22vessel+density%22+%22tumor%22+%22mice%22+%22%C2%B5m%22&hl=en&as_sdt=2007&as_ylo=1950&as_yhi=2023"
24,"N Rohr-Udilova, E Bauer, G Timelthaler, R Eferl, ...","Impact of glutathione peroxidase 4 on cell proliferation, angiogenesis and cytokine production in hepatocellular carcinoma",2018,"Oncotarget","ncbi.nlm.nih.gov","https://www.ncbi.nlm.nih.gov/pmc/articles/PMC5839371/","https://scholar.google.com/scholar?cites=6539591943816703896&as_sdt=2005&sciodt=2007&hl=en",455,"2023-07-26 09:55:10","HTML","","","",,,,,24,4.80,5,5,5,"… were incubated with 200 µM H 2 O 2 or with 30 µM LOOH for the … exhibited an increased vessel density but decreased vessel … led to a decreased average vessel size and a reduced …","https://www.ncbi.nlm.nih.gov/pmc/articles/PMC5839371/","https://scholar.google.com/scholar?q=related:mG8zgzlMwVoJ:scholar.google.com/&scioq=%22vessel+size%22+%22vessel+density%22+%22tumor%22+%22mice%22+%22%C2%B5m%22&hl=en&as_sdt=2007&as_ylo=1950&as_yhi=2023"
59,"AC James, JO Szot, K Iyer, JA Major, ...","Notch4 reveals a novel mechanism regulating Notch signal transduction",2014,"… Et Biophysica Acta (BBA …","Elsevier","https://www.sciencedirect.com/science/article/pii/S0167488914000998","https://scholar.google.com/scholar?cites=970006283249171586&as_sdt=2005&sciodt=2007&hl=en",456,"2023-07-26 09:55:10","HTML","","","",,,,,59,6.56,12,5,9,"… To determine the phenotype of mice lacking Notch4 we generated mice from embryonic stem (ES) cells targeted to replace the entire Notch4 coding sequence with LacZ and neo …","https://www.sciencedirect.com/science/article/pii/S0167488914000998","https://scholar.google.com/scholar?q=related:grz2RpMndg0J:scholar.google.com/&scioq=%22vessel+size%22+%22vessel+density%22+%22tumor%22+%22mice%22+%22%C2%B5m%22&hl=en&as_sdt=2007&as_ylo=1950&as_yhi=2023"
12,"AB Satterlee, DE Dunn, DC Lo, S Khagi, ...","Tumoricidal stem cell therapy enables killing in novel hybrid models of heterogeneous glioblastoma",2019,"Neuro …","academic.oup.com","https://academic.oup.com/neuro-oncology/article-abstract/21/12/1552/5550912","https://scholar.google.com/scholar?cites=11813582172538551360&as_sdt=2005&sciodt=2007&hl=en",457,"2023-07-26 09:55:10","","","","",,,,,12,3.00,2,5,4,"… Tumor implantation into female athymic nude mice was carried out as … Tumor-bearing brains in OCT were sectioned at 6 μm … periphery, and vessel density decreases while vessel size …","https://academic.oup.com/neuro-oncology/article-pdf/21/12/1552/31557267/noz138.pdf","https://scholar.google.com/scholar?q=related:QDwMF2VG8qMJ:scholar.google.com/&scioq=%22vessel+size%22+%22vessel+density%22+%22tumor%22+%22mice%22+%22%C2%B5m%22&hl=en&as_sdt=2007&as_ylo=1950&as_yhi=2023"
29,"V Martín-Granado, S Ortiz-Rivero, R Carmona, ...","C3G promotes a selective release of angiogenic factors from activated mouse platelets to regulate angiogenesis and tumor metastasis",2017,"Oncotarget","ncbi.nlm.nih.gov","https://www.ncbi.nlm.nih.gov/pmc/articles/PMC5762300/","https://scholar.google.com/scholar?cites=11587908563114520379&as_sdt=2005&sciodt=2007&hl=en",458,"2023-07-26 09:55:10","HTML","","","",,,,,29,4.83,7,4,6,"… sections, from the indicated genotypes, showing vessel density by CD31 staining. Scale bars: 20 µm. Quantification of vessel number (D) and vessel size (E) in tumor sections from the …","https://www.ncbi.nlm.nih.gov/pmc/articles/PMC5762300/","https://scholar.google.com/scholar?q=related:O-8lWnGF0KAJ:scholar.google.com/&scioq=%22vessel+size%22+%22vessel+density%22+%22tumor%22+%22mice%22+%22%C2%B5m%22&hl=en&as_sdt=2007&as_ylo=1950&as_yhi=2023"
279,"G Voros, E Maquoi, D Demeulemeester, N Clerx, ...","Modulation of angiogenesis during adipose tissue development in murine models of obesity",2005,"…","academic.oup.com","https://academic.oup.com/endo/article-abstract/146/10/4545/2500303","https://scholar.google.com/scholar?cites=12916859468509281562&as_sdt=2005&sciodt=2007&hl=en",459,"2023-07-26 09:55:10","","","","",,,,,279,15.50,56,5,18,"… Blood vessels were visualized by staining 10-μm paraffin … vessel size and lower vessel density in tissues of obese mice, but … mice on HFD for 2 wk, but not for 5 or 15 wk, compared with …","https://academic.oup.com/endo/article/146/10/4545/2500303","https://scholar.google.com/scholar?q=related:Gv0iCkDnQbMJ:scholar.google.com/&scioq=%22vessel+size%22+%22vessel+density%22+%22tumor%22+%22mice%22+%22%C2%B5m%22&hl=en&as_sdt=2007&as_ylo=1950&as_yhi=2023"
76,"DO Schwenke, JT Pearson, ...","Imaging of the pulmonary circulation in the closed-chest rat using synchrotron radiation microangiography",2007,"Journal of applied …","journals.physiology.org","https://journals.physiology.org/doi/abs/10.1152/japplphysiol.00596.2006","https://scholar.google.com/scholar?cites=9993507282575193973&as_sdt=2005&sciodt=2007&hl=en",460,"2023-07-26 09:55:10","","10.1152/japplphysiol.00596.2006","","",,,,,76,4.75,25,3,16,"… 100 μm; 28 vessels had a diameter between 100 and 200 μm… The relationship between vessel size and the magnitude of … structural changes in pulmonary vessel density, and changes …","https://journals.physiology.org/doi/full/10.1152/japplphysiol.00596.2006","https://scholar.google.com/scholar?q=related:dXcs9uwRsIoJ:scholar.google.com/&scioq=%22vessel+size%22+%22vessel+density%22+%22tumor%22+%22mice%22+%22%C2%B5m%22&hl=en&as_sdt=2007&as_ylo=1950&as_yhi=2023"
20,"S Metcalf, HS Pandha, R Morgan","Antiangiogenic effects of zoledronate on cancer neovasculature",2011,"Future Oncology","Future Medicine","https://www.futuremedicine.com/doi/abs/10.2217/fon.11.113","https://scholar.google.com/scholar?cites=9867222006388886397&as_sdt=2005&sciodt=2007&hl=en",461,"2023-07-26 09:55:10","","10.2217/fon.11.113","","",,,,,20,1.67,7,3,12,"… after 24 h of incubation with 50 µM ZA; however, without a … morbidity as well as mean vessel density. However, these results … magnetic resonance imaging and vessel size imaging: a …","","https://scholar.google.com/scholar?q=related:fQu60iJq74gJ:scholar.google.com/&scioq=%22vessel+size%22+%22vessel+density%22+%22tumor%22+%22mice%22+%22%C2%B5m%22&hl=en&as_sdt=2007&as_ylo=1950&as_yhi=2023"
2,"P Yazbeck, X Cullere, P Bennett, V Yajnik, ...","DOCK4 regulation of Rho GTPases mediates pulmonary vascular barrier function",2022,"… and Vascular Biology","Am Heart Assoc","https://www.ahajournals.org/doi/abs/10.1161/ATVBAHA.122.317565","https://scholar.google.com/scholar?cites=4832412355869005309&as_sdt=2005&sciodt=2007&hl=en",462,"2023-07-26 09:55:10","","10.1161/ATVBAHA.122.317565","","",,,,,2,2.00,0,5,1,"… 20 and 200 μm in the greatest diameter in lungs from D4 −/− and wt mice was determined. … in vessel density and lumen size. However, in our viable Dock4 −/− mice, vessel size and …","https://www.ahajournals.org/doi/pdf/10.1161/ATVBAHA.122.317565","https://scholar.google.com/scholar?q=related:_dXHN28tEEMJ:scholar.google.com/&scioq=%22vessel+size%22+%22vessel+density%22+%22tumor%22+%22mice%22+%22%C2%B5m%22&hl=en&as_sdt=2007&as_ylo=1950&as_yhi=2023"
13,"G Sharma, JM Jagtap, AK Parchur, VR Gogineni, ...","Heritable modifiers of the tumor microenvironment influence nanoparticle uptake, distribution and response to photothermal therapy",2020,"Theranostics","ncbi.nlm.nih.gov","https://www.ncbi.nlm.nih.gov/pmc/articles/PMC7196309/","https://scholar.google.com/scholar?cites=15415695864717153449&as_sdt=2005&sciodt=2007&hl=en",463,"2023-07-26 09:55:10","HTML","","","",,,,,13,4.33,3,5,3,"… -positive blood vessel density by immunofluorescent staining … the 15-30 µm of the blood vessels in tumor tissues from SS.… MRI) and steady-state vessel size index MRI to quantitatively …","https://www.ncbi.nlm.nih.gov/pmc/articles/PMC7196309/","https://scholar.google.com/scholar?q=related:qZTsjbaN79UJ:scholar.google.com/&scioq=%22vessel+size%22+%22vessel+density%22+%22tumor%22+%22mice%22+%22%C2%B5m%22&hl=en&as_sdt=2007&as_ylo=1950&as_yhi=2023"
58,"RS Dhillon, C Xie, W Tyler, LM Calvi, ...","PTH‐enhanced structural allograft healing is associated with decreased angiopoietin‐2–mediated arteriogenesis, mast cell accumulation, and fibrosis",2013,"Journal of Bone and …","Wiley Online Library","https://asbmr.onlinelibrary.wiley.com/doi/abs/10.1002/jbmr.1765","https://scholar.google.com/scholar?cites=327765566044600568&as_sdt=2005&sciodt=2007&hl=en",464,"2023-07-26 09:55:10","","10.1002/jbmr.1765","","",,,,,58,5.80,12,5,10,"… occur without increasing bone vessel density by redistribution of … (<90 µm), and significantly fewer large vessels (>90 µm) … The number of vessels per vessel size within the ROI of the …","https://asbmr.onlinelibrary.wiley.com/doi/pdf/10.1002/jbmr.1765","https://scholar.google.com/scholar?q=related:-HixtQt1jAQJ:scholar.google.com/&scioq=%22vessel+size%22+%22vessel+density%22+%22tumor%22+%22mice%22+%22%C2%B5m%22&hl=en&as_sdt=2007&as_ylo=1950&as_yhi=2023"
44,"CS Rutland, M Mukhopadhyay, ...","Induction of intrauterine growth restriction by reducing placental vascular growth with the angioinhibin TNP-470",2005,"Biology of …","academic.oup.com","https://academic.oup.com/biolreprod/article-abstract/73/6/1164/2666858","https://scholar.google.com/scholar?cites=8391501385785820741&as_sdt=2005&sciodt=2007&hl=en",465,"2023-07-26 09:55:10","","","","",,,,,44,2.44,15,3,18,"… Sections (thickness 5 μm) were cut and placed on glass slides… tumor growth without any change in vessel density [40, 41]. … , as the labyrinthine blood vessel size was not decreased at …","https://academic.oup.com/biolreprod/article/73/6/1164/2666858","https://scholar.google.com/scholar?q=related:RUb23wyadHQJ:scholar.google.com/&scioq=%22vessel+size%22+%22vessel+density%22+%22tumor%22+%22mice%22+%22%C2%B5m%22&hl=en&as_sdt=2007&as_ylo=1950&as_yhi=2023"
100,"SE Brunet-Dunand, C Vouyovitch, S Araneda, ...","Autocrine human growth hormone promotes tumor angiogenesis in mammary carcinoma",2009,"…","academic.oup.com","https://academic.oup.com/endo/article-abstract/150/3/1341/2455664","https://scholar.google.com/scholar?cites=12343980121632929417&as_sdt=2005&sciodt=2007&hl=en",466,"2023-07-26 09:55:10","","","","",,,,,100,7.14,25,4,14,"… into the upper chamber of a 0.4-μm cell culture insert (BD Biosciences … ; G, lymphatic vessel density was assessed by quantifying … cutaneous lymphatic vessel size in wild-type mice (83). …","https://academic.oup.com/endo/article/150/3/1341/2455664","https://scholar.google.com/scholar?q=related:ifZp-ISgTqsJ:scholar.google.com/&scioq=%22vessel+size%22+%22vessel+density%22+%22tumor%22+%22mice%22+%22%C2%B5m%22&hl=en&as_sdt=2007&as_ylo=1950&as_yhi=2023"
195,"M Tremmel, A Matzke, I Albrecht, ...","A CD44v6 peptide reveals a role of CD44 in VEGFR-2 signaling and angiogenesis",2009,"Blood, The Journal …","ashpublications.org","https://ashpublications.org/blood/article-abstract/114/25/5236/26526","https://scholar.google.com/scholar?cites=10857464965247397583&as_sdt=2005&sciodt=2007&hl=en",467,"2023-07-26 09:55:10","","","","",,,,,195,13.93,49,4,14,"… Bars represent 50 μm. … from L3.6pl cells: the tumor size was drastically reduced (Figure 7B). Furthermore, the vessel density and the vessel size were decreased by more than 60% on …","https://www.sciencedirect.com/science/article/pii/S0006497120388510","https://scholar.google.com/scholar?q=related:z-7RTtx2rZYJ:scholar.google.com/&scioq=%22vessel+size%22+%22vessel+density%22+%22tumor%22+%22mice%22+%22%C2%B5m%22&hl=en&as_sdt=2007&as_ylo=1950&as_yhi=2023"
29,"J Harding, A Ritter, A Rayasam, Z Fabry, ...","Lymphangiogenesis is induced by mycobacterial granulomas via vascular endothelial growth factor receptor-3 and supports systemic T-cell responses …",2015,"The American journal of …","Elsevier","https://www.sciencedirect.com/science/article/pii/S000294401400594X","https://scholar.google.com/scholar?cites=15938760479339636574&as_sdt=2005&sciodt=2007&hl=en",468,"2023-07-26 09:55:10","HTML","","","",,,,,29,3.63,6,5,8,"… (35 μm thick) from uninfected and BCG-infected mice shows … of lymph vessels and average lymph vessel size. Surprisingly, … by increasing the access of tumor cells to lymph vessels and …","https://www.sciencedirect.com/science/article/pii/S000294401400594X","https://scholar.google.com/scholar?q=related:XucSczXaMd0J:scholar.google.com/&scioq=%22vessel+size%22+%22vessel+density%22+%22tumor%22+%22mice%22+%22%C2%B5m%22&hl=en&as_sdt=2007&as_ylo=1950&as_yhi=2023"
192,"Y Lv, C Xu, X Zhao, C Lin, X Yang, X Xin, L Zhang, ...","Nanoplatform assembled from a CD44-targeted prodrug and smart liposomes for dual targeting of tumor microenvironment and cancer cells",2018,"Acs Nano","ACS Publications","https://pubs.acs.org/doi/abs/10.1021/acsnano.7b08051","https://scholar.google.com/scholar?cites=11882754313808551305&as_sdt=2005&sciodt=2007&hl=en",469,"2023-07-26 09:55:10","","10.1021/acsnano.7b08051","","",,,,,192,38.40,24,8,5,"… and vessel size hinders the nanoparticles’ ability to diffuse into the … ) The tumor sections (5 μm) prepared for immunohistochemistry were stained with CD31 to quantify the vessel density …","https://pubs.acs.org/doi/pdf/10.1021/acsnano.7b08051","https://scholar.google.com/scholar?q=related:iZ3MQxcG6KQJ:scholar.google.com/&scioq=%22vessel+size%22+%22vessel+density%22+%22tumor%22+%22mice%22+%22%C2%B5m%22&hl=en&as_sdt=2007&as_ylo=1950&as_yhi=2023"
30,"S Yang, J Lin, F Lu, Z Han, C Fu, P Lv, ...","Evaluation of antiangiogenic and antiproliferative effects of sorafenib by sequential histology and intravoxel incoherent motion diffusion‐weighted imaging in an …",2017,"Journal of Magnetic …","Wiley Online Library","https://onlinelibrary.wiley.com/doi/abs/10.1002/jmri.25344","https://scholar.google.com/scholar?cites=10154346485345149095&as_sdt=2005&sciodt=2007&hl=en",470,"2023-07-26 09:55:10","","10.1002/jmri.25344","","",,,,,30,5.00,4,7,6,"… -bearing nude mice were randomly chosen for a baseline … Zwick et al using DCE MRI and vessel size imaging to monitor … First, the histopathologic section of the tumor with 3-μm …","https://onlinelibrary.wiley.com/doi/pdfdirect/10.1002/jmri.25344","https://scholar.google.com/scholar?q=related:p-A7EVR864wJ:scholar.google.com/&scioq=%22vessel+size%22+%22vessel+density%22+%22tumor%22+%22mice%22+%22%C2%B5m%22&hl=en&as_sdt=2007&as_ylo=1950&as_yhi=2023"
31,"R Ramer, B Hinz","New insights into antimetastatic and antiangiogenic effects of cannabinoids",2015,"International review of cell and molecular biology","Elsevier","https://www.sciencedirect.com/science/article/pii/S1937644814000082","https://scholar.google.com/scholar?cites=9936825005848386700&as_sdt=2005&sciodt=2007&hl=en",471,"2023-07-26 09:55:10","","","","",,,,,31,3.88,16,2,8,"… Noteworthy, SR141716 was used at rather high concentrations ranging from 16 to 40 μM in … a long-term tumor progression model of mouse mammary tumor virus (MMTV)-neu mice that …","","https://scholar.google.com/scholar?q=related:jNzP_LGx5okJ:scholar.google.com/&scioq=%22vessel+size%22+%22vessel+density%22+%22tumor%22+%22mice%22+%22%C2%B5m%22&hl=en&as_sdt=2007&as_ylo=1950&as_yhi=2023"
53,"S Iriyama, T Ono, H Aoki, S Amano","Hyperpigmentation in human solar lentigo is promoted by heparanase-induced loss of heparan sulfate chains at the dermal–epidermal junction",2011,"Journal of dermatological science","Elsevier","https://www.sciencedirect.com/science/article/pii/S0923181111002829","https://scholar.google.com/scholar?cites=2395927313179088725&as_sdt=2005&sciodt=2007&hl=en",472,"2023-07-26 09:55:10","","","","",,,,,53,4.42,13,4,12,"… and its over-expression in tumor cells confers an invasive … vessel size, and the relative tissue area occupied by blood vessels were determined in the dermis in an area within 500-μm …","","https://scholar.google.com/scholar?q=related:VReyeTILQCEJ:scholar.google.com/&scioq=%22vessel+size%22+%22vessel+density%22+%22tumor%22+%22mice%22+%22%C2%B5m%22&hl=en&as_sdt=2007&as_ylo=1950&as_yhi=2023"
71,"BR Shepherd, SM Jay, WM Saltzman, ...","Human aortic smooth muscle cells promote arteriole formation by coengrafted endothelial cells",2009,"… Engineering Part A","liebertpub.com","https://www.liebertpub.com/doi/abs/10.1089/ten.tea.2008.0010","https://scholar.google.com/scholar?cites=16573371596535132023&as_sdt=2005&sciodt=2007&hl=en",473,"2023-07-26 09:55:10","","10.1089/ten.tea.2008.0010","","",,,,,71,5.07,18,4,14,"… μm) were counted for each graft to determine vessel density. … While vessel size distribution within grafts containing either … angiogenesis and accelerates tumor growthCancer Res…","https://www.liebertpub.com/doi/full/10.1089/ten.tea.2008.0010","https://scholar.google.com/scholar?q=related:d28GVqhxAOYJ:scholar.google.com/&scioq=%22vessel+size%22+%22vessel+density%22+%22tumor%22+%22mice%22+%22%C2%B5m%22&hl=en&as_sdt=2007&as_ylo=1950&as_yhi=2023"
36,"N Kosyakova, DD Kao, M Figetakis, ...","Differential functional roles of fibroblasts and pericytes in the formation of tissue-engineered microvascular networks in vitro",2020,"NPJ Regenerative …","nature.com","https://www.nature.com/articles/s41536-019-0086-3","https://scholar.google.com/scholar?cites=1914741131746207330&as_sdt=2005&sciodt=2007&hl=en",474,"2023-07-26 09:55:10","HTML","","","",,,,,36,12.00,9,4,3,"… coverage, decreased vessel size, and permeability in tissue-engineered microvessels. … vessel density and diameters over the long time-course. Scale bars of tile images are 250 µm…","https://www.nature.com/articles/s41536-019-0086-3","https://scholar.google.com/scholar?q=related:YuaPIuqGkhoJ:scholar.google.com/&scioq=%22vessel+size%22+%22vessel+density%22+%22tumor%22+%22mice%22+%22%C2%B5m%22&hl=en&as_sdt=2007&as_ylo=1950&as_yhi=2023"
42,"Y Xu, JG Pickering, Z Nong, E Gibson, JM Arpino, ...","A method for 3D histopathology reconstruction supporting mouse microvasculature analysis",2015,"PloS one","journals.plos.org","https://journals.plos.org/plosone/article?id=10.1371/journal.pone.0126817","https://scholar.google.com/scholar?cites=6798947812909040907&as_sdt=2005&sciodt=2007&hl=en",475,"2023-07-26 09:55:10","HTML","","","",,,,,42,5.25,7,6,8,"… layers with respect to vessel density, organization, and … , including vessel angle, vessel size, and vessel wall thickness. … sizes are approximately 10 μm and vessel wall components are …","https://journals.plos.org/plosone/article?id=10.1371/journal.pone.0126817","https://scholar.google.com/scholar?q=related:C8XccgO3Wl4J:scholar.google.com/&scioq=%22vessel+size%22+%22vessel+density%22+%22tumor%22+%22mice%22+%22%C2%B5m%22&hl=en&as_sdt=2007&as_ylo=1950&as_yhi=2023"
10,"M Galiè, P Farace, F Merigo, S Fiorini, S Tambalo, ...","Washout of small molecular contrast agent in carcinoma-derived experimental tumors",2009,"Microvascular …","Elsevier","https://www.sciencedirect.com/science/article/pii/S0026286209002374","https://scholar.google.com/scholar?cites=7185708428396605997&as_sdt=2005&sciodt=2007&hl=en",476,"2023-07-26 09:55:10","HTML","","","",,,,,10,0.71,2,6,14,"… The background precontrast images of the mice bodies are also visualized. Draining areas (… In fact, the tumor periphery is known to be often characterized by higher vessel density and …","https://www.sciencedirect.com/science/article/pii/S0026286209002374","https://scholar.google.com/scholar?q=related:LTIcfr7DuGMJ:scholar.google.com/&scioq=%22vessel+size%22+%22vessel+density%22+%22tumor%22+%22mice%22+%22%C2%B5m%22&hl=en&as_sdt=2007&as_ylo=1950&as_yhi=2023"
119,"S Tual-Chalot, M Mahmoud, KR Allinson, ...","Endothelial depletion of Acvrl1 in mice leads to arteriovenous malformations associated with reduced endoglin expression",2014,"PloS one","journals.plos.org","https://journals.plos.org/plosone/article?id=10.1371/journal.pone.0098646","https://scholar.google.com/scholar?cites=3695113177628121001&as_sdt=2005&sciodt=2007&hl=en",477,"2023-07-26 09:55:10","HTML","","","",,,,,119,13.22,30,4,9,"… fields of view (5300 µm×4460 µm) using images from 24 … at 3 positions (200 µm, 250 µm and 300 µm) from the centre of … 5 fields of view (355 µm×265 µm) per retina using maximum …","https://journals.plos.org/plosone/article?id=10.1371/journal.pone.0098646","https://scholar.google.com/scholar?q=related:qZdjhdutRzMJ:scholar.google.com/&scioq=%22vessel+size%22+%22vessel+density%22+%22tumor%22+%22mice%22+%22%C2%B5m%22&hl=en&as_sdt=2007&as_ylo=1950&as_yhi=2023"
6,"Y Liu, Y Shu, L Yin, T Xie, J Zou, P Zhan, ...","Protective roles of the TIR/BB-loop mimetic AS-1 in alkali-induced corneal neovascularization by inhibiting ERK phosphorylation",2021,"Experimental Eye …","Elsevier","https://www.sciencedirect.com/science/article/pii/S0014483521001330","https://scholar.google.com/scholar?cites=11371558035896507725&as_sdt=2005&sciodt=2007&hl=en",478,"2023-07-26 09:55:10","HTML","","","",,,,,6,3.00,1,7,2,"… Vessel density was calculated by the proportion of neovascularized … vessel size according to surgical microscopy on days 3, 7, and 14 (n = 7). (F) H&E-stained corneal sections (5 μm). …","https://www.sciencedirect.com/science/article/pii/S0014483521001330","https://scholar.google.com/scholar?q=related:TZ1Z2Mjjz50J:scholar.google.com/&scioq=%22vessel+size%22+%22vessel+density%22+%22tumor%22+%22mice%22+%22%C2%B5m%22&hl=en&as_sdt=2007&as_ylo=1950&as_yhi=2023"
97,"HP Weskott","Emerging roles for contrast-enhanced ultrasound",2008,"Clinical hemorheology and microcirculation","content.iospress.com","https://content.iospress.com/articles/clinical-hemorheology-and-microcirculation/ch1062","https://scholar.google.com/scholar?cites=16018365654851487029&as_sdt=2005&sciodt=2007&hl=en",479,"2023-07-26 09:55:10","","","","",,,,,97,6.47,97,1,15,"… well to the tumor vessel density [20]. … tumor vessel size, shape, and permeability, thus reducing intratumoral pressure and possibly helping to improve delivery of chemotherapy to tumor …","","https://scholar.google.com/scholar?q=related:NYW9s7GqTN4J:scholar.google.com/&scioq=%22vessel+size%22+%22vessel+density%22+%22tumor%22+%22mice%22+%22%C2%B5m%22&hl=en&as_sdt=2007&as_ylo=1950&as_yhi=2023"
11,"SB Andersen, I Taghavi, HM Kjer, SB Søgaard, ...","Evaluation of 2D super-resolution ultrasound imaging of the rat renal vasculature using ex vivo micro-computed tomography",2021,"Scientific reports","nature.com","https://www.nature.com/articles/s41598-021-03726-6","https://scholar.google.com/scholar?cites=9353604238836498497&as_sdt=2005&sciodt=2007&hl=en",480,"2023-07-26 09:55:10","HTML","","","",,,,,11,5.50,2,5,2,"… Studies on cancer models in chick embryos and mice have … , they used a 4-μm voxel image to compare vessel size … together with metrics such as vessel density, branching, or tortuosity 3…","https://www.nature.com/articles/s41598-021-03726-6","https://scholar.google.com/scholar?q=related:QQBwaX-tzoEJ:scholar.google.com/&scioq=%22vessel+size%22+%22vessel+density%22+%22tumor%22+%22mice%22+%22%C2%B5m%22&hl=en&as_sdt=2007&as_ylo=1950&as_yhi=2023"
13,"JC Lee, O Modiri, RW England, ...","Propranolol therapy in infantile hemangioma: it is not just about the beta",2021,"Plastic and …","journals.lww.com","https://journals.lww.com/plasreconsurg/Fulltext/2021/04000/Propranolol_Therapy_in_Infantile_Hemangioma__It_Is.15.aspx","https://scholar.google.com/scholar?cites=6683328874678566253&as_sdt=2005&sciodt=2007&hl=en",481,"2023-07-26 09:55:10","HTML","","","",,,,,13,6.50,3,4,2,"… Infantile hemangiomas are the most common benign tumor in … (100 μM for hemangioma endothelial cells versus 200 μM to 1 … in significantly reduced vessel size but not vessel density. …","https://journals.lww.com/plasreconsurg/Fulltext/2021/04000/Propranolol_Therapy_in_Infantile_Hemangioma__It_Is.15.aspx","https://scholar.google.com/scholar?q=related:bb1TpDP0v1wJ:scholar.google.com/&scioq=%22vessel+size%22+%22vessel+density%22+%22tumor%22+%22mice%22+%22%C2%B5m%22&hl=en&as_sdt=2007&as_ylo=1950&as_yhi=2023"
