Cites,Authors,Title,Year,Source,Publisher,ArticleURL,CitesURL,GSRank,QueryDate,Type,DOI,ISSN,CitationURL,Volume,Issue,StartPage,EndPage,ECC,CitesPerYear,CitesPerAuthor,AuthorCount,Age,Abstract,FullTextURL,RelatedURL
295,"MS Gee, WN Procopio, S Makonnen, ...","Tumor vessel development and maturation impose limits on the effectiveness of anti-vascular therapy",2003,"The American journal of …","Elsevier","https://www.sciencedirect.com/science/article/pii/S0002944010638096","https://scholar.google.com/scholar?cites=1738160799147631268&as_sdt=2005&sciodt=2007&hl=en",1,"2023-07-26 09:55:10","HTML","","","",,,,,295,14.75,74,4,20,"… Therapy reduced tumor vessel density, which was attributable to … B: Vessel size profile of untreated K1735 tumors. The … five sequential 4-μm sections (20 μm of tumor depth) to determine …","https://www.sciencedirect.com/science/article/pii/S0002944010638096","https://scholar.google.com/scholar?q=related:pCK0owkwHxgJ:scholar.google.com/&scioq=%22vessel+size%22+%22vessel+density%22+%22tumor%22+%22mice%22+%22%C2%B5m%22&hl=en&as_sdt=2007&as_ylo=1950&as_yhi=2023"
261,"LE Littlepage, MD Sternlicht, N Rougier, J Phillips, ...","Matrix metalloproteinases contribute distinct roles in neuroendocrine prostate carcinogenesis, metastasis, and angiogenesis progression",2010,"Cancer research","AACR","https://aacrjournals.org/cancerres/article-abstract/70/6/2224/565857","https://scholar.google.com/scholar?cites=14622352475555537831&as_sdt=2005&sciodt=2007&hl=en",2,"2023-07-26 09:55:10","","","","",,,,,261,20.08,52,5,13,"… We cut 20-μm sections for vasculature staining from frozen blocks and usually 5-… Average vessel size was calculated by dividing the vasculature area by vessel density. …","https://aacrjournals.org/cancerres/article/70/6/2224/565857","https://scholar.google.com/scholar?q=related:p6MKnhoI7coJ:scholar.google.com/&scioq=%22vessel+size%22+%22vessel+density%22+%22tumor%22+%22mice%22+%22%C2%B5m%22&hl=en&as_sdt=2007&as_ylo=1950&as_yhi=2023"
65,"SE Ungersma, G Pacheco, C Ho, ...","Vessel imaging with viable tumor analysis for quantification of tumor angiogenesis",2010,"… in Medicine: An …","Wiley Online Library","https://onlinelibrary.wiley.com/doi/abs/10.1002/mrm.22442","https://scholar.google.com/scholar?cites=1483341712026797993&as_sdt=2005&sciodt=2007&hl=en",3,"2023-07-26 09:55:10","","10.1002/mrm.22442","","",,,,,65,5.00,16,4,13,"… such as vessel size index, blood volume, and vessel density. … Mice were enrolled in the study at a pretreatment tumor size … on two 3-μm-thick slices from each tumor using a customized …","https://onlinelibrary.wiley.com/doi/pdfdirect/10.1002/mrm.22442","https://scholar.google.com/scholar?q=related:qYfgkW3jlRQJ:scholar.google.com/&scioq=%22vessel+size%22+%22vessel+density%22+%22tumor%22+%22mice%22+%22%C2%B5m%22&hl=en&as_sdt=2007&as_ylo=1950&as_yhi=2023"
399,"JL Li, RCA Sainson, W Shi, R Leek, LS Harrington, ...","Delta-like 4 Notch Ligand Regulates Tumor Angiogenesis, Improves Tumor Vascular Function, and Promotes Tumor Growth In vivo",2007,"Cancer research","AACR","https://aacrjournals.org/cancerres/article-abstract/67/23/11244/533886","https://scholar.google.com/scholar?cites=17677560131883760216&as_sdt=2005&sciodt=2007&hl=en",4,"2023-07-26 09:55:10","","","","",,,,,399,24.94,67,6,16,"… inhibits tumor growth in some preclinical tumor models in mice (… μm unless otherwise stated. A, DLL4 expression decreased vessel density and vessel number, but increased vessel size …","https://aacrjournals.org/cancerres/article/67/23/11244/533886","https://scholar.google.com/scholar?q=related:WPqJvEdPU_UJ:scholar.google.com/&scioq=%22vessel+size%22+%22vessel+density%22+%22tumor%22+%22mice%22+%22%C2%B5m%22&hl=en&as_sdt=2007&as_ylo=1950&as_yhi=2023"
42,"RT Ullrich, JF Jikeli, M Diedenhofen, P Böhm-Sturm, ...","In-vivo visualization of tumor microvessel density and response to anti-angiogenic treatment by high resolution MRI in mice",2011,"PloS one","journals.plos.org","https://journals.plos.org/plosone/article?id=10.1371/journal.pone.0019592","https://scholar.google.com/scholar?cites=5224112259401400858&as_sdt=2005&sciodt=2007&hl=en",5,"2023-07-26 09:55:10","HTML","","","",,,,,42,3.50,8,5,12,"… index (MDI (1/mm 2 )) in MRI and a low vessel index (VSI (µm)). The PTK787-treated … Interestingly, we found inverse behavior of the vessel size and vessel density changes: an increase …","https://journals.plos.org/plosone/article?id=10.1371/journal.pone.0019592","https://scholar.google.com/scholar?q=related:GkJi4GvGf0gJ:scholar.google.com/&scioq=%22vessel+size%22+%22vessel+density%22+%22tumor%22+%22mice%22+%22%C2%B5m%22&hl=en&as_sdt=2007&as_ylo=1950&as_yhi=2023"
24,"KA Bohn, CE Adkins, RK Mittapalli, ...","Semi-automated rapid quantification of brain vessel density utilizing fluorescent microscopy",2016,"Journal of neuroscience …","Elsevier","https://www.sciencedirect.com/science/article/pii/S0165027016301339","https://scholar.google.com/scholar?cites=3692369084230544119&as_sdt=2005&sciodt=2007&hl=en",6,"2023-07-26 09:55:10","HTML","","","",,,,,24,3.43,6,4,7,"… in both mice and rats, in two tumor models, … the vessel size range of <10 μm (∼81% and ∼94%, respectively) (Fig. 4). The size range with the greatest number of vessels was 2–4.99 μm …","https://www.sciencedirect.com/science/article/pii/S0165027016301339","https://scholar.google.com/scholar?q=related:9yoyfR7uPTMJ:scholar.google.com/&scioq=%22vessel+size%22+%22vessel+density%22+%22tumor%22+%22mice%22+%22%C2%B5m%22&hl=en&as_sdt=2007&as_ylo=1950&as_yhi=2023"
87,"SE Bohndiek, LS Sasportas, S Machtaler, ...","Photoacoustic tomography detects early vessel regression and normalization during ovarian tumor response to the antiangiogenic therapy trebananib",2015,"Journal of Nuclear …","Soc Nuclear Med","https://jnm.snmjournals.org/content/56/12/1942.short","https://scholar.google.com/scholar?cites=12361577939293455835&as_sdt=2005&sciodt=2007&hl=en",7,"2023-07-26 09:55:10","","","","",,,,,87,10.88,22,4,8,"… ± 300 μm 2 to 2,700 ± 500 μm 2 in trebananib-treated mice (n = 5 … -positive tumor vessels and reduction of vessel size in … PAT assessment of tumor vessel density and oxygenation can …","https://jnm.snmjournals.org/content/jnumed/56/12/1942.full.pdf","https://scholar.google.com/scholar?q=related:20XkLqQljasJ:scholar.google.com/&scioq=%22vessel+size%22+%22vessel+density%22+%22tumor%22+%22mice%22+%22%C2%B5m%22&hl=en&as_sdt=2007&as_ylo=1950&as_yhi=2023"
44,"M Jugold, M Palmowski, J Huppert, EC Woenne, ...","Volumetric high-frequency Doppler ultrasound enables the assessment of early antiangiogenic therapy effects on tumor xenografts in nude mice",2008,"European …","Springer","https://link.springer.com/article/10.1007/s00330-007-0825-5","https://scholar.google.com/scholar?cites=16654483918262685880&as_sdt=2005&sciodt=2007&hl=en",8,"2023-07-26 09:55:10","","10.1007/s00330-007-0825-5","","",,,,,44,2.93,9,5,15,"… Images with 200-μm slice thicknesses were recorded and … tumor (b) the control tumor (a) shows a higher vessel density … the lower limit in detectable vessel size. Accordingly, the …","https://www.researchgate.net/profile/Eva_Woenne/publication/5763501_Volumetric_high-frequency_Doppler_ultrasound_enables_the_assessment_of_early_antiangiogenic_therapy_effects_on_tumor_xenografts_in_nude_mice/links/00463527cec58151f6000000/Volumetric-high-frequency-Doppler-ultrasound-enables-the-assessment-of-early-antiangiogenic-therapy-effects-on-tumor-xenografts-in-nude-mice.pdf","https://scholar.google.com/scholar?q=related:uNCAaeKcIOcJ:scholar.google.com/&scioq=%22vessel+size%22+%22vessel+density%22+%22tumor%22+%22mice%22+%22%C2%B5m%22&hl=en&as_sdt=2007&as_ylo=1950&as_yhi=2023"
99,"R Serduc, T Christen, J Laissue, R Farion, ...","Brain tumor vessel response to synchrotron microbeam radiation therapy: a short-term in vivo study",2008,"Physics in Medicine …","iopscience.iop.org","https://iopscience.iop.org/article/10.1088/0031-9155/53/13/015/meta","https://scholar.google.com/scholar?cites=1513548968041436631&as_sdt=2005&sciodt=2007&hl=en",9,"2023-07-26 09:55:10","","10.1088/0031-9155/53/13/015","","",,,,,99,6.60,20,5,15,"… nude mice brains were irradiated by MRT 13 days after tumor … In the untreated group, both tumor size and vessel size index … In our study (211 µm beam spacing, 25 µm microbeam width…","https://iopscience.iop.org/article/10.1088/0031-9155/53/13/015/pdf","https://scholar.google.com/scholar?q=related:19VEbsQ0ARUJ:scholar.google.com/&scioq=%22vessel+size%22+%22vessel+density%22+%22tumor%22+%22mice%22+%22%C2%B5m%22&hl=en&as_sdt=2007&as_ylo=1950&as_yhi=2023"
189,"E Sadoun, MJ Reed","Impaired angiogenesis in aging is associated with alterations in vessel density, matrix composition, inflammatory response, and growth factor expression",2003,"Journal of Histochemistry & …","journals.sagepub.com","https://journals.sagepub.com/doi/abs/10.1177/002215540305100902","https://scholar.google.com/scholar?cites=1713740160418810084&as_sdt=2005&sciodt=2007&hl=en",10,"2023-07-26 09:55:10","","10.1177/002215540305100902","","",,,,,189,9.45,95,2,20,"… in vessel density in the sponges from aged mice relative to … Bar = 150 μm. As shown by the brown immunostaining for … at 19d was similar to that of young at 14d with respect to vessel size…","https://journals.sagepub.com/doi/full/10.1177/002215540305100902","https://scholar.google.com/scholar?q=related:5IgVm5htyBcJ:scholar.google.com/&scioq=%22vessel+size%22+%22vessel+density%22+%22tumor%22+%22mice%22+%22%C2%B5m%22&hl=en&as_sdt=2007&as_ylo=1950&as_yhi=2023"
161,"J Ehling, B Theek, F Gremse, S Baetke, ...","Micro-CT imaging of tumor angiogenesis: quantitative measures describing micromorphology and vascularization",2014,"The American journal of …","Elsevier","https://www.sciencedirect.com/science/article/pii/S0002944013007268","https://scholar.google.com/scholar?cites=6353029693815409199&as_sdt=2005&sciodt=2007&hl=en",11,"2023-07-26 09:55:10","HTML","","","",,,,,161,17.89,32,5,9,"… : Differences in tumor growth (C) and blood vessel density and … , we systematically investigated vessel size, vessel distribution, … vessel size for A431 was 11 ± 3 μm (core) and 23 ± 6 μm (…","https://www.sciencedirect.com/science/article/pii/S0002944013007268","https://scholar.google.com/scholar?q=related:L0pgw9h-KlgJ:scholar.google.com/&scioq=%22vessel+size%22+%22vessel+density%22+%22tumor%22+%22mice%22+%22%C2%B5m%22&hl=en&as_sdt=2007&as_ylo=1950&as_yhi=2023"
243,"F Kiessling, S Greschus, MP Lichy, M Bock, C Fink, ...","Volumetric computed tomography (VCT): a new technology for noninvasive, high-resolution monitoring of tumor angiogenesis",2004,"Nature medicine","nature.com","https://www.nature.com/articles/nm1101","https://scholar.google.com/scholar?cites=4343657029860398537&as_sdt=2005&sciodt=2007&hl=en",12,"2023-07-26 09:55:10","","","","",,,,,243,12.79,41,6,19,"… tumor shows the increase of vessel density around the tumor … pictures of the tumor had a diameter of 83 μm, we conclude that … To balance possible errors in determination of vessel size, …","https://search.ebscohost.com/login.aspx?direct=true&profile=ehost&scope=site&authtype=crawler&jrnl=10788956&AN=14565104&h=7j1iEqMnsU1LuVEv%2B%2B7rn0k01ZVL72lqd8n%2FSkpQ35zQ3ploqJmcNS8I6CdBfeISIbHtWAdeG1emGBpt3%2F%2FyQw%3D%3D&crl=f","https://scholar.google.com/scholar?q=related:yRX1Eg7FRzwJ:scholar.google.com/&scioq=%22vessel+size%22+%22vessel+density%22+%22tumor%22+%22mice%22+%22%C2%B5m%22&hl=en&as_sdt=2007&as_ylo=1950&as_yhi=2023"
20,"F Kording, C Weidensteiner, S Zwick, ...","Simultaneous assessment of vessel size index, relative blood volume, and vessel permeability in a mouse brain tumor model using a combined spin echo gradient …",2014,"Journal of Magnetic …","Wiley Online Library","https://onlinelibrary.wiley.com/doi/abs/10.1002/jmri.24513","https://scholar.google.com/scholar?cites=5820256386985777190&as_sdt=2005&sciodt=2007&hl=en",13,"2023-07-26 09:55:10","","10.1002/jmri.24513","","",,,,,20,2.22,5,4,9,"… in treated mice, which correlated with results from … 4) as a measure for the total vessel density are correlated with the … the maximum vessel size must not exceed 200 μm and increased …","https://onlinelibrary.wiley.com/doi/pdf/10.1002/jmri.24513","https://scholar.google.com/scholar?q=related:Jlj8z1i0xVAJ:scholar.google.com/&scioq=%22vessel+size%22+%22vessel+density%22+%22tumor%22+%22mice%22+%22%C2%B5m%22&hl=en&as_sdt=2007&as_ylo=1950&as_yhi=2023"
210,"R Giavazzi, B Sennino, D Coltrini, A Garofalo, ...","Distinct role of fibroblast growth factor-2 and vascular endothelial growth factor on tumor growth and angiogenesis",2003,"The American journal of …","Elsevier","https://www.sciencedirect.com/science/article/pii/S0002944010643258","https://scholar.google.com/scholar?cites=441130153766079469&as_sdt=2005&sciodt=2007&hl=en",14,"2023-07-26 09:55:10","HTML","","","",,,,,210,10.50,42,5,20,"… in blood vessel density and, consequently, in tumor burden. … Five-μm sections were obtained with a cryostat microtome … and regulation of vessel size during embryonic development. …","https://www.sciencedirect.com/science/article/pii/S0002944010643258","https://scholar.google.com/scholar?q=related:7cvwook1HwYJ:scholar.google.com/&scioq=%22vessel+size%22+%22vessel+density%22+%22tumor%22+%22mice%22+%22%C2%B5m%22&hl=en&as_sdt=2007&as_ylo=1950&as_yhi=2023"
35,"T Nielsen, L Bentzen, M Pedersen, T Tramm, ...","Combretastatin A-4 phosphate affects tumor vessel volume and size distribution as assessed using MRI-based vessel size imaging",2012,"Clinical Cancer …","AACR","https://aacrjournals.org/clincancerres/article-abstract/18/23/6469/283664","https://scholar.google.com/scholar?cites=3395753349701319390&as_sdt=2005&sciodt=2007&hl=en",15,"2023-07-26 09:55:10","","","","",,,,,35,3.18,7,5,11,"… positioned similarly through the tumor as for a scan of 2 mice. … A 6-μm frozen section of the central part of each tumor was cut … vessel density, number fraction of perfused vessels, mean …","https://aacrjournals.org/clincancerres/article/18/23/6469/283664","https://scholar.google.com/scholar?q=related:3jrKGa4jIC8J:scholar.google.com/&scioq=%22vessel+size%22+%22vessel+density%22+%22tumor%22+%22mice%22+%22%C2%B5m%22&hl=en&as_sdt=2007&as_ylo=1950&as_yhi=2023"
148,"NV Soucy, MA Ihnat, CD Kamat, L Hess, ...","Arsenic Stimulates Angiogenesis and Tumorigenesis In Vivo",2003,"Toxicological …","academic.oup.com","https://academic.oup.com/toxsci/article-abstract/76/2/271/1686015","https://scholar.google.com/scholar?cites=16311640168041672021&as_sdt=2005&sciodt=2007&hl=en",16,"2023-07-26 09:55:10","","","","",,,,,148,7.40,30,5,20,"… for this response was 0.033 μM and inhibition of vessel … effects on blood vessel density and tumor morphology. Low-… Blood vessel size was decreased to near control levels by the …","https://academic.oup.com/toxsci/article/76/2/271/1686015","https://scholar.google.com/scholar?q=related:Ve0dYE-WXuIJ:scholar.google.com/&scioq=%22vessel+size%22+%22vessel+density%22+%22tumor%22+%22mice%22+%22%C2%B5m%22&hl=en&as_sdt=2007&as_ylo=1950&as_yhi=2023"
883,"M Mazzone, D Dettori, RL de Oliveira, S Loges, ...","Heterozygous deficiency of PHD2 restores tumor oxygenation and inhibits metastasis via endothelial normalization",2009,"Cell","cell.com","https://www.cell.com/fulltext/S0092-8674(09)00068-3","https://scholar.google.com/scholar?cites=9161161825313337816&as_sdt=2005&sciodt=2007&hl=en",17,"2023-07-26 09:55:10","HTML","","","",,,,,883,63.07,177,5,14,"… Haplodeficiency of PHD2 did not affect tumor vessel density … Also, there was no shift in tumor vessel size (Figures S6I and … -5 (4.7 ± 0.2 μm in WT versus 5.5 ± 0.2 μm in PHD2+/−; n = 6; …","https://www.cell.com/fulltext/S0092-8674(09)00068-3","https://scholar.google.com/scholar?q=related:2LGrZyT8In8J:scholar.google.com/&scioq=%22vessel+size%22+%22vessel+density%22+%22tumor%22+%22mice%22+%22%C2%B5m%22&hl=en&as_sdt=2007&as_ylo=1950&as_yhi=2023"
78,"S Zwick, R Strecker, V Kiselev, P Gall, ...","Assessment of vascular remodeling under antiangiogenic therapy using DCE‐MRI and vessel size imaging",2009,"Journal of Magnetic …","Wiley Online Library","https://onlinelibrary.wiley.com/doi/abs/10.1002/jmri.21710","https://scholar.google.com/scholar?cites=390711531515645597&as_sdt=2005&sciodt=2007&hl=en",18,"2023-07-26 09:55:10","","10.1002/jmri.21710","","",,,,,78,5.57,16,5,14,"… of tumor vessel architecture, we assumed that vessel size … 13.9 μm for the control group (53 ± 12 μm and 57 ± 14 μm at … A quantity of changes in vessel density and thus a dimension …","https://onlinelibrary.wiley.com/doi/pdf/10.1002/jmri.21710","https://scholar.google.com/scholar?q=related:nY6jXREWbAUJ:scholar.google.com/&scioq=%22vessel+size%22+%22vessel+density%22+%22tumor%22+%22mice%22+%22%C2%B5m%22&hl=en&as_sdt=2007&as_ylo=1950&as_yhi=2023"
275,"J Drevs, R Müller-Driver, C Wittig, S Fuxius, N Esser, ...","PTK787/ZK 222584, a specific vascular endothelial growth factor-receptor tyrosine kinase inhibitor, affects the anatomy of the tumor vascular bed and the functional …",2002,"Cancer research","AACR","https://aacrjournals.org/cancerres/article-abstract/62/14/4015/509021","https://scholar.google.com/scholar?cites=8800230698670635801&as_sdt=2005&sciodt=2007&hl=en",19,"2023-07-26 09:55:10","","","","",,,,,275,13.10,46,6,21,"… Immunohistochemical analysis of vessel density in tumor … Cryosections of tissue with a thickness of 5–10 μm were taken … care unless distribution of vessel size is assessed in parallel. …","https://aacrjournals.org/cancerres/article/62/14/4015/509021","https://scholar.google.com/scholar?q=related:GTvA3zGzIHoJ:scholar.google.com/&scioq=%22vessel+size%22+%22vessel+density%22+%22tumor%22+%22mice%22+%22%C2%B5m%22&hl=en&as_sdt=2007&as_ylo=1950&as_yhi=2023"
35,"YJ Ho, TC Wang, CH Fan, CK Yeh","Spatially uniform tumor treatment and drug penetration by regulating ultrasound with microbubbles",2018,"ACS applied materials & …","ACS Publications","https://pubs.acs.org/doi/abs/10.1021/acsami.8b05508","https://scholar.google.com/scholar?cites=5927084211683586552&as_sdt=2005&sciodt=2007&hl=en",20,"2023-07-26 09:55:10","","10.1021/acsami.8b05508","","",,,,,35,7.00,9,4,5,"… The vessel size was measured on CD31 images in the … The vessel density in the tumor rim reduced to 56 ± 9 and 22 ± … for large vessels (20–40 μm) in the tumor rim was higher at 7 MPa …","https://pubs.acs.org/doi/full/10.1021/acsami.8b05508","https://scholar.google.com/scholar?q=related:-PE5_687QVIJ:scholar.google.com/&scioq=%22vessel+size%22+%22vessel+density%22+%22tumor%22+%22mice%22+%22%C2%B5m%22&hl=en&as_sdt=2007&as_ylo=1950&as_yhi=2023"
52,"WK You, P Bonaldo, WB Stallcup","Collagen VI ablation retards brain tumor progression due to deficits in assembly of the vascular basal lamina",2012,"The American journal of pathology","Elsevier","https://www.sciencedirect.com/science/article/pii/S0002944011010698","https://scholar.google.com/scholar?cites=11081939901323445028&as_sdt=2005&sciodt=2007&hl=en",21,"2023-07-26 09:55:10","HTML","","","",,,,,52,4.73,17,3,11,"… quantified as vessel number per 10,000 μm 2 of tumor area. … of vessels, changes in vessel density, and changes in pericyte … Instead, we observed interesting changes in vessel size, with …","https://www.sciencedirect.com/science/article/pii/S0002944011010698","https://scholar.google.com/scholar?q=related:JIOcKKD1ypkJ:scholar.google.com/&scioq=%22vessel+size%22+%22vessel+density%22+%22tumor%22+%22mice%22+%22%C2%B5m%22&hl=en&as_sdt=2007&as_ylo=1950&as_yhi=2023"
0,"VSI Multispectral","Dual PI3K/mTOR Inhibition Induces Structural Changes in Tumor Vasculature Assessed by Vessel Size Imaging",2011,"Proc. Intl. Soc. Mag. Reson. Med","","","",22,"2023-07-26 09:55:10","CITATION","","","",,,,,0,0.00,0,1,12,"","","https://scholar.google.com/scholar?q=related:JCqkkfIAOdIJ:scholar.google.com/&scioq=%22vessel+size%22+%22vessel+density%22+%22tumor%22+%22mice%22+%22%C2%B5m%22&hl=en&as_sdt=2007&as_ylo=1950&as_yhi=2023"
97,"CY Lin, YH Hsu, MH Lin, TH Yang, HM Chen, ...","Neurovascular abnormalities in humans and mice with Huntington's disease",2013,"Experimental …","Elsevier","https://www.sciencedirect.com/science/article/pii/S0014488613002689","https://scholar.google.com/scholar?cites=10088400242103214374&as_sdt=2005&sciodt=2007&hl=en",23,"2023-07-26 09:55:10","HTML","","","",,,,,97,9.70,16,6,10,"… -μm-thick paraffinized sections and 20-μm-… vessel density, we analyzed the vessel size in the frontal cortex and caudate/putamen in patients with HD. A significant change in vessel size …","https://www.sciencedirect.com/science/article/pii/S0014488613002689","https://scholar.google.com/scholar?q=related:JuGGzpEyAYwJ:scholar.google.com/&scioq=%22vessel+size%22+%22vessel+density%22+%22tumor%22+%22mice%22+%22%C2%B5m%22&hl=en&as_sdt=2007&as_ylo=1950&as_yhi=2023"
43,"K Huber, A Feuchtinger, DM Borgmann, Z Li, ...","Novel approach of MALDI drug imaging, immunohistochemistry, and digital image analysis for drug distribution studies in tissues",2014,"Analytical …","ACS Publications","https://pubs.acs.org/doi/abs/10.1021/ac502177y","https://scholar.google.com/scholar?cites=2246009912530194809&as_sdt=2005&sciodt=2007&hl=en",24,"2023-07-26 09:55:10","","10.1021/ac502177y","","",,,,,43,4.78,9,5,9,"… mice carrying squamous cell carcinoma (FaDu) xenografts (n … the average vessel size of the FaDu tumors was below 1000 μm 2 … The total vessel density of the FaDu tumor areas without …","https://pubs.acs.org/doi/full/10.1021/ac502177y","https://scholar.google.com/scholar?q=related:eVFelh1uKx8J:scholar.google.com/&scioq=%22vessel+size%22+%22vessel+density%22+%22tumor%22+%22mice%22+%22%C2%B5m%22&hl=en&as_sdt=2007&as_ylo=1950&as_yhi=2023"
7,"JV Gaustad, TG Simonsen, LMK Hansem, ...","Intravital microscopy of tumor vessel morphology and function using a standard fluorescence microscope",2021,"European Journal of …","Springer","https://link.springer.com/article/10.1007/s00259-021-05243-0","https://scholar.google.com/scholar?cites=10820153637136302619&as_sdt=2005&sciodt=2007&hl=en",25,"2023-07-26 09:55:10","HTML","10.1007/s00259-021-05243-0","","",,,,,7,3.50,2,4,2,"… were produced to quantify vessel density, vessel diameter, … of 7.5 × 7.5 μm 2 , whereas high-resolution images of the tumor … information on tumor vasculature such as vessel size imaging …","https://link.springer.com/article/10.1007/s00259-021-05243-0","https://scholar.google.com/scholar?q=related:GwKpxGfoKJYJ:scholar.google.com/&scioq=%22vessel+size%22+%22vessel+density%22+%22tumor%22+%22mice%22+%22%C2%B5m%22&hl=en&as_sdt=2007&as_ylo=1950&as_yhi=2023"
862,"T Inai, M Mancuso, H Hashizume, F Baffert, ...","… of vascular endothelial growth factor (VEGF) signaling in cancer causes loss of endothelial fenestrations, regression of tumor vessels, and appearance of …",2004,"The American journal of …","Elsevier","https://www.sciencedirect.com/science/article/pii/S0002944010632737","https://scholar.google.com/scholar?cites=6734047924468677879&as_sdt=2005&sciodt=2007&hl=en",26,"2023-07-26 09:55:10","HTML","","","",,,,,862,45.37,172,5,19,"… potent anti-angiogenic and anti-tumor effects in mice.27, 35 We … and high vessel density in vehicle-treated RIP-Tag2 tumor (A… change in vessel size (mean diameter 9.7 μm after vehicle …","https://www.sciencedirect.com/science/article/pii/S0002944010632737","https://scholar.google.com/scholar?q=related:93xppugkdF0J:scholar.google.com/&scioq=%22vessel+size%22+%22vessel+density%22+%22tumor%22+%22mice%22+%22%C2%B5m%22&hl=en&as_sdt=2007&as_ylo=1950&as_yhi=2023"
87,"T Tokatlian, C Cam, T Segura","Non-viral DNA delivery from porous hyaluronic acid hydrogels in mice",2014,"Biomaterials","Elsevier","https://www.sciencedirect.com/science/article/pii/S0142961213012258","https://scholar.google.com/scholar?cites=5569813272465110551&as_sdt=2005&sciodt=2007&hl=en",27,"2023-07-26 09:55:10","HTML","","","",,,,,87,9.67,29,3,9,"… and 100 μm porous hydrogels, with the 60 μm gels having significantly higher vessel density at … Vessels from hydrogels that fell below this threshold were not included in the vessel size …","https://www.sciencedirect.com/science/article/pii/S0142961213012258","https://scholar.google.com/scholar?q=related:F_aJQqnzS00J:scholar.google.com/&scioq=%22vessel+size%22+%22vessel+density%22+%22tumor%22+%22mice%22+%22%C2%B5m%22&hl=en&as_sdt=2007&as_ylo=1950&as_yhi=2023"
77,"CC Chien, HH Chen, SF Lai, ...","Gold nanoparticles as high-resolution X-ray imaging contrast agents for the analysis of tumor-related micro-vasculature",2012,"Journal of …","jnanobiotechnology.biomedcentral …","https://jnanobiotechnology.biomedcentral.com/articles/10.1186/1477-3155-10-10","https://scholar.google.com/scholar?cites=11380776883676799908&as_sdt=2005&sciodt=2007&hl=en",28,"2023-07-26 09:55:10","HTML","10.1186/1477-3155-10-10","","",,,,,77,7.00,19,4,11,"… The detected vessel density was 3-7 times higher than with … ; the vessel size marked by the arrow in the inset is ~10 μm. (b) … During imaging the mice were kept under anesthesia using 1…","https://jnanobiotechnology.biomedcentral.com/articles/10.1186/1477-3155-10-10","https://scholar.google.com/scholar?q=related:pGOIG0ek8J0J:scholar.google.com/&scioq=%22vessel+size%22+%22vessel+density%22+%22tumor%22+%22mice%22+%22%C2%B5m%22&hl=en&as_sdt=2007&as_ylo=1950&as_yhi=2023"
