Cites,Authors,Title,Year,Source,Publisher,ArticleURL,CitesURL,GSRank,QueryDate,Type,DOI,ISSN,CitationURL,Volume,Issue,StartPage,EndPage,ECC,CitesPerYear,CitesPerAuthor,AuthorCount,Age,Abstract,FullTextURL,RelatedURL
1,"CH Yoo, J Goh, GH Jahng, S Jin, DK Lee, ...","Simulation of microvascular signal changes used on a gadolinium-chelated contrast agent at 3 T MRI in the presence of amyloid-beta plaques",2022,"Journal of the Korean …","Springer","https://link.springer.com/article/10.1007/s40042-022-00567-y","https://scholar.google.com/scholar?cites=14770067304277010985&as_sdt=2005&sciodt=2007&hl=en",228,"2023-07-26 09:55:10","","10.1007/s40042-022-00567-y","","",,,,,1,1.00,0,6,1,"… density was strongly correlated with tumor prognosis [8] and … , the vessel density, and the vessel size index yielded strong … to 6 μm vessel size for 1.5 T, 4 μm for 3.0 T, and 2 μm for 7.0 T, …","","https://scholar.google.com/scholar?q=related:KeoKRPXR-cwJ:scholar.google.com/&scioq=%22vessel+size%22+%22vessel+density%22+%22tumor%22+%22mice%22+%22%C2%B5m%22&hl=en&as_sdt=2007&as_ylo=1950&as_yhi=2023"
18,"GD Ielacqua, F Schlegel, M Füchtemeier, ...","Magnetic resonance Q mapping reveals a decrease in microvessel density in the arcaβ mouse model of cerebral amyloidosis",2016,"Frontiers in aging …","frontiersin.org","https://www.frontiersin.org/articles/10.3389/fnagi.2015.00241/full","https://scholar.google.com/scholar?cites=7355581790459127799&as_sdt=2005&sciodt=2007&hl=en",229,"2023-07-26 09:55:10","HTML","10.3389/fnagi.2015.00241","","",,,,,18,2.57,5,4,7,"… = 862 × 1330 μm). Aβ deposits were clearly visible in arcAβ mice as parenchymal plaques … was devoid of Aβ deposits had a normal vessel density. However, there were no correlation …","https://www.frontiersin.org/articles/10.3389/fnagi.2015.00241/full","https://scholar.google.com/scholar?q=related:9-eluKpGFGYJ:scholar.google.com/&scioq=%22vessel+size%22+%22vessel+density%22+%22tumor%22+%22mice%22+%22%C2%B5m%22&hl=en&as_sdt=2007&as_ylo=1950&as_yhi=2023"
87,"M Drinane, J Mollmark, L Zagorchev, K Moodie, ...","The Antiangiogenic Activity of rPAI-123 Inhibits Vasa Vasorum and Growth of Atherosclerotic Plaque",2009,"Circulation …","Am Heart Assoc","https://www.ahajournals.org/doi/abs/10.1161/circresaha.108.184622","https://scholar.google.com/scholar?cites=2966540711156356787&as_sdt=2005&sciodt=2007&hl=en",230,"2023-07-26 09:55:10","","10.1161/circresaha.108.184622","","",,,,,87,6.21,17,5,14,"… The increased vessel density in saline-treated mice is … DAs were scanned ex vivo at 6.5 μm, and 3D volumetric … remodeling and age-related vessel size. The data also demonstrate that …","https://www.ahajournals.org/doi/full/10.1161/circresaha.108.184622","https://scholar.google.com/scholar?q=related:s5Y1NA9FKykJ:scholar.google.com/&scioq=%22vessel+size%22+%22vessel+density%22+%22tumor%22+%22mice%22+%22%C2%B5m%22&hl=en&as_sdt=2007&as_ylo=1950&as_yhi=2023"
15,"SJ Blocker, KA Douglas, LA Polin, H Lee, ...","Liposomal 64Cu-PET imaging of anti-VEGF drug effects on liposomal delivery to colon cancer xenografts",2017,"Theranostics","ncbi.nlm.nih.gov","https://www.ncbi.nlm.nih.gov/pmc/articles/PMC5695009/","https://scholar.google.com/scholar?cites=5322884411143664373&as_sdt=2005&sciodt=2007&hl=en",231,"2023-07-26 09:55:10","HTML","","","",,,,,15,2.50,3,5,6,"… bev was able to alter vessel size. Therapeutically, while bev … Louis, MO) was performed on 5 µm slices, and digital images … altered following bev, the vessel density (vessels/cm 3 ) …","https://www.ncbi.nlm.nih.gov/pmc/articles/PMC5695009/","https://scholar.google.com/scholar?q=related:9bKuiiuv3kkJ:scholar.google.com/&scioq=%22vessel+size%22+%22vessel+density%22+%22tumor%22+%22mice%22+%22%C2%B5m%22&hl=en&as_sdt=2007&as_ylo=1950&as_yhi=2023"
15,"T Wittenborn, T Nielsen, JV Nygaard, ...","Ultrahigh‐field DCE‐MRI of angiogenesis in a novel angiogenesis mouse model",2012,"Journal of Magnetic …","Wiley Online Library","https://onlinelibrary.wiley.com/doi/abs/10.1002/jmri.22855","https://scholar.google.com/scholar?cites=6085534905075953267&as_sdt=2005&sciodt=2007&hl=en",232,"2023-07-26 09:55:10","","10.1002/jmri.22855","","",,,,,15,1.36,4,4,11,"… The average vessel size rapidly increases to around 200 μm … The increase in vessel density and vessel size meant that more … we observe an increase in vessel density, we observe an …","https://onlinelibrary.wiley.com/doi/pdf/10.1002/jmri.22855","https://scholar.google.com/scholar?q=related:c-5K7cApdFQJ:scholar.google.com/&scioq=%22vessel+size%22+%22vessel+density%22+%22tumor%22+%22mice%22+%22%C2%B5m%22&hl=en&as_sdt=2007&as_ylo=1950&as_yhi=2023"
32,"M Kragh, B Quistorff, M Tenan, EG Van Meir, ...","Overexpression of thrombospondin-1 reduces growth and vascular index but not perfusion in glioblastoma",2002,"Cancer research","AACR","https://aacrjournals.org/cancerres/article-abstract/62/4/1191/509622","https://scholar.google.com/scholar?cites=16223089075906964259&as_sdt=2005&sciodt=2007&hl=en",233,"2023-07-26 09:55:10","","","","",,,,,32,1.52,6,5,21,"… Sections of 4–5 μm were cut and stained with H&E. Sections … reduced vessel size was a cause of reduced tumor growth or … of TSP-1 decreased the vessel density by 52%, as determined …","https://aacrjournals.org/cancerres/article/62/4/1191/509622","https://scholar.google.com/scholar?q=related:I2v0mI_9I-EJ:scholar.google.com/&scioq=%22vessel+size%22+%22vessel+density%22+%22tumor%22+%22mice%22+%22%C2%B5m%22&hl=en&as_sdt=2007&as_ylo=1950&as_yhi=2023"
30,"M Cocks, A Mohan, CA Meyers, C Ding, B Levi, ...","Vascular patterning in human heterotopic ossification",2017,"Human pathology","Elsevier","https://www.sciencedirect.com/science/article/pii/S0046817717300771","https://scholar.google.com/scholar?cites=13772246008643588560&as_sdt=2005&sciodt=2007&hl=en",234,"2023-07-26 09:55:10","HTML","","","",,,,,30,5.00,5,6,6,"… as tumor-derived VEGF expression, as well as indices of vascularity correlate with outcome in OS [18], [19]. Elevated tumor … vessel area, blood vessel density, and blood vessel size. D, …","https://www.sciencedirect.com/science/article/pii/S0046817717300771","https://scholar.google.com/scholar?q=related:0BF-wMbYIL8J:scholar.google.com/&scioq=%22vessel+size%22+%22vessel+density%22+%22tumor%22+%22mice%22+%22%C2%B5m%22&hl=en&as_sdt=2007&as_ylo=1950&as_yhi=2023"
15,"J Wobb, SA Krueger, JL Kane, S Galoforo, ...","The effects of pulsed radiation therapy on tumor oxygenation in 2 murine models of head and neck squamous cell carcinoma",2015,"International Journal of …","Elsevier","https://www.sciencedirect.com/science/article/pii/S0360301615003752","https://scholar.google.com/scholar?cites=15252150329712465205&as_sdt=2005&sciodt=2007&hl=en",235,"2023-07-26 09:55:10","HTML","","","",,,,,15,1.88,3,5,8,"… Mice were exposed to either 2 Gy/day delivered in 1 … to a spatial resolution of approximately 170 μm. F-FDG scans were … (B) Average vessel size, mean vessel density, and percent …","https://www.sciencedirect.com/science/article/pii/S0360301615003752","https://scholar.google.com/scholar?q=related:NVVeX-qFqtMJ:scholar.google.com/&scioq=%22vessel+size%22+%22vessel+density%22+%22tumor%22+%22mice%22+%22%C2%B5m%22&hl=en&as_sdt=2007&as_ylo=1950&as_yhi=2023"
17,"JE Girling, JF Donoghue, ...","Vascular endothelial growth factor-D over-expressing tumor cells induce differential effects on uterine vasculature in a mouse model of endometrial cancer",2010,"Reproductive …","rbej.biomedcentral.com","https://rbej.biomedcentral.com/articles/10.1186/1477-7827-8-84","https://scholar.google.com/scholar?cites=14518922193306937766&as_sdt=2005&sciodt=2007&hl=en",236,"2023-07-26 09:55:10","HTML","10.1186/1477-7827-8-84","","",,,,,17,1.31,6,3,13,"… mice with control or VEGF-D-expressing 293EBNA tumor … ) at sites near (approximately 600 μm) and distal (lower uterine … mean values for vessel density, proliferation and vessel size in …","https://rbej.biomedcentral.com/articles/10.1186/1477-7827-8-84","https://scholar.google.com/scholar?q=related:pmmYbc-SfckJ:scholar.google.com/&scioq=%22vessel+size%22+%22vessel+density%22+%22tumor%22+%22mice%22+%22%C2%B5m%22&hl=en&as_sdt=2007&as_ylo=1950&as_yhi=2023"
14,"I Fichtner, D Behrens, J Claffey, A Deally, ...","The antiangiogenic and antitumoral activity of Titanocene Y* In vivo",2011,"Letters in Drug …","ingentaconnect.com","https://www.ingentaconnect.com/content/ben/lddd/2011/00000008/00000004/art00002","https://scholar.google.com/scholar?cites=12480819335878120274&as_sdt=2005&sciodt=2007&hl=en",237,"2023-07-26 09:55:10","","","","",,,,,14,1.17,3,5,12,"… with an IC50 value of 4.9 μM shown in a spheroid-based cellular … Evaluation of micro vessel density was performed with … and quantified for following parameters: Micro vessel size, …","https://www.researchgate.net/profile/Holger-Weber-2/publication/233544529_The_Antiangiogenic_and_Antitumoral_Activity_of_Titanocene_Y_In_Vivo/links/0a85e53469b4ed3671000000/The-Antiangiogenic-and-Antitumoral-Activity-of-Titanocene-Y-In-Vivo.pdf","https://scholar.google.com/scholar?q=related:UpPXTA_HNK0J:scholar.google.com/&scioq=%22vessel+size%22+%22vessel+density%22+%22tumor%22+%22mice%22+%22%C2%B5m%22&hl=en&as_sdt=2007&as_ylo=1950&as_yhi=2023"
135,"CY Lin, C Chang, WM Cheung, MH Lin, ...","Dynamic changes in vascular permeability, cerebral blood volume, vascular density, and size after transient focal cerebral ischemia in rats: evaluation with contrast …",2008,"Journal of Cerebral …","journals.sagepub.com","https://journals.sagepub.com/doi/abs/10.1038/jcbfm.2008.42","https://scholar.google.com/scholar?cites=16971376923364387390&as_sdt=2005&sciodt=2007&hl=en",238,"2023-07-26 09:55:10","","10.1038/jcbfm.2008.42","","",,,,,135,9.00,27,5,15,"… a reciprocal increase in vessel size were observed within the … in vessel size in vessels with a diameter greater than 30 μm. … Vessel density and size imaging were derived, pixel by pixel, …","https://journals.sagepub.com/doi/full/10.1038/jcbfm.2008.42","https://scholar.google.com/scholar?q=related:PmplwmRxhusJ:scholar.google.com/&scioq=%22vessel+size%22+%22vessel+density%22+%22tumor%22+%22mice%22+%22%C2%B5m%22&hl=en&as_sdt=2007&as_ylo=1950&as_yhi=2023"
28,"MJ Oudin, SK Hughes, N Rohani, MN Moufarrej, ...","Characterization of the expression of the pro-metastatic MenaINV isoform during breast tumor progression",2016,"Clinical &experimental …","Springer","https://link.springer.com/article/10.1007/s10585-015-9775-5","https://scholar.google.com/scholar?cites=12013905605216484703&as_sdt=2005&sciodt=2007&hl=en",239,"2023-07-26 09:55:10","","10.1007/s10585-015-9775-5","","",,,,,28,4.00,6,5,7,"… = 2 mice, 5–7 image fields per tumor for f, g. Scale bar = 20 … Scale bar is 30 µm. b Representative images of human beast … vessel density, it is heterogeneous within the primary …","https://www.ncbi.nlm.nih.gov/pmc/articles/PMC4777680/","https://scholar.google.com/scholar?q=related:X70A3H73uaYJ:scholar.google.com/&scioq=%22vessel+size%22+%22vessel+density%22+%22tumor%22+%22mice%22+%22%C2%B5m%22&hl=en&as_sdt=2007&as_ylo=1950&as_yhi=2023"
64,"EX Wu, H Tang, JH Jensen","High‐resolution MR imaging of mouse brain microvasculature using the relaxation rate shift index Q",2004,"NMR in Biomedicine: An …","Wiley Online Library","https://analyticalsciencejournals.onlinelibrary.wiley.com/doi/abs/10.1002/nbm.921","https://scholar.google.com/scholar?cites=11568253267491288602&as_sdt=2005&sciodt=2007&hl=en",240,"2023-07-26 09:55:10","","10.1002/nbm.921","","",,,,,64,3.37,21,3,19,"… In particular, the intra-tumoral microvessel density is an … estimates for vessel size has also been utilized.Given the … the in-plane resolution was 100 μm. The data were reconstructed as …","https://analyticalsciencejournals.onlinelibrary.wiley.com/doi/pdfdirect/10.1002/nbm.921","https://scholar.google.com/scholar?q=related:GvaROA6xiqAJ:scholar.google.com/&scioq=%22vessel+size%22+%22vessel+density%22+%22tumor%22+%22mice%22+%22%C2%B5m%22&hl=en&as_sdt=2007&as_ylo=1950&as_yhi=2023"
54,"A Ruddell, KS Kelly-Spratt, M Furuya, SS Parghi, ...","p19/Arf and p53 suppress sentinel lymph node lymphangiogenesis and carcinoma metastasis",2008,"Oncogene","nature.com","https://www.nature.com/articles/1210973","https://scholar.google.com/scholar?cites=12996056989517156342&as_sdt=2005&sciodt=2007&hl=en",241,"2023-07-26 09:55:10","","","","",,,,,54,3.60,11,5,15,"… Blood vessel size and density (arrowheads) increases modestly in papillomas … Scale bar=100 μm. … Lymphatic vessel area, blood vessel area or blood vessel density in three sections …","http://authors.fhcrc.org/407/1/RuddellAOncogeneManuscript031010.pdf","https://scholar.google.com/scholar?q=related:9g_n1PlEW7QJ:scholar.google.com/&scioq=%22vessel+size%22+%22vessel+density%22+%22tumor%22+%22mice%22+%22%C2%B5m%22&hl=en&as_sdt=2007&as_ylo=1950&as_yhi=2023"
49,"J Onken, R Torka, S Korsing, J Radke, ...","Inhibiting receptor tyrosine kinase AXL with small molecule inhibitor BMS-777607 reduces glioblastoma growth, migration, and invasion in vitro and in vivo",2016,"Oncotarget","ncbi.nlm.nih.gov","https://www.ncbi.nlm.nih.gov/pmc/articles/PMC4891090/","https://scholar.google.com/scholar?cites=18324915700752235456&as_sdt=2005&sciodt=2007&hl=en",242,"2023-07-26 09:55:10","HTML","","","",,,,,49,7.00,10,5,7,"… of 12.5 μM BMS-777607 abrogated tumor cell invasion into the … (B) CD31 staining (red) shows differences in vessel size and … vessel density (n = 3, ***p <0.0001). Scale bar indicates 50 …","https://www.ncbi.nlm.nih.gov/pmc/articles/PMC4891090/","https://scholar.google.com/scholar?q=related:wLtQgr0tT_4J:scholar.google.com/&scioq=%22vessel+size%22+%22vessel+density%22+%22tumor%22+%22mice%22+%22%C2%B5m%22&hl=en&as_sdt=2007&as_ylo=1950&as_yhi=2023"
12,"J Kim, E Kim, LR Euceda, DE Meyer, ...","Multiparametric characterization of response to anti‐angiogenic therapy using USPIO contrast‐enhanced MRI in combination with dynamic contrast‐enhanced MRI",2018,"Journal of Magnetic …","Wiley Online Library","https://onlinelibrary.wiley.com/doi/abs/10.1002/jmri.25898","https://scholar.google.com/scholar?cites=17344965865611419455&as_sdt=2005&sciodt=2007&hl=en",243,"2023-07-26 09:55:10","","10.1002/jmri.25898","","",,,,,12,2.40,2,5,5,"… blood volume, vessel size, and vessel density can be derived … Two additional mice did not receive treatment but their tumor … Sections of 4 μm thickness were stained with anti-α-smooth …","https://onlinelibrary.wiley.com/doi/pdf/10.1002/jmri.25898","https://scholar.google.com/scholar?q=related:P18LpY6ytfAJ:scholar.google.com/&scioq=%22vessel+size%22+%22vessel+density%22+%22tumor%22+%22mice%22+%22%C2%B5m%22&hl=en&as_sdt=2007&as_ylo=1950&as_yhi=2023"
41,"C Xu, WUH Schmidt, K Villringer, ...","Vessel size imaging reveals pathological changes of microvessel density and size in acute ischemia",2011,"Journal of Cerebral …","journals.sagepub.com","https://journals.sagepub.com/doi/abs/10.1038/jcbfm.2011.38","https://scholar.google.com/scholar?cites=14134029397810870105&as_sdt=2005&sciodt=2007&hl=en",244,"2023-07-26 09:55:10","","10.1038/jcbfm.2011.38","","",,,,,41,3.42,10,4,12,"… ; FWHM, 10.7 μm). In the thalamus with the absence of large … -appearing tissue around the tumor, the difference in results is … vessel density is observed in WM than in GM. It indicates that …","https://journals.sagepub.com/doi/full/10.1038/jcbfm.2011.38","https://scholar.google.com/scholar?q=related:WfdxHdooJsQJ:scholar.google.com/&scioq=%22vessel+size%22+%22vessel+density%22+%22tumor%22+%22mice%22+%22%C2%B5m%22&hl=en&as_sdt=2007&as_ylo=1950&as_yhi=2023"
36,"D Marino, Y Angehrn, S Klein, S Riccardi, ...","Activation of the epidermal growth factor receptor promotes lymphangiogenesis in the skin",2013,"Journal of …","Elsevier","https://www.sciencedirect.com/science/article/pii/S0923181113001448","https://scholar.google.com/scholar?cites=4129539869930292500&as_sdt=2005&sciodt=2007&hl=en",245,"2023-07-26 09:55:10","","","","",,,,,36,3.60,7,5,10,"… covered by vessels, the vessel density and sectioned area (size… (SU5416) were added at 10 μM to the embryoid bodies either … vessel area but also of lymphatic vessel size (Fig. 5a–c). …","https://www.ncbi.nlm.nih.gov/pmc/articles/PMC3745787/","https://scholar.google.com/scholar?q=related:FAUC6aESTzkJ:scholar.google.com/&scioq=%22vessel+size%22+%22vessel+density%22+%22tumor%22+%22mice%22+%22%C2%B5m%22&hl=en&as_sdt=2007&as_ylo=1950&as_yhi=2023"
152,"B Bussolati, L Biancone, P Cassoni, S Russo, ...","PAF produced by human breast cancer cells promotes migration and proliferation of tumor cells and neo-angiogenesis",2000,"The American journal of …","Elsevier","https://www.sciencedirect.com/science/article/pii/S0002944010648080","https://scholar.google.com/scholar?cites=1171050309006912122&as_sdt=2005&sciodt=2007&hl=en",246,"2023-07-26 09:55:10","HTML","","","",,,,,152,6.61,30,5,23,"… Sections (3 μm) were cut and stained with hematoxylin and eosin … mice. In this model blockade of PAF-R both by WEB2170 and CV3988 induced a significant reduction in vessel density…","https://www.sciencedirect.com/science/article/pii/S0002944010648080","https://scholar.google.com/scholar?q=related:eup3Mg1oQBAJ:scholar.google.com/&scioq=%22vessel+size%22+%22vessel+density%22+%22tumor%22+%22mice%22+%22%C2%B5m%22&hl=en&as_sdt=2007&as_ylo=1950&as_yhi=2023"
9,"S McDermott, AR Guimaraes R","Magnetic nanoparticles in the imaging of tumor angiogenesis",2012,"Applied Sciences","mdpi.com","https://www.mdpi.com/2076-3417/2/2/525","https://scholar.google.com/scholar?cites=13979133084609431074&as_sdt=2005&sciodt=2007&hl=en",247,"2023-07-26 09:55:10","","","","",,,,,9,0.82,5,2,11,"… areas are characterized by high vessel density [18], large … 2 * is fairly independent of vessel size beyond 3–4 µm. These … tumor bearing mice revealed ~46% reduction in tumor blood …","https://www.mdpi.com/2076-3417/2/2/525/htm","https://scholar.google.com/scholar?q=related:IkYO0Hnb_8EJ:scholar.google.com/&scioq=%22vessel+size%22+%22vessel+density%22+%22tumor%22+%22mice%22+%22%C2%B5m%22&hl=en&as_sdt=2007&as_ylo=1950&as_yhi=2023"
6,"MJ Kaiser, JP Hauzeur, S Blacher, JM Foidart, ...","Contrast-enhanced coded phase-inversion harmonic sonography of knee synovitis correlates with histological vessel density: 2 automated digital quantifications",2009,"The Journal of …","jrheum.org","https://www.jrheum.org/content/36/7/1391.short","https://scholar.google.com/scholar?cites=2015806020186753618&as_sdt=2005&sciodt=2007&hl=en",248,"2023-07-26 09:55:10","","","","",,,,,6,0.43,1,5,14,"… the presence of microbubbles in tumor vessels of the metastasis … Sections (thickness 5 μm) were cut at 40 μm intervals from … The lower limit of a vessel size was arbitrarily fixed to 5 pixels…","https://citeseerx.ist.psu.edu/document?repid=rep1&type=pdf&doi=90c8ecb1eb16eea6f41e8cf93f50a1601eaef1f0","https://scholar.google.com/scholar?q=related:UkpTKeWU-RsJ:scholar.google.com/&scioq=%22vessel+size%22+%22vessel+density%22+%22tumor%22+%22mice%22+%22%C2%B5m%22&hl=en&as_sdt=2007&as_ylo=1950&as_yhi=2023"
79,"M Kanamori, SRV Berg, G Bergers, MS Berger, ...","Integrin β3 overexpression suppresses tumor growth in a human model of gliomagenesis: implications for the role of β3 overexpression in glioblastoma multiforme",2004,"Cancer research","AACR","https://aacrjournals.org/cancerres/article-abstract/64/8/2751/517778","https://scholar.google.com/scholar?cites=11917442693865512085&as_sdt=2005&sciodt=2007&hl=en",249,"2023-07-26 09:55:10","","","","",,,,,79,4.16,16,5,19,"… Five-μm sections were deparaffinized, quenched with 0.6% … Vessel density was assessed by counting the number of LEL-… for vessel number and vessel size. Although the tumors formed …","https://aacrjournals.org/cancerres/article/64/8/2751/517778","https://scholar.google.com/scholar?q=related:lZztHv1CY6UJ:scholar.google.com/&scioq=%22vessel+size%22+%22vessel+density%22+%22tumor%22+%22mice%22+%22%C2%B5m%22&hl=en&as_sdt=2007&as_ylo=1950&as_yhi=2023"
17,"S Shi, DY Yoon, K Hodge‐Bell, ...","Aryl hydrocarbon nuclear translocator (hypoxia inducible factor 1β) activity is required more during early than late tumor growth",2010,"… in cooperation with …","Wiley Online Library","https://onlinelibrary.wiley.com/doi/abs/10.1002/mc.20585","https://scholar.google.com/scholar?cites=12512985646192922584&as_sdt=2005&sciodt=2007&hl=en",250,"2023-07-26 09:55:10","","10.1002/mc.20585","","",,,,,17,1.31,4,4,13,"… by replacing the media with 0.75 µM of benzo[ghi]perylene (B[ghi]P… average vessel size, and the relative area occupied by tumor … vessel density did not correlate with magnitude of tumor …","https://onlinelibrary.wiley.com/doi/pdf/10.1002/mc.20585","https://scholar.google.com/scholar?q=related:2A_kCCYOp60J:scholar.google.com/&scioq=%22vessel+size%22+%22vessel+density%22+%22tumor%22+%22mice%22+%22%C2%B5m%22&hl=en&as_sdt=2007&as_ylo=1950&as_yhi=2023"
50,"X Gao, Y Zhao, ...","Anti-VEGF treatment improves neurological function and augments radiation response in NF2 schwannoma model",2015,"Proceedings of the …","National Acad Sciences","https://www.pnas.org/doi/abs/10.1073/pnas.1512570112","https://scholar.google.com/scholar?cites=10214097962089360823&as_sdt=2005&sciodt=2007&hl=en",251,"2023-07-26 09:55:10","","10.1073/pnas.1512570112","","",,,,,50,6.25,17,3,8,"… that anti-VEGF treatment decreased vessel density in 2 days, and … Clinical studies of relative vessel size and permeability, tumor … For each tumor, four to five adjacent 3D profiles (150 μm …","https://www.pnas.org/syndication/doi/10.1073/pnas.1512570112","https://scholar.google.com/scholar?q=related:t61g2_rDv40J:scholar.google.com/&scioq=%22vessel+size%22+%22vessel+density%22+%22tumor%22+%22mice%22+%22%C2%B5m%22&hl=en&as_sdt=2007&as_ylo=1950&as_yhi=2023"
55,"C Yeh, B Soetikno, S Hu, KI Maslov, ...","Microvascular quantification based on contour-scanning photoacoustic microscopy",2014,"Journal of biomedical …","spiedigitallibrary.org","https://www.spiedigitallibrary.org/journals/journal-of-biomedical-optics/volume-19/issue-9/096011/Microvascular-quantification-based-on-contour-scanning-photoacoustic-microscopy/10.1117/1.JBO.19.9.096011.short","https://scholar.google.com/scholar?cites=12342902743964625025&as_sdt=2005&sciodt=2007&hl=en",252,"2023-07-26 09:55:10","","10.1117/1.JBO.19.9.096011.short","","",,,,,55,6.11,11,5,9,"… the accuracy of vessel density and diameter quantification. … z -stack scanning OR-PAM (120 μm section thickness) in terms of … (d) Normalized pixel counts for each vessel-size category …","https://www.spiedigitallibrary.org/journalArticle/Download?fullDOI=10.1117/1.JBO.19.9.096011","https://scholar.google.com/scholar?q=related:gag0b6bMSqsJ:scholar.google.com/&scioq=%22vessel+size%22+%22vessel+density%22+%22tumor%22+%22mice%22+%22%C2%B5m%22&hl=en&as_sdt=2007&as_ylo=1950&as_yhi=2023"
8,"Y Wu, Y Yan, X Gao, L Yang, Y Li, X Guo, J Xie, ...","Gd-encapsulated carbonaceous dots for accurate characterization of tumor vessel permeability in magnetic resonance imaging",2019,"… , Biology and Medicine","Elsevier","https://www.sciencedirect.com/science/article/pii/S1549963419301583","https://scholar.google.com/scholar?cites=15289209695566692202&as_sdt=2005&sciodt=2007&hl=en",253,"2023-07-26 09:55:10","","","","",,,,,8,2.00,1,8,4,"… , with high vessel density and anomalous morphology.1., 2. … were euthanized and the tumors were harvested, cut into 5 μm thick … Vessel size affects vessel perfusion 23 , and perfusion …","","https://scholar.google.com/scholar?q=related:av-1YDYvLtQJ:scholar.google.com/&scioq=%22vessel+size%22+%22vessel+density%22+%22tumor%22+%22mice%22+%22%C2%B5m%22&hl=en&as_sdt=2007&as_ylo=1950&as_yhi=2023"
69,"TH Barker, P Framson, PA Puolakkainen, ...","Matricellular homologs in the foreign body response: hevin suppresses inflammation, but hevin and SPARC together diminish angiogenesis",2005,"The American journal of …","Elsevier","https://www.sciencedirect.com/science/article/pii/S0002944010623127","https://scholar.google.com/scholar?cites=6964270621924276282&as_sdt=2005&sciodt=2007&hl=en",254,"2023-07-26 09:55:10","HTML","","","",,,,,69,3.83,17,4,18,"… Analysis of capsular vessel size distribution was also … area in μm 2 ) illustrates that only HvS−/− mice exhibit increased … −/− mice displayed a threefold increase in vessel density of the FB …","https://www.sciencedirect.com/science/article/pii/S0002944010623127","https://scholar.google.com/scholar?q=related:Ojh8ezsPpmAJ:scholar.google.com/&scioq=%22vessel+size%22+%22vessel+density%22+%22tumor%22+%22mice%22+%22%C2%B5m%22&hl=en&as_sdt=2007&as_ylo=1950&as_yhi=2023"
3,"W Zhang, X Chen, D Ding, G Zhang, Z Zhu, XJ Yang, ...","Real-time in vivo imaging reveals specific nanoparticle target binding in a syngeneic glioma mouse model",2022,"Nanoscale","pubs.rsc.org","https://pubs.rsc.org/en/content/articlehtml/2022/nr/d1nr07591h","https://scholar.google.com/scholar?cites=15142743153095698678&as_sdt=2005&sciodt=2007&hl=en",255,"2023-07-26 09:55:10","","","","",,,,,3,3.00,0,7,1,"… in our model, we also calculated the vessel density at different time points. As shown in ESI … 0 μm to 300 μm. Thus, our results only revealed nanoparticle infiltration in this specific tumor …","","https://scholar.google.com/scholar?q=related:9mg_BavUJdIJ:scholar.google.com/&scioq=%22vessel+size%22+%22vessel+density%22+%22tumor%22+%22mice%22+%22%C2%B5m%22&hl=en&as_sdt=2007&as_ylo=1950&as_yhi=2023"
